airwayId,airwayLocation,airwayStringRaw,airwayStringTokens,orderedSegValues,tokenCount,pointRowCount,exactTokenMatch,normalizedTokenMatch,firstMismatchIndex,mismatchReason
T458,C,STUBN CFB DANZI PETER AGNEZ ACOVE ATHOS HIDAL STELA CTR FAIDS SPENO GLYDE BOS,STUBN|CFB|DANZI|PETER|AGNEZ|ACOVE|ATHOS|HIDAL|STELA|CTR|FAIDS|SPENO|GLYDE|BOS,STUBN|CFB|DANZI|PETER|AGNEZ|ACOVE|ATHOS|HIDAL|STELA|CTR|FAIDS|SPENO|GLYDE|BOS,14,14,true,true,,exact_match
T459,C,JIIMS LULOO SCOOL DOGGR,JIIMS|LULOO|SCOOL|DOGGR,JIIMS|LULOO|SCOOL|DOGGR,4,4,true,true,,exact_match
T460,C,PSB SWISS ZAGTI FQM NOSEE HNK RIMBA SAGES WIGAN BOWAN MOBBS SASHA TOMES BAF GLYDE,PSB|SWISS|ZAGTI|FQM|NOSEE|HNK|RIMBA|SAGES|WIGAN|BOWAN|MOBBS|SASHA|TOMES|BAF|GLYDE,PSB|SWISS|ZAGTI|FQM|NOSEE|HNK|RIMBA|SAGES|WIGAN|BOWAN|MOBBS|SASHA|TOMES|BAF|GLYDE,15,15,true,true,,exact_match
T461,C,DPK BELTT NESSI EEGOR DENNA FZOOL LOVES DEEDE PAWLN GELAW ATHOS GROUP ALB,DPK|BELTT|NESSI|EEGOR|DENNA|FZOOL|LOVES|DEEDE|PAWLN|GELAW|ATHOS|GROUP|ALB,DPK|BELTT|NESSI|EEGOR|DENNA|FZOOL|LOVES|DEEDE|PAWLN|GELAW|ATHOS|GROUP|ALB,13,13,true,true,,exact_match
T462,C,BIS MOFIT WISEK IRIWY ABR FIBDA CALAG WICKA FFORT DAWSO ARDUE CLAPS FITAS GENEO,BIS|MOFIT|WISEK|IRIWY|ABR|FIBDA|CALAG|WICKA|FFORT|DAWSO|ARDUE|CLAPS|FITAS|GENEO,BIS|MOFIT|WISEK|IRIWY|ABR|FIBDA|CALAG|WICKA|FFORT|DAWSO|ARDUE|CLAPS|FITAS|GENEO,14,14,true,true,,exact_match
T463,C,VADDR DUNBO WRENN PRENO ZONKO EEGOR TRUDE SOARS MOONI STUBY BOWAN HIDAL CANAN CAM JOGIM GRISS ENSON WEIGH WINLA BTV,VADDR|DUNBO|WRENN|PRENO|ZONKO|EEGOR|TRUDE|SOARS|MOONI|STUBY|BOWAN|HIDAL|CANAN|CAM|JOGIM|GRISS|ENSON|WEIGH|WINLA|BTV,VADDR|DUNBO|WRENN|PRENO|ZONKO|EEGOR|TRUDE|SOARS|MOONI|STUBY|BOWAN|HIDAL|CANAN|CAM|JOGIM|GRISS|ENSON|WEIGH|WINLA|BTV,20,20,true,true,,exact_match
T464,C,CUSAY TONOC EDGRR HEVAV CHURP,CUSAY|TONOC|EDGRR|HEVAV|CHURP,CUSAY|TONOC|EDGRR|HEVAV|CHURP,5,5,true,true,,exact_match
T465,C,DSM GACEY IOWWA RRAZZ KBEEE MOORI DEMLL NITZR,DSM|GACEY|IOWWA|RRAZZ|KBEEE|MOORI|DEMLL|NITZR,DSM|GACEY|IOWWA|RRAZZ|KBEEE|MOORI|DEMLL|NITZR,8,8,true,true,,exact_match
T466,C,SJT CHILD JCT ARPER STV GOBBY BETTI MARCS SEEDS WEMAR FFSSH WHAEL LDRET KEEDS VUH BOLOS SBI,SJT|CHILD|JCT|ARPER|STV|GOBBY|BETTI|MARCS|SEEDS|WEMAR|FFSSH|WHAEL|LDRET|KEEDS|VUH|BOLOS|SBI,SJT|CHILD|JCT|ARPER|STV|GOBBY|BETTI|MARCS|SEEDS|WEMAR|FFSSH|WHAEL|LDRET|KEEDS|VUH|BOLOS|SBI,17,17,true,true,,exact_match
T467,C,BERYL ELY TESSA RUBII LWL YIKUK BROPH,BERYL|ELY|TESSA|RUBII|LWL|YIKUK|BROPH,BERYL|ELY|TESSA|RUBII|LWL|YIKUK|BROPH,7,7,true,true,,exact_match
T468,C,HLC RISHO KOTZA KNSAS KOPSY DCODA FAZED OYITO STEEL BVILL HTHWY COVUT TRAIG LMN OSIVE LEWRP,HLC|RISHO|KOTZA|KNSAS|KOPSY|DCODA|FAZED|OYITO|STEEL|BVILL|HTHWY|COVUT|TRAIG|LMN|OSIVE|LEWRP,HLC|RISHO|KOTZA|KNSAS|KOPSY|DCODA|FAZED|OYITO|STEEL|BVILL|HTHWY|COVUT|TRAIG|LMN|OSIVE|LEWRP,16,16,true,true,,exact_match
T469,C,TASEY PGO,TASEY|PGO,TASEY|PGO,2,2,true,true,,exact_match
T470,C,ALKAL TORIN KINZE VIPUC IDECA DEDNE DEKKR SWEAT GOLCH KLISP CHOMP,ALKAL|TORIN|KINZE|VIPUC|IDECA|DEDNE|DEKKR|SWEAT|GOLCH|KLISP|CHOMP,ALKAL|TORIN|KINZE|VIPUC|IDECA|DEDNE|DEKKR|SWEAT|GOLCH|KLISP|CHOMP,11,11,true,true,,exact_match
T471,C,RCOLA RELAY WRACK NTCHZ ZAROX MLU,RCOLA|RELAY|WRACK|NTCHZ|ZAROX|MLU,RCOLA|RELAY|WRACK|NTCHZ|ZAROX|MLU,6,6,true,true,,exact_match
T472,C,TASEY YOTUB DEENS NEPRE HOT,TASEY|YOTUB|DEENS|NEPRE|HOT,TASEY|YOTUB|DEENS|NEPRE|HOT,5,5,true,true,,exact_match
T473,C,ICEKI GOBTY RUCBO NTCHZ PISAN TULLO BOSCY MLU,ICEKI|GOBTY|RUCBO|NTCHZ|PISAN|TULLO|BOSCY|MLU,ICEKI|GOBTY|RUCBO|NTCHZ|PISAN|TULLO|BOSCY|MLU,8,8,true,true,,exact_match
T474,C,AEX LARTO NIFTE NTCHZ CREEM BARNE WUDVI MHZ,AEX|LARTO|NIFTE|NTCHZ|CREEM|BARNE|WUDVI|MHZ,AEX|LARTO|NIFTE|NTCHZ|CREEM|BARNE|WUDVI|MHZ,8,8,true,true,,exact_match
T475,C,BIS ODUBY CHACE GICHI,BIS|ODUBY|CHACE|GICHI,BIS|ODUBY|CHACE|GICHI,4,4,true,true,,exact_match
T476,C,TUNDR FILRO TWANE EYEUP COHLE WIMKA,TUNDR|FILRO|TWANE|EYEUP|COHLE|WIMKA,TUNDR|FILRO|TWANE|EYEUP|COHLE|WIMKA,6,6,true,true,,exact_match
T477,C,CPTAL HGR VINSE COFAX BLINK PSB,CPTAL|HGR|VINSE|COFAX|BLINK|PSB,CPTAL|HGR|VINSE|COFAX|BLINK|PSB,6,6,true,true,,exact_match
T478,C,RIVRS OXKEK SPI EVOVY IDQUD CMI SLONI LCOLN BOLRR,RIVRS|OXKEK|SPI|EVOVY|IDQUD|CMI|SLONI|LCOLN|BOLRR,RIVRS|OXKEK|SPI|EVOVY|IDQUD|CMI|SLONI|LCOLN|BOLRR,9,9,true,true,,exact_match
T479,C,DNVIL ENTUK PIGGS DEWET DBRAH ZOOMS KUBYS SITTR NUTTR SCRIB JARLO,DNVIL|ENTUK|PIGGS|DEWET|DBRAH|ZOOMS|KUBYS|SITTR|NUTTR|SCRIB|JARLO,DNVIL|ENTUK|PIGGS|DEWET|DBRAH|ZOOMS|KUBYS|SITTR|NUTTR|SCRIB|JARLO,11,11,true,true,,exact_match
T480,C,GSO REIDE YANCE MCDON DOGWD MAZON COUPN DRONE SUNNS MCARY ECG OCSIP NORTN RTBRO ZOLMN,GSO|REIDE|YANCE|MCDON|DOGWD|MAZON|COUPN|DRONE|SUNNS|MCARY|ECG|OCSIP|NORTN|RTBRO|ZOLMN,GSO|REIDE|YANCE|MCDON|DOGWD|MAZON|COUPN|DRONE|SUNNS|MCARY|ECG|OCSIP|NORTN|RTBRO|ZOLMN,15,15,true,true,,exact_match
T481,A,BKA LYRIC SSR CHILL BAVKE MAGNM,BKA|LYRIC|SSR|CHILL|BAVKE|MAGNM,BKA|LYRIC|SSR|CHILL|BAVKE|MAGNM,6,6,true,true,,exact_match
T482,C,MEYER DUFFI GUMBE COUPN,MEYER|DUFFI|GUMBE|COUPN,MEYER|DUFFI|GUMBE|COUPN,4,4,true,true,,exact_match
T483,C,SHWNN KIELL KAABA HONEE LFK,SHWNN|KIELL|KAABA|HONEE|LFK,SHWNN|KIELL|KAABA|HONEE|LFK,5,5,true,true,,exact_match
T484,C,NELLO ANNYE TALLE MILBY BURGG,NELLO|ANNYE|TALLE|MILBY|BURGG,NELLO|ANNYE|TALLE|MILBY|BURGG,5,5,true,true,,exact_match
T485,C,SHWNN SILBE XAMPL ROMER LFK,SHWNN|SILBE|XAMPL|ROMER|LFK,SHWNN|SILBE|XAMPL|ROMER|LFK,5,5,true,true,,exact_match
T486,C,BURBN ZUMKI RRORY OKUCI MONTE RAKOC TASEY LENYI GIGVE SLOTH WEEBR WARLO LOCUS HAMPT RICKG POYNI ZIRUL OZIGE EDOME IXDIL EJKSN CECAR LAARI IZAAC TOMLN NEEON CLOUT HANOP HRISN UYSEF MINIM BESOM NESTS VLKNN,BURBN|ZUMKI|RRORY|OKUCI|MONTE|RAKOC|TASEY|LENYI|GIGVE|SLOTH|WEEBR|WARLO|LOCUS|HAMPT|RICKG|POYNI|ZIRUL|OZIGE|EDOME|IXDIL|EJKSN|CECAR|LAARI|IZAAC|TOMLN|NEEON|CLOUT|HANOP|HRISN|UYSEF|MINIM|BESOM|NESTS|VLKNN,BURBN|ZUMKI|RRORY|OKUCI|MONTE|RAKOC|TASEY|LENYI|GIGVE|SLOTH|WEEBR|WARLO|LOCUS|HAMPT|RICKG|POYNI|ZIRUL|OZIGE|EDOME|IXDIL|EJKSN|CECAR|LAARI|IZAAC|TOMLN|NEEON|CLOUT|HANOP|HRISN|UYSEF|MINIM|BESOM|NESTS|VLKNN,34,34,true,true,,exact_match
T487,C,SEA LOFAL DIGGN JAWBN WATTR JIGEB ROSLN ORCUS DISCO,SEA|LOFAL|DIGGN|JAWBN|WATTR|JIGEB|ROSLN|ORCUS|DISCO,SEA|LOFAL|DIGGN|JAWBN|WATTR|JIGEB|ROSLN|ORCUS|DISCO|U.S. CANADIAN BORDER-1,9,10,false,false,9,token_count_mismatch
T488,C,TYI RRLEE RMACK DAREZ STIKK ALGTR RTBRO,TYI|RRLEE|RMACK|DAREZ|STIKK|ALGTR|RTBRO,TYI|RRLEE|RMACK|DAREZ|STIKK|ALGTR|RTBRO,7,7,true,true,,exact_match
T489,C,BOLTS ATTAK NESST CEDDI CCITY GRNVL YALMI HARKE SALER PCANN,BOLTS|ATTAK|NESST|CEDDI|CCITY|GRNVL|YALMI|HARKE|SALER|PCANN,BOLTS|ATTAK|NESST|CEDDI|CCITY|GRNVL|YALMI|HARKE|SALER|PCANN,10,10,true,true,,exact_match
T490,C,IWD DINER CINOP BBEAR VUKFI ESC,IWD|DINER|CINOP|BBEAR|VUKFI|ESC,IWD|DINER|CINOP|BBEAR|VUKFI|ESC,6,6,true,true,,exact_match
T491,C,BOLTS CHAAZ EXWAY WALEE OHLEE SIROC,BOLTS|CHAAZ|EXWAY|WALEE|OHLEE|SIROC,BOLTS|CHAAZ|EXWAY|WALEE|OHLEE|SIROC,6,6,true,true,,exact_match
T492,C,FIINN SPEKL PMPNO WEZER YOJIX YONMA ODDEL DEARY,FIINN|SPEKL|PMPNO|WEZER|YOJIX|YONMA|ODDEL|DEARY,FIINN|SPEKL|PMPNO|WEZER|YOJIX|YONMA|ODDEL|DEARY,8,8,true,true,,exact_match
T493,C,BOLTS CHAAZ ORATE CCITY HADDE VLDST JOGOS WALPI TIFFT ROCKM HIDBI HANET DOOLY,BOLTS|CHAAZ|ORATE|CCITY|HADDE|VLDST|JOGOS|WALPI|TIFFT|ROCKM|HIDBI|HANET|DOOLY,BOLTS|CHAAZ|ORATE|CCITY|HADDE|VLDST|JOGOS|WALPI|TIFFT|ROCKM|HIDBI|HANET|DOOLY,13,13,true,true,,exact_match
T494,C,SKWAD TWOON,SKWAD|TWOON,SKWAD|TWOON,2,2,true,true,,exact_match
T495,C,BOLTS ATTAK NESST DEANR BWDEN,BOLTS|ATTAK|NESST|DEANR|BWDEN,BOLTS|ATTAK|NESST|DEANR|BWDEN,5,5,true,true,,exact_match
T497,C,ECG NTU FAAFO BAYSO LNSKY OUTLA GWYNN STEIN CORET FAGED,ECG|NTU|FAAFO|BAYSO|LNSKY|OUTLA|GWYNN|STEIN|CORET|FAGED,ECG|NTU|FAAFO|BAYSO|LNSKY|OUTLA|GWYNN|STEIN|CORET|FAGED,10,10,true,true,,exact_match
T499,C,CRP EJUXO ATHIS CARTI LEMIG SAT GUADA STV CORVY DILLO,CRP|EJUXO|ATHIS|CARTI|LEMIG|SAT|GUADA|STV|CORVY|DILLO,CRP|EJUXO|ATHIS|CARTI|LEMIG|SAT|GUADA|STV|CORVY|DILLO,10,10,true,true,,exact_match
T545,C,BRO HAVIX RELAX MANNY OPULL ASCOT SOLON POGOE CRP SINTO SKIDS ZAMLI SLENA LILJO YENNS EMBOW SAT GOBBY AMUSE BASIS SLIMM AGJ,BRO|HAVIX|RELAX|MANNY|OPULL|ASCOT|SOLON|POGOE|CRP|SINTO|SKIDS|ZAMLI|SLENA|LILJO|YENNS|EMBOW|SAT|GOBBY|AMUSE|BASIS|SLIMM|AGJ,BRO|HAVIX|RELAX|MANNY|OPULL|ASCOT|SOLON|POGOE|CRP|SINTO|SKIDS|ZAMLI|SLENA|LILJO|YENNS|EMBOW|SAT|GOBBY|AMUSE|BASIS|SLIMM|AGJ,22,22,true,true,,exact_match
T553,C,GSO MAYOS PLEXI HENBY TABER DBRAH COVEY NATTS VELLI AHCIN EKN,GSO|MAYOS|PLEXI|HENBY|TABER|DBRAH|COVEY|NATTS|VELLI|AHCIN|EKN,GSO|MAYOS|PLEXI|HENBY|TABER|DBRAH|COVEY|NATTS|VELLI|AHCIN|EKN,11,11,true,true,,exact_match
T608,C,HOCKE CFSKT UKNIX WOZEE CLUNG MONCK ROC LORTH MAGEN KONDO WIFFY SYR STODA VASTS LAMMS NORSE MARIA ALB WARUV GRAVE GRISY WARIC HURLY GDM BRONC LOBBY SOSYO REVER,HOCKE|CFSKT|UKNIX|WOZEE|CLUNG|MONCK|ROC|LORTH|MAGEN|KONDO|WIFFY|SYR|STODA|VASTS|LAMMS|NORSE|MARIA|ALB|WARUV|GRAVE|GRISY|WARIC|HURLY|GDM|BRONC|LOBBY|SOSYO|REVER,HOCKE|CFSKT|U.S. CANADIAN BORDER-2|U.S. CANADIAN BORDER-3|UKNIX|WOZEE|CLUNG|MONCK|ROC|LORTH|MAGEN|KONDO|WIFFY|SYR|STODA|VASTS|LAMMS|NORSE|MARIA|ALB|WARUV|GRAVE|GRISY|WARIC|HURLY|GDM|BRONC|LOBBY|SOSYO|REVER,28,30,false,false,2,token_value_mismatch
T616,C,FNT URSSA HOCKE CFTCS,FNT|URSSA|HOCKE|CFTCS,FNT|URSSA|HOCKE|CFTCS|U.S. CANADIAN BORDER-1,4,5,false,false,4,token_count_mismatch
T634,C,VIBRU ART BRUIN PAGER SYR FAYET STODA TEBOR DINNO EATEN SHERB RAHKS DANZI RIMBA PRNCE FILPS WEETS IGN CASSH NOBBI CMK DENNA BETHA CREAM BOROS GARRD SUFOK SEY,VIBRU|ART|BRUIN|PAGER|SYR|FAYET|STODA|TEBOR|DINNO|EATEN|SHERB|RAHKS|DANZI|RIMBA|PRNCE|FILPS|WEETS|IGN|CASSH|NOBBI|CMK|DENNA|BETHA|CREAM|BOROS|GARRD|SUFOK|SEY,U.S.CANADIAN BORDER-2|VIBRU|ART|BRUIN|PAGER|SYR|FAYET|STODA|TEBOR|DINNO|EATEN|SHERB|RAHKS|DANZI|RIMBA|PRNCE|FILPS|WEETS|IGN|CASSH|NOBBI|CMK|DENNA|BETHA|CREAM|BOROS|GARRD|SUFOK|SEY,28,29,false,false,0,token_value_mismatch
T645,C,EPSOP PUDGE ROSSS IKLIT,EPSOP|PUDGE|ROSSS|IKLIT,U.S. CANADIAN BORDER-1|EPSOP|PUDGE|ROSSS|IKLIT|U.S.CANADIAN BORDER-2,4,6,false,false,0,token_value_mismatch
T662,C,DEPRI KATAH HULTN,DEPRI|KATAH|HULTN,U.S. CANADIAN BORDER-1|DEPRI|KATAH|HULTN,3,4,false,false,0,token_value_mismatch
T675,C,SSM BBIGG NOJJE RUXDU,SSM|BBIGG|NOJJE|RUXDU,SSM|BBIGG|U.S. CANADIAN BORDER-1|U.S. CANADIAN BORDER-2|NOJJE|RUXDU|U.S. CANADIAN BORDER-3,4,7,false,false,2,token_value_mismatch
T698,C,EBGIX HULTN ACTON,EBGIX|HULTN|ACTON,U.S. CANADIAN BORDER-1|EBGIX|HULTN|ACTON|U.S. CANADIAN BORDER-2,3,5,false,false,0,token_value_mismatch
T705,C,ACK CLAMY DEEPO FLAPE OSSER LIBBE ARCAV ORCHA CCC BELTT NESSI EEGOR DENNA FZOOL LOVES DEEDE PAWLN TRESA CYPER PETER CODDI MILID LAMMS USICI GACKE BECKS SMAIR FOSYU SRNAC UUBER RIGID PBERG LATTS MUTNA,ACK|CLAMY|DEEPO|FLAPE|OSSER|LIBBE|ARCAV|ORCHA|CCC|BELTT|NESSI|EEGOR|DENNA|FZOOL|LOVES|DEEDE|PAWLN|TRESA|CYPER|PETER|CODDI|MILID|LAMMS|USICI|GACKE|BECKS|SMAIR|FOSYU|SRNAC|UUBER|RIGID|PBERG|LATTS|MUTNA,ACK|CLAMY|DEEPO|FLAPE|OSSER|LIBBE|ARCAV|ORCHA|CCC|BELTT|NESSI|EEGOR|DENNA|FZOOL|LOVES|DEEDE|PAWLN|TRESA|CYPER|PETER|CODDI|MILID|LAMMS|USICI|GACKE|BECKS|SMAIR|FOSYU|SRNAC|UUBER|RIGID|PBERG|LATTS|MUTNA|U.S. CANADIAN BORDER-1,34,35,false,false,34,token_count_mismatch
T719,A,MOCKA EEVER LILDE LATCH BKA,MOCKA|EEVER|LILDE|LATCH|BKA,MOCKA|U.S. CANADIAN BORDER-3|EEVER|LILDE|LATCH|BKA,5,6,false,false,1,token_value_mismatch
T739,C,KATEK DAVDA SSENA TALNO KERVO CAMPO WRAPT MLT PRENT DANOL,KATEK|DAVDA|SSENA|TALNO|KERVO|CAMPO|WRAPT|MLT|PRENT|DANOL,U.S. CANADIAN BORDER-1|KATEK|DAVDA|SSENA|TALNO|U.S. CANADIAN BORDER-2|U.S. CANADIAN BORDER-4|KERVO|CAMPO|WRAPT|MLT|PRENT|DANOL|U.S. CANADIAN BORDER-3,10,14,false,false,0,token_value_mismatch
T765,C,GRB SPRYS CRAZE BBEAR EMQIF CIBPA CMX VAYUC FEMOK BBLUE ASIXX TAGUC INL KORTY LCROS CALDU,GRB|SPRYS|CRAZE|BBEAR|EMQIF|CIBPA|CMX|VAYUC|FEMOK|BBLUE|ASIXX|TAGUC|INL|KORTY|LCROS|CALDU,GRB|SPRYS|CRAZE|BBEAR|EMQIF|CIBPA|CMX|VAYUC|FEMOK|BBLUE|U.S. CANADIAN BORDER-1|U.S. CANADIAN BORDER-2|ASIXX|TAGUC|INL|KORTY|U.S. CANADIAN BORDER-3|U.S. CANADIAN BORDER-5|LCROS|CALDU|U.S. CANADIAN BORDER-6,16,21,false,false,10,token_value_mismatch
T768,C,INL YUPNU CIVLU ARBBY,INL|YUPNU|CIVLU|ARBBY,INL|YUPNU|CIVLU|ARBBY|U.S. CANADIAN BORDER-1,4,5,false,false,4,token_count_mismatch
T776,C,KAYCY KMNGO NCOLY WAGGO RRBEE SKOWT SSM,KAYCY|KMNGO|NCOLY|WAGGO|RRBEE|SKOWT|SSM,U.S. CANADIAN BORDER-1|KAYCY|KMNGO|U.S. CANADIAN BORDER-2|U.S. CANADIAN BORDER-3|NCOLY|WAGGO|RRBEE|U.S. CANADIAN BORDER-4|U.S. CANADIAN BORDER-5|SKOWT|SSM,7,12,false,false,0,token_value_mismatch
T781,C,FNT KATTY HANKY ADRIE MARGN BLUEZ CFKMG PINTE HULTN,FNT|KATTY|HANKY|ADRIE|MARGN|BLUEZ|CFKMG|PINTE|HULTN,FNT|KATTY|HANKY|ADRIE|MARGN|BLUEZ|CFKMG|U.S. CANADIAN BORDER-1|U.S. CANADIAN BORDER-2|PINTE|HULTN,9,11,false,false,7,token_value_mismatch
T797,C,INL WUGOR,INL|WUGOR,INL|WUGOR|U.S. CANADIAN BORDER-1,2,3,false,false,2,token_count_mismatch
T810,C,BERDD AVALE SRADE JEORG CATGA SSM,BERDD|AVALE|SRADE|JEORG|CATGA|SSM,U.S. CANADIAN BORDER-2|BERDD|AVALE|SRADE|JEORG|U.S. CANADIAN BORDER-1|U.S. CANADIAN BORDER-3|CATGA|SSM,6,9,false,false,0,token_value_mismatch
TK502,C,EMI TAYLO WINGO SINON GRIBL TOLAN BALDE SPATE DECKR,EMI|TAYLO|WINGO|SINON|GRIBL|TOLAN|BALDE|SPATE|DECKR,EMI|TAYLO|WINGO|SINON|GRIBL|TOLAN|BALDE|SPATE|DECKR,9,9,true,true,,exact_match
TK504,C,RUSEY CIDOB HAMOR ARCUM TULLY BORKE BANKA,RUSEY|CIDOB|HAMOR|ARCUM|TULLY|BORKE|BANKA,RUSEY|CIDOB|HAMOR|ARCUM|TULLY|BORKE|BANKA,7,7,true,true,,exact_match
V1,C,CRG LLIPS OCNOP STARY TYBEE RUBYS BASSO HONAP ROOFS COTAK CHS CARNO WANDO CUBBY KIMMY INLET PLANN CRE ASHES JAYDB YOAST WALLO ISO ATR PEAPS LEEAH ANABL HOWIE CRESI CYN WHITE DIXIE MOVFA JFK DPK BELTT MAD YODEL WEGOT HFD DVANY GRAYM GRIPE BOSOX WHYBE BOS,CRG|LLIPS|OCNOP|STARY|TYBEE|RUBYS|BASSO|HONAP|ROOFS|COTAK|CHS|CARNO|WANDO|CUBBY|KIMMY|INLET|PLANN|CRE|ASHES|JAYDB|YOAST|WALLO|ISO|ATR|PEAPS|LEEAH|ANABL|HOWIE|CRESI|CYN|WHITE|DIXIE|MOVFA|JFK|DPK|BELTT|MAD|YODEL|WEGOT|HFD|DVANY|GRAYM|GRIPE|BOSOX|WHYBE|BOS,CRG|LLIPS|OCNOP|STARY|TYBEE|RUBYS|BASSO|HONAP|ROOFS|COTAK|CHS|CARNO|WANDO|CUBBY|KIMMY|INLET|PLANN|CRE|ASHES|JAYDB|YOAST|WALLO|ISO|ATR|PEAPS|LEEAH|ANABL|HOWIE|CRESI|CYN|WHITE|DIXIE|MOVFA|JFK|DPK|BELTT|MAD|YODEL|WEGOT|HFD|DVANY|GRAYM|GRIPE|BOSOX|WHYBE|BOS,46,46,true,true,,exact_match
V1,H,KOA REEFS MOANA ROWIN JESSI LAVAS MAKEN HARPO OGG,KOA|REEFS|MOANA|ROWIN|JESSI|LAVAS|MAKEN|HARPO|OGG,KOA|REEFS|MOANA|ROWIN|JESSI|LAVAS|MAKEN|HARPO|OGG,9,9,true,true,,exact_match
V10,C,PUB ORWAY TODDE WOSUR LAA ADEER LACKA GCK ONIPE KUDIC POKPE HEPVA DDC FIVLI EARPP CUKTO STAFF HUT BURTO JUBVO WAIVE FLOSS ANUGE EMP EBJEL DODSN WETZL IYOCO ANX ROBDY LEXIN MURTE IRK MURLY JURIX LOAMY BRL NILES HARRT CHETT STYLE GIJ,PUB|ORWAY|TODDE|WOSUR|LAA|ADEER|LACKA|GCK|ONIPE|KUDIC|POKPE|HEPVA|DDC|FIVLI|EARPP|CUKTO|STAFF|HUT|BURTO|JUBVO|WAIVE|FLOSS|ANUGE|EMP|EBJEL|DODSN|WETZL|IYOCO|ANX|ROBDY|LEXIN|MURTE|IRK|MURLY|JURIX|LOAMY|BRL|NILES|HARRT|CHETT|STYLE|GIJ,PUB|ORWAY|TODDE|WOSUR|LAA|ADEER|LACKA|GCK|ONIPE|KUDIC|POKPE|HEPVA|DDC|FIVLI|EARPP|CUKTO|STAFF|HUT|BURTO|JUBVO|WAIVE|FLOSS|ANUGE|EMP|EBJEL|DODSN|WETZL|IYOCO|ANX|ROBDY|LEXIN|MURTE|IRK|MURLY|JURIX|LOAMY|BRL|NILES|HARRT|CHETT|STYLE|GIJ,42,42,true,true,,exact_match
V100,C,MBW SLATR ZIKRU BFF HAPOP JUNUM AIA EVENN EFFEX MARSS ANW GIYED ONL ALO DEWAR INDET DBQ,MBW|SLATR|ZIKRU|BFF|HAPOP|JUNUM|AIA|EVENN|EFFEX|MARSS|ANW|GIYED|ONL|ALO|DEWAR|INDET|DBQ,MBW|SLATR|ZIKRU|BFF|HAPOP|JUNUM|AIA|EVENN|EFFEX|MARSS|ANW|GIYED|ONL|ALO|DEWAR|INDET|DBQ,17,17,true,true,,exact_match
V101,C,GLL LIBEL RIDJE FROGS BROCC UYRAG ECHOA ZOMBU LORIN CHE HAGJI STRIM RENAE VEL NEOLA TCH KAYZE JEMKU OGD KREBS BEARR BLIDA SHEAR NULTE MALTT BYI REAPS HLE SOLDE,GLL|LIBEL|RIDJE|FROGS|BROCC|UYRAG|ECHOA|ZOMBU|LORIN|CHE|HAGJI|STRIM|RENAE|VEL|NEOLA|TCH|KAYZE|JEMKU|OGD|KREBS|BEARR|BLIDA|SHEAR|NULTE|MALTT|BYI|REAPS|HLE|SOLDE,GLL|LIBEL|RIDJE|FROGS|BROCC|UYRAG|ECHOA|ZOMBU|LORIN|CHE|HAGJI|STRIM|RENAE|VEL|NEOLA|TCH|KAYZE|JEMKU|OGD|KREBS|BEARR|BLIDA|SHEAR|NULTE|MALTT|BYI|REAPS|HLE|SOLDE,29,29,true,true,,exact_match
V102,C,SFL AXEPE CNM HOMEX WUDRU DYETT HOB DEKEC IBOCO ELOYE TASNE RUKTE HEGTA MANIC JOXUL LBB,SFL|AXEPE|CNM|HOMEX|WUDRU|DYETT|HOB|DEKEC|IBOCO|ELOYE|TASNE|RUKTE|HEGTA|MANIC|JOXUL|LBB,SFL|AXEPE|CNM|HOMEX|WUDRU|DYETT|HOB|DEKEC|IBOCO|ELOYE|TASNE|RUKTE|HEGTA|MANIC|JOXUL|LBB,16,16,true,true,,exact_match
V103,C,CTF ZOPOC GANTS KEWPI GSO MAYOS EKN CKB STORE BURGS KIVGE AIR ATWOO MINER WNGFT ACO,CTF|ZOPOC|GANTS|KEWPI|GSO|MAYOS|EKN|CKB|STORE|BURGS|KIVGE|AIR|ATWOO|MINER|WNGFT|ACO,CTF|ZOPOC|GANTS|KEWPI|GSO|MAYOS|EKN|CKB|STORE|BURGS|KIVGE|AIR|ATWOO|MINER|WNGFT|ACO,16,16,true,true,,exact_match
V105,C,TUS TORTS ZEKAP ALMON BASER TFD POPKE PXR JONHH GINKE KARLO ZADER DRK HOBES BEYMI SINHO TRUXE PRFUM ZIVSI WINDS BLD LAS HARLS LUCKY HIDEN BTY LIDAT TEZUM ZOTUX OAL YERIN RYANN CHIME FMG,TUS|TORTS|ZEKAP|ALMON|BASER|TFD|POPKE|PXR|JONHH|GINKE|KARLO|ZADER|DRK|HOBES|BEYMI|SINHO|TRUXE|PRFUM|ZIVSI|WINDS|BLD|LAS|HARLS|LUCKY|HIDEN|BTY|LIDAT|TEZUM|ZOTUX|OAL|YERIN|RYANN|CHIME|FMG,TUS|TORTS|ZEKAP|ALMON|BASER|TFD|POPKE|PXR|JONHH|GINKE|KARLO|ZADER|DRK|HOBES|BEYMI|SINHO|TRUXE|PRFUM|ZIVSI|WINDS|BLD|LAS|HARLS|LUCKY|HIDEN|BTY|LIDAT|TEZUM|ZOTUX|OAL|YERIN|RYANN|CHIME|FMG,34,34,true,true,,exact_match
V106,C,JST WILTT HUDON RASHE,JST|WILTT|HUDON|RASHE,JST|WILTT|HUDON|RASHE,4,4,true,true,,exact_match
V107,C,LAX STABO SMO BAYST SADDE GUYBE GINNA FIM PIRUE REYES DERBB AVE CITIE PXN CATHE VINCO MABRY MISON DECOT OAK COMMO MICRA PYE BOARS,LAX|STABO|SMO|BAYST|SADDE|GUYBE|GINNA|FIM|PIRUE|REYES|DERBB|AVE|CITIE|PXN|CATHE|VINCO|MABRY|MISON|DECOT|OAK|COMMO|MICRA|PYE|BOARS,LAX|STABO|SMO|BAYST|SADDE|GUYBE|GINNA|FIM|PIRUE|REYES|DERBB|AVE|CITIE|PXN|CATHE|VINCO|MABRY|MISON|DECOT|OAK|COMMO|MICRA|PYE|BOARS,24,24,true,true,,exact_match
V108,C,ROZZA HABAP SGD CROIT CCR PITTS OAKEY LODDI LIN EKR TRUEL LILXO AJAXX DBL JNETT BASEE MURFE STAMY BRK AFDUC ADANE CHEBA HGO YAKIY GLD DEPAY CUGGA HLC,ROZZA|HABAP|SGD|CROIT|CCR|PITTS|OAKEY|LODDI|LIN|EKR|TRUEL|LILXO|AJAXX|DBL|JNETT|BASEE|MURFE|STAMY|BRK|AFDUC|ADANE|CHEBA|HGO|YAKIY|GLD|DEPAY|CUGGA|HLC,ROZZA|HABAP|SGD|CROIT|CCR|PITTS|OAKEY|LODDI|LIN|EKR|TRUEL|LILXO|AJAXX|DBL|JNETT|BASEE|MURFE|STAMY|BRK|AFDUC|ADANE|CHEBA|HGO|YAKIY|GLD|DEPAY|CUGGA|HLC,28,28,true,true,,exact_match
V11,C,CNG WESON PXV MACKY CLOWN RACYR SCOTO KELLY VHP WELDO DEEKS MZZ LATES CHMLY CRETE FWA ZOLNR GRABI EDGEE,CNG|WESON|PXV|MACKY|CLOWN|RACYR|SCOTO|KELLY|VHP|WELDO|DEEKS|MZZ|LATES|CHMLY|CRETE|FWA|ZOLNR|GRABI|EDGEE,CNG|WESON|PXV|MACKY|CLOWN|RACYR|SCOTO|KELLY|VHP|WELDO|DEEKS|MZZ|LATES|CHMLY|CRETE|FWA|ZOLNR|GRABI|EDGEE,19,19,true,true,,exact_match
V11,H,REEFS MYNAH FLITT UPP PULPS LNBRG BARBY SWEEP OPANA OGG,REEFS|MYNAH|FLITT|UPP|PULPS|LNBRG|BARBY|SWEEP|OPANA|OGG,REEFS|MYNAH|FLITT|UPP|PULPS|LNBRG|BARBY|SWEEP|OPANA|OGG,10,10,true,true,,exact_match
V110,C,DMN NUWIN WUMEX LAYEN TCS,DMN|NUWIN|WUMEX|LAYEN|TCS,DMN|NUWIN|WUMEX|LAYEN|TCS,5,5,true,true,,exact_match
V111,C,BSR SNS JEJMA HENCE CATHE KARNN WINDY PATYY MOD,BSR|SNS|JEJMA|HENCE|CATHE|KARNN|WINDY|PATYY|MOD,BSR|SNS|JEJMA|HENCE|CATHE|KARNN|WINDY|PATYY|MOD,9,9,true,true,,exact_match
V112,C,HQM ZEDAT ILWAC AST KEIKO PITER BTG PIQRI CARBY LTJ VECCU OGPAY LOAMS ECHOD FODOP PDT TACUP LYLES RODNA GEG DAZIE CEMOM JOMRU DIANN EDGES,HQM|ZEDAT|ILWAC|AST|KEIKO|PITER|BTG|PIQRI|CARBY|LTJ|VECCU|OGPAY|LOAMS|ECHOD|FODOP|PDT|TACUP|LYLES|RODNA|GEG|DAZIE|CEMOM|JOMRU|DIANN|EDGES,HQM|ZEDAT|ILWAC|AST|KEIKO|PITER|BTG|PIQRI|CARBY|LTJ|VECCU|OGPAY|LOAMS|ECHOD|FODOP|PDT|TACUP|LYLES|RODNA|GEG|DAZIE|CEMOM|JOMRU|DIANN|EDGES|U.S. CANADIAN BORDER-2,25,26,false,false,25,token_count_mismatch
V113,C,MQO JEDGI PRB PXN VOLTA PATYY MOD LIN KATSO SPOOK RICHY HUYJO FMG NICER ROBUD GOWZE SDO REO RENOL BOI PLUTO LKT FANID JUNKA SLIPP CPN NUNZU EVVER HUDVU LOCIS UGACE HLN HONVI ANNEM LINGE TEKOE AXABE LWT,MQO|JEDGI|PRB|PXN|VOLTA|PATYY|MOD|LIN|KATSO|SPOOK|RICHY|HUYJO|FMG|NICER|ROBUD|GOWZE|SDO|REO|RENOL|BOI|PLUTO|LKT|FANID|JUNKA|SLIPP|CPN|NUNZU|EVVER|HUDVU|LOCIS|UGACE|HLN|HONVI|ANNEM|LINGE|TEKOE|AXABE|LWT,MQO|JEDGI|PRB|PXN|VOLTA|PATYY|MOD|LIN|KATSO|SPOOK|RICHY|HUYJO|FMG|NICER|ROBUD|GOWZE|SDO|REO|RENOL|BOI|PLUTO|LKT|FANID|JUNKA|SLIPP|CPN|NUNZU|EVVER|HUDVU|LOCIS|UGACE|HLN|HONVI|ANNEM|LINGE|TEKOE|AXABE|LWT,38,38,true,true,,exact_match
V114,C,PNH CAUDE DOGIN CDS PEWAE VASTY SPS FLOPP FERET BYP GGG SPOUT EKPOW CARTH EXITE COVEX MARTA NUBOY AEX CATCS MIKLE MOGAN KNAPP ALIYA LSU VEILS RQR SNAKI SLIDD CLERY MUDDA GPT MINDO WIGGO AKXUT LBY,PNH|CAUDE|DOGIN|CDS|PEWAE|VASTY|SPS|FLOPP|FERET|BYP|GGG|SPOUT|EKPOW|CARTH|EXITE|COVEX|MARTA|NUBOY|AEX|CATCS|MIKLE|MOGAN|KNAPP|ALIYA|LSU|VEILS|RQR|SNAKI|SLIDD|CLERY|MUDDA|GPT|MINDO|WIGGO|AKXUT|LBY,PNH|CAUDE|DOGIN|CDS|PEWAE|VASTY|SPS|FLOPP|FERET|BYP|GGG|SPOUT|EKPOW|CARTH|EXITE|COVEX|MARTA|NUBOY|AEX|CATCS|MIKLE|MOGAN|KNAPP|ALIYA|LSU|VEILS|RQR|SNAKI|SLIDD|CLERY|MUDDA|GPT|MINDO|WIGGO|AKXUT|LBY,36,36,true,true,,exact_match
V115,C,CEW ITUYU ROMEK PIGON CHAFF REDDI MGM BEING KORNR WALTY TASYU HEENA JAPAM VUZ COLIG WILED SNEAR ARBEE BOAZE DUBBS ETOWA GROSS VXV HVQ MORAN JPU,CEW|ITUYU|ROMEK|PIGON|CHAFF|REDDI|MGM|BEING|KORNR|WALTY|TASYU|HEENA|JAPAM|VUZ|COLIG|WILED|SNEAR|ARBEE|BOAZE|DUBBS|ETOWA|GROSS|VXV|HVQ|MORAN|JPU,CEW|ITUYU|ROMEK|PIGON|CHAFF|REDDI|MGM|BEING|KORNR|WALTY|TASYU|HEENA|JAPAM|VUZ|COLIG|WILED|SNEAR|ARBEE|BOAZE|DUBBS|ETOWA|GROSS|VXV|HVQ|MORAN|JPU,26,26,true,true,,exact_match
V116,C,SFK GUYED LACIE LOPEZ LVZ EXAGE TALLI COATE SAX,SFK|GUYED|LACIE|LOPEZ|LVZ|EXAGE|TALLI|COATE|SAX,SFK|GUYED|LACIE|LOPEZ|LVZ|EXAGE|TALLI|COATE|SAX,9,9,true,true,,exact_match
V117,C,JPU PYRAT WEELD BEALL AIR WISKE,JPU|PYRAT|WEELD|BEALL|AIR|WISKE,JPU|PYRAT|WEELD|BEALL|AIR|WISKE,6,6,true,true,,exact_match
V118,C,MBW YEKUS PUCIP LAR JESAR SENSE RENRE CYS,MBW|YEKUS|PUCIP|LAR|JESAR|SENSE|RENRE|CYS,MBW|YEKUS|PUCIP|LAR|JESAR|SENSE|RENRE|CYS,8,8,true,true,,exact_match
V12,C,GVO RZS EMUXY PMD ETHER NASTE HELDE NULMN BASAL HEC CLIPP EED MEMPE JAWSY MUMTE TURNE CHILY DRK DRRTY JUWSO OATES HOXOL INW ZUN TAPDE CARTY HEGMA ABQ OTO ACH WASBI TCC JADIL VEGGE PNH UKDEW BROKE HINOD MMB ICT INDIC GAMWY LASKI AGEXY EMP EBJEL DODSN WETZL IYOCO ANX OCTAM FRANC COU STITH FTZ AUGST SNYDR TOY JACOB TWILA JIGSY CORKI BIB JOVAR WORKE LUPCE KELLY ZARHO OZMOE SHB AGC FURIX MILWO JST ZOTBI MIROY COFAX JUNEY POLLS LOMON HAR KUPPS BOYER WEPNA PTW,GVO|RZS|EMUXY|PMD|ETHER|NASTE|HELDE|NULMN|BASAL|HEC|CLIPP|EED|MEMPE|JAWSY|MUMTE|TURNE|CHILY|DRK|DRRTY|JUWSO|OATES|HOXOL|INW|ZUN|TAPDE|CARTY|HEGMA|ABQ|OTO|ACH|WASBI|TCC|JADIL|VEGGE|PNH|UKDEW|BROKE|HINOD|MMB|ICT|INDIC|GAMWY|LASKI|AGEXY|EMP|EBJEL|DODSN|WETZL|IYOCO|ANX|OCTAM|FRANC|COU|STITH|FTZ|AUGST|SNYDR|TOY|JACOB|TWILA|JIGSY|CORKI|BIB|JOVAR|WORKE|LUPCE|KELLY|ZARHO|OZMOE|SHB|AGC|FURIX|MILWO|JST|ZOTBI|MIROY|COFAX|JUNEY|POLLS|LOMON|HAR|KUPPS|BOYER|WEPNA|PTW,GVO|RZS|EMUXY|PMD|ETHER|NASTE|HELDE|NULMN|BASAL|HEC|CLIPP|EED|MEMPE|JAWSY|MUMTE|TURNE|CHILY|DRK|DRRTY|JUWSO|OATES|HOXOL|INW|ZUN|TAPDE|CARTY|HEGMA|ABQ|OTO|ACH|WASBI|TCC|JADIL|VEGGE|PNH|UKDEW|BROKE|HINOD|MMB|ICT|INDIC|GAMWY|LASKI|AGEXY|EMP|EBJEL|DODSN|WETZL|IYOCO|ANX|OCTAM|FRANC|COU|STITH|FTZ|AUGST|SNYDR|TOY|JACOB|TWILA|JIGSY|CORKI|BIB|JOVAR|WORKE|LUPCE|KELLY|ZARHO|OZMOE|SHB|AGC|FURIX|MILWO|JST|ZOTBI|MIROY|COFAX|JUNEY|POLLS|LOMON|HAR|KUPPS|BOYER|WEPNA|PTW,85,85,true,true,,exact_match
V12,H,KATHS NONNI LEANE KRYST KEOLA SHIGI HNL CKH GRITL BAMBO JOELE MAGGI SHARK,KATHS|NONNI|LEANE|KRYST|KEOLA|SHIGI|HNL|CKH|GRITL|BAMBO|JOELE|MAGGI|SHARK,KATHS|NONNI|LEANE|KRYST|KEOLA|SHIGI|HNL|CKH|GRITL|BAMBO|JOELE|MAGGI|SHARK,13,13,true,true,,exact_match
V120,C,SEA TAGOR NORMY FITGA WINIM CUNUR CASHS EAT OZALI EPH WIPES OWOSE EPAFY GEG PYPER EPENE JURSY KARPS MLP EDOBE HANIM CHARL SHIMY GTF JAYKE YOGOS ZEKEL UFXIT LWT CIWXU ESTRO MLS DIXLE DPR TUZCO NENOE PIR ELREE KAATS MHE YUGUL FRYRE FSD BILOO HAYNS GRUVE ONTIJ BANCO HAYOR JUGTO MCW AREDA SEATS ALO,SEA|TAGOR|NORMY|FITGA|WINIM|CUNUR|CASHS|EAT|OZALI|EPH|WIPES|OWOSE|EPAFY|GEG|PYPER|EPENE|JURSY|KARPS|MLP|EDOBE|HANIM|CHARL|SHIMY|GTF|JAYKE|YOGOS|ZEKEL|UFXIT|LWT|CIWXU|ESTRO|MLS|DIXLE|DPR|TUZCO|NENOE|PIR|ELREE|KAATS|MHE|YUGUL|FRYRE|FSD|BILOO|HAYNS|GRUVE|ONTIJ|BANCO|HAYOR|JUGTO|MCW|AREDA|SEATS|ALO,SEA|TAGOR|NORMY|FITGA|WINIM|CUNUR|CASHS|EAT|OZALI|EPH|WIPES|OWOSE|EPAFY|GEG|PYPER|EPENE|JURSY|KARPS|MLP|EDOBE|HANIM|CHARL|SHIMY|GTF|JAYKE|YOGOS|ZEKEL|UFXIT|LWT|CIWXU|ESTRO|MLS|DIXLE|DPR|TUZCO|NENOE|PIR|ELREE|KAATS|MHE|YUGUL|FRYRE|FSD|BILOO|HAYNS|GRUVE|ONTIJ|BANCO|HAYOR|JUGTO|MCW|AREDA|SEATS|ALO,54,54,true,true,,exact_match
V121,C,FJS BAYTS GYPSE OED UZEHE BROKN MOURN RBG SOZKY OTH SCOTY VAUGN EUG DOSEE MOHWK VIDAS WHIFF SNOKY DSD JABOT IMB JONWE BKE GOYEK DNJ LKT OSURE NOSEY DLN,FJS|BAYTS|GYPSE|OED|UZEHE|BROKN|MOURN|RBG|SOZKY|OTH|SCOTY|VAUGN|EUG|DOSEE|MOHWK|VIDAS|WHIFF|SNOKY|DSD|JABOT|IMB|JONWE|BKE|GOYEK|DNJ|LKT|OSURE|NOSEY|DLN,FJS|BAYTS|GYPSE|OED|UZEHE|BROKN|MOURN|RBG|SOZKY|OTH|SCOTY|VAUGN|EUG|DOSEE|MOHWK|VIDAS|WHIFF|SNOKY|DSD|JABOT|IMB|JONWE|BKE|GOYEK|DNJ|LKT|OSURE|NOSEY|DLN,29,29,true,true,,exact_match
V122,C,CEC REFIX OBRIN CEXUN CONLI WISEP PAPLE OLECY GNATS OED BRUTE LANKS JEXAM CEGAN ACLOB LEIFF OLEBY LMT BIDDS LKV REO,CEC|REFIX|OBRIN|CEXUN|CONLI|WISEP|PAPLE|OLECY|GNATS|OED|BRUTE|LANKS|JEXAM|CEGAN|ACLOB|LEIFF|OLEBY|LMT|BIDDS|LKV|REO,CEC|REFIX|OBRIN|CEXUN|CONLI|WISEP|PAPLE|OLECY|GNATS|OED|BRUTE|LANKS|JEXAM|CEGAN|ACLOB|LEIFF|OLEBY|LMT|BIDDS|LKV|REO,21,21,true,true,,exact_match
V123,C,MITCH GEEMO SWANN TACKS UKIEY CANUV OOD RUUTH DAVYS ENZEW HOLEY BRAND KORRY RBV TYKES MINKS RENUE APPLE TICKL PROUD DIALS LGA FAMMA CRALY HAARP RYMES CMK NOBBI CASSH TRESA WIGAN ATHOS GROUP ALB TIMKE CAM,MITCH|GEEMO|SWANN|TACKS|UKIEY|CANUV|OOD|RUUTH|DAVYS|ENZEW|HOLEY|BRAND|KORRY|RBV|TYKES|MINKS|RENUE|APPLE|TICKL|PROUD|DIALS|LGA|FAMMA|CRALY|HAARP|RYMES|CMK|NOBBI|CASSH|TRESA|WIGAN|ATHOS|GROUP|ALB|TIMKE|CAM,MITCH|GEEMO|SWANN|TACKS|UKIEY|CANUV|OOD|RUUTH|DAVYS|ENZEW|HOLEY|BRAND|KORRY|RBV|TYKES|MINKS|RENUE|APPLE|TICKL|PROUD|DIALS|LGA|FAMMA|CRALY|HAARP|RYMES|CMK|NOBBI|CASSH|TRESA|WIGAN|ATHOS|GROUP|ALB|TIMKE|CAM,36,36,true,true,,exact_match
V124,C,BYP OKUCI MONTE RAKOC PRX YOTUB DEENS NEPRE HOT BEGAN LIT HILLE,BYP|OKUCI|MONTE|RAKOC|PRX|YOTUB|DEENS|NEPRE|HOT|BEGAN|LIT|HILLE,BYP|OKUCI|MONTE|RAKOC|PRX|YOTUB|DEENS|NEPRE|HOT|BEGAN|LIT|HILLE,12,12,true,true,,exact_match
