airwayId,airwayLocation,airwayStringRaw,airwayStringTokens,orderedSegValues,tokenCount,pointRowCount,exactTokenMatch,normalizedTokenMatch,firstMismatchIndex,mismatchReason
A216,C,MONPI OATSS RIDLL LOEBB HOOVR GALEE FACED,MONPI|OATSS|RIDLL|LOEBB|HOOVR|GALEE|FACED,MONPI|OATSS|RIDLL|LOEBB|HOOVR|GALEE|FACED,7,7,true,true,,exact_match
A220,C,MAEVA CRONN BINGE AHNDO MANEY MAFIC CINNY,MAEVA|CRONN|BINGE|AHNDO|MANEY|MAFIC|CINNY,MAEVA|CRONN|BINGE|AHNDO|MANEY|MAFIC|CINNY,7,7,true,true,,exact_match
A221,C,CULPS ERTTS MONIE LULJY HEXUG WILLE,CULPS|ERTTS|MONIE|LULJY|HEXUG|WILLE,CULPS|ERTTS|MONIE|LULJY|HEXUG|WILLE,6,6,true,true,,exact_match
A222,C,UNZ CLANS AXIDE FIBSS KRONK ADUFO PNI AXTEN UKS STEFF RASON,UNZ|CLANS|AXIDE|FIBSS|KRONK|ADUFO|PNI|AXTEN|UKS|STEFF|RASON,UNZ|CLANS|AXIDE|FIBSS|KRONK|ADUFO|PNI|AXTEN|UKS|STEFF|RASON,11,11,true,true,,exact_match
A315,C,ZBV SWIMM TINKY PEKRE JAYEE HODGY AMBIS DUNNO ACMEE KNSLY JOSES,ZBV|SWIMM|TINKY|PEKRE|JAYEE|HODGY|AMBIS|DUNNO|ACMEE|KNSLY|JOSES,ZBV|SWIMM|TINKY|PEKRE|JAYEE|HODGY|AMBIS|DUNNO|ACMEE|KNSLY|JOSES,11,11,true,true,,exact_match
A331,C,ZIGIE ZOULU ZEMOM ZINNO ZAGER ZANNG SEDAR,ZIGIE|ZOULU|ZEMOM|ZINNO|ZAGER|ZANNG|SEDAR,ZIGIE|ZOULU|ZEMOM|ZINNO|ZAGER|ZANNG|SEDAR,7,7,true,true,,exact_match
A332,C,AUNTI HALLI HELOP HEKAB HEMLO,AUNTI|HALLI|HELOP|HEKAB|HEMLO,AUNTI|HALLI|HELOP|HEKAB|HEMLO,5,5,true,true,,exact_match
A337,C,JUNIE AXIDE FONUG SNAPP TEEDE TEGOD,JUNIE|AXIDE|FONUG|SNAPP|TEEDE|TEGOD,JUNIE|AXIDE|FONUG|SNAPP|TEEDE|TEGOD,6,6,true,true,,exact_match
A339,C,SHREE WRNNR TILLY KEITH,SHREE|WRNNR|TILLY|KEITH,SHREE|WRNNR|TILLY|KEITH,4,4,true,true,,exact_match
A342,A,NUZAN OPAKE PINSO AMOND DRAPP CRYPT CDB,NUZAN|OPAKE|PINSO|AMOND|DRAPP|CRYPT|CDB,NUZAN|OPAKE|PINSO|AMOND|DRAPP|CRYPT|CDB,7,7,true,true,,exact_match
A450,C,CAHYO TNUGE PIGFA LOEBB BUCAT UNZ BAGBE HOPPY FONUG STINE DEWSS JIMOS NGUEN NATIE RESEE SYSTA BRIUN HOOPA KATHS,CAHYO|TNUGE|PIGFA|LOEBB|BUCAT|UNZ|BAGBE|HOPPY|FONUG|STINE|DEWSS|JIMOS|NGUEN|NATIE|RESEE|SYSTA|BRIUN|HOOPA|KATHS,CAHYO|TNUGE|PIGFA|LOEBB|BUCAT|UNZ|BAGBE|HOPPY|FONUG|STINE|DEWSS|JIMOS|NGUEN|NATIE|RESEE|SYSTA|BRIUN|HOOPA|KATHS,19,19,true,true,,exact_match
A509,C,URSUS ELLEE EONNS JURER DHP MARCI,URSUS|ELLEE|EONNS|JURER|DHP|MARCI,URSUS|ELLEE|EONNS|JURER|DHP|MARCI,6,6,true,true,,exact_match
A517,C,ZPATA PJM,ZPATA|PJM,ZPATA|PJM,2,2,true,true,,exact_match
A554,C,LAMER RODRK CERDA EYSEL NETTA GTK TAANA SEKAR,LAMER|RODRK|CERDA|EYSEL|NETTA|GTK|TAANA|SEKAR,LAMER|RODRK|CERDA|EYSEL|NETTA|GTK|TAANA|SEKAR,8,8,true,true,,exact_match
A555,C,ILURI PORQE COY VEDAS TUUNA DDP IDAHO HARDE GRADI KARRN SEBUG COCBU GTK MAYAG RATTL EGANN MICAS BTLER GUANA INDEE DUKKY GEROT DONEZ BOSAR LEPAS ZQA HINZY PRUNE RAJAY ZBV,ILURI|PORQE|COY|VEDAS|TUUNA|DDP|IDAHO|HARDE|GRADI|KARRN|SEBUG|COCBU|GTK|MAYAG|RATTL|EGANN|MICAS|BTLER|GUANA|INDEE|DUKKY|GEROT|DONEZ|BOSAR|LEPAS|ZQA|HINZY|PRUNE|RAJAY|ZBV,ILURI|PORQE|COY|VEDAS|TUUNA|DDP|IDAHO|HARDE|GRADI|KARRN|SEBUG|COCBU|GTK|MAYAG|RATTL|EGANN|MICAS|BTLER|GUANA|INDEE|DUKKY|GEROT|DONEZ|BOSAR|LEPAS|ZQA|HINZY|PRUNE|RAJAY|ZBV,30,30,true,true,,exact_match
A578,C,PNI AFOYU FENSE,PNI|AFOYU|FENSE,PNI|AFOYU|FENSE,3,3,true,true,,exact_match
A579,C,CARRP CHEEM CROBY CEBUR CUFFY,CARRP|CHEEM|CROBY|CEBUR|CUFFY,CARRP|CHEEM|CROBY|CEBUR|CUFFY,5,5,true,true,,exact_match
A590,A,PASRO POWAL PLADO PINSO POOFF PINTT PTZGR PUGGY POETT SELDM PORGE HAMND,PASRO|POWAL|PLADO|PINSO|POOFF|PINTT|PTZGR|PUGGY|POETT|SELDM|PORGE|HAMND,PASRO|POWAL|PLADO|PINSO|POOFF|PINTT|PTZGR|PUGGY|POETT|SELDM|PORGE|HAMND,12,12,true,true,,exact_match
A597,C,ADBON OKOLE GALSS JUNIE OPLAR GUMGE UNZ WUVEN REEDE RICHH MONPI,ADBON|OKOLE|GALSS|JUNIE|OPLAR|GUMGE|UNZ|WUVEN|REEDE|RICHH|MONPI,ADBON|OKOLE|GALSS|JUNIE|OPLAR|GUMGE|UNZ|WUVEN|REEDE|RICHH|MONPI,11,11,true,true,,exact_match
A598,C,MARTI MAJ,MARTI|MAJ,MARTI|MAJ,2,2,true,true,,exact_match
A638,C,STT GUYRO SLUGO PJM,STT|GUYRO|SLUGO|PJM,STT|GUYRO|SLUGO|PJM,4,4,true,true,,exact_match
A699,C,SUMRS LOUIZ HOOKY NUCAR STIFF RAMJT PERMT PBI,SUMRS|LOUIZ|HOOKY|NUCAR|STIFF|RAMJT|PERMT|PBI,SUMRS|LOUIZ|HOOKY|NUCAR|STIFF|RAMJT|PERMT|PBI,8,8,true,true,,exact_match
A756,C,BODLO KNSLY ROSEA DUKKY,BODLO|KNSLY|ROSEA|DUKKY,BODLO|KNSLY|ROSEA|DUKKY,4,4,true,true,,exact_match
A766,C,SBI LAURL KLAMS KENGS KELPP KEHLI,SBI|LAURL|KLAMS|KENGS|KELPP|KEHLI,SBI|LAURL|KLAMS|KENGS|KELPP|KEHLI,6,6,true,true,,exact_match
A770,C,LEV DOLPH ALGAE KEHLI,LEV|DOLPH|ALGAE|KEHLI,LEV|DOLPH|ALGAE|KEHLI,4,4,true,true,,exact_match
AR10,C,DHP TURBO PREDA ZAPPA,DHP|TURBO|PREDA|ZAPPA,DHP|TURBO|PREDA|ZAPPA,4,4,true,true,,exact_match
AR11,C,VKZ JANUS VALLY,VKZ|JANUS|VALLY,VKZ|JANUS|VALLY,3,3,true,true,,exact_match
AR12,C,DEDDY PITRW SNNTA OGGRE EBEAR DIZNY RROOO HARON JAINS,DEDDY|PITRW|SNNTA|OGGRE|EBEAR|DIZNY|RROOO|HARON|JAINS,DEDDY|PITRW|SNNTA|OGGRE|EBEAR|DIZNY|RROOO|HARON|JAINS,9,9,true,true,,exact_match
AR15,C,BAHAA HIBAC PETEE APOLO MALET ORL,BAHAA|HIBAC|PETEE|APOLO|MALET|ORL,BAHAA|HIBAC|PETEE|APOLO|MALET|ORL,6,6,true,true,,exact_match
AR16,C,PERMT LENDS GRUBR SNABS SEELO,PERMT|LENDS|GRUBR|SNABS|SEELO,PERMT|LENDS|GRUBR|SNABS|SEELO,5,5,true,true,,exact_match
AR17,C,WAALT OSTNN ACMED OGGRE NRRSE BAHAA HIBAC VKZ,WAALT|OSTNN|ACMED|OGGRE|NRRSE|BAHAA|HIBAC|VKZ,WAALT|OSTNN|ACMED|OGGRE|NRRSE|BAHAA|HIBAC|VKZ,8,8,true,true,,exact_match
AR18,C,WOLFO RAMJT ETECK PELCN OZENA ROWSY FLRDA,WOLFO|RAMJT|ETECK|PELCN|OZENA|ROWSY|FLRDA,WOLFO|RAMJT|ETECK|PELCN|OZENA|ROWSY|FLRDA,7,7,true,true,,exact_match
AR19,C,MAJIK FLAMU RAZZL AAARG JRDAN SAGGY CHIEZ,MAJIK|FLAMU|RAZZL|AAARG|JRDAN|SAGGY|CHIEZ,MAJIK|FLAMU|RAZZL|AAARG|JRDAN|SAGGY|CHIEZ,7,7,true,true,,exact_match
AR22,C,HOAGG MEIGS DUUNK SPOOF IDOLS SKARP,HOAGG|MEIGS|DUUNK|SPOOF|IDOLS|SKARP,HOAGG|MEIGS|DUUNK|SPOOF|IDOLS|SKARP,6,6,true,true,,exact_match
AR23,C,URSUS ZFP CANIT OZENA,URSUS|ZFP|CANIT|OZENA,URSUS|ZFP|CANIT|OZENA,4,4,true,true,,exact_match
AR24,C,URSUS ZFP BRATZ OHLAA COACH TYCAL JAZZI,URSUS|ZFP|BRATZ|OHLAA|COACH|TYCAL|JAZZI,URSUS|ZFP|BRATZ|OHLAA|COACH|TYCAL|JAZZI,7,7,true,true,,exact_match
AR3,C,ZQA KURAY MELON HANKX BARTS ANGLL NUCAR CASPR SCOBY CARPX ADUCI JAZZI DIZNY FRRAM JRDAN KEEKS OSTNN GARIC,ZQA|KURAY|MELON|HANKX|BARTS|ANGLL|NUCAR|CASPR|SCOBY|CARPX|ADUCI|JAZZI|DIZNY|FRRAM|JRDAN|KEEKS|OSTNN|GARIC,ZQA|KURAY|MELON|HANKX|BARTS|ANGLL|NUCAR|CASPR|SCOBY|CARPX|ADUCI|JAZZI|DIZNY|FRRAM|JRDAN|KEEKS|OSTNN|GARIC,18,18,true,true,,exact_match
AR5,C,KOOKK FEMON JAWSS BAHAA SNABS OZENA OHLAA CARPX TROUT,KOOKK|FEMON|JAWSS|BAHAA|SNABS|OZENA|OHLAA|CARPX|TROUT,KOOKK|FEMON|JAWSS|BAHAA|SNABS|OZENA|OHLAA|CARPX|TROUT,9,9,true,true,,exact_match
AR6,C,ORL BITHO MALET APOLO PETEE HIBAC HALSS HOBEE,ORL|BITHO|MALET|APOLO|PETEE|HIBAC|HALSS|HOBEE,ORL|BITHO|MALET|APOLO|PETEE|HIBAC|HALSS|HOBEE,8,8,true,true,,exact_match
AR8,C,ECG OHPEA TOMMZ OXANA,ECG|OHPEA|TOMMZ|OXANA,ECG|OHPEA|TOMMZ|OXANA,4,4,true,true,,exact_match
AR9,C,ORF BAATT NAGGI FUMES MEYRA ATLIC OUTES ETMEY DELPP CUMBY CROAK ZIBUT,ORF|BAATT|NAGGI|FUMES|MEYRA|ATLIC|OUTES|ETMEY|DELPP|CUMBY|CROAK|ZIBUT,ORF|BAATT|NAGGI|FUMES|MEYRA|ATLIC|OUTES|ETMEY|DELPP|CUMBY|CROAK|ZIBUT,12,12,true,true,,exact_match
B200,C,BISOX ANJJE CARLS BENTS AMATT TONYS FICKY,BISOX|ANJJE|CARLS|BENTS|AMATT|TONYS|FICKY,BISOX|ANJJE|CARLS|BENTS|AMATT|TONYS|FICKY,7,7,true,true,,exact_match
B233,A,GAL SANGL KUTAL,GAL|SANGL|KUTAL,GAL|SANGL|KUTAL,3,3,true,true,,exact_match
B24,C,SIE FISSH DASHA CORNE JETER WICKE HAPVY DIAAN BOJAN AGUNE LYNUS AZEZU WEBBB,SIE|FISSH|DASHA|CORNE|JETER|WICKE|HAPVY|DIAAN|BOJAN|AGUNE|LYNUS|AZEZU|WEBBB,SIE|FISSH|DASHA|CORNE|JETER|WICKE|HAPVY|DIAAN|BOJAN|AGUNE|LYNUS|AZEZU|WEBBB,13,13,true,true,,exact_match
B240,A,ERNIK IDROD AVUBA ENM,ERNIK|IDROD|AVUBA|ENM,ERNIK|IDROD|AVUBA|ENM,4,4,true,true,,exact_match
B241,A,ENM ENEGU ROCET RUSOR,ENM|ENEGU|ROCET|RUSOR,ENM|ENEGU|ROCET|RUSOR,4,4,true,true,,exact_match
B244,A,FRENK OTZ,FRENK|OTZ,FRENK|OTZ,2,2,true,true,,exact_match
B326,C,CHOKO NIXEE NUTTO NAMIE NIXAM,CHOKO|NIXEE|NUTTO|NAMIE|NIXAM,CHOKO|NIXEE|NUTTO|NAMIE|NIXAM,5,5,true,true,,exact_match
B452,C,ATIGO KERRY KRONK KRASY DOHRT,ATIGO|KERRY|KRONK|KRASY|DOHRT,ATIGO|KERRY|KRONK|KRASY|DOHRT,5,5,true,true,,exact_match
B453,C,BOXER KYLLE KANUA VIDKU TAMRU SIMLU KURTT PETPA NAKBI METPA KATCH MDO,BOXER|KYLLE|KANUA|VIDKU|TAMRU|SIMLU|KURTT|PETPA|NAKBI|METPA|KATCH|MDO,BOXER|KYLLE|KANUA|VIDKU|TAMRU|SIMLU|KURTT|PETPA|NAKBI|METPA|KATCH|MDO,12,12,true,true,,exact_match
B454,C,UPNAR COMIR BORIC ARENS TONYS,UPNAR|COMIR|BORIC|ARENS|TONYS,UPNAR|COMIR|BORIC|ARENS|TONYS,5,5,true,true,,exact_match
B474,C,BARKR ADOWA ARVII ADISN ARTOP,BARKR|ADOWA|ARVII|ADISN|ARTOP,BARKR|ADOWA|ARVII|ADISN|ARTOP,5,5,true,true,,exact_match
B503,C,ENAMO RYDEL HODGY ZQA,ENAMO|RYDEL|HODGY|ZQA,ENAMO|RYDEL|HODGY|ZQA,4,4,true,true,,exact_match
B520,C,ANTEX BQN DDP MALIE STT PASIC LARPP JUICE PJM ELOPO ANU,ANTEX|BQN|DDP|MALIE|STT|PASIC|LARPP|JUICE|PJM|ELOPO|ANU,ANTEX|BQN|DDP|MALIE|STT|PASIC|LARPP|JUICE|PJM|ELOPO|ANU,11,11,true,true,,exact_match
B577,C,PASSA QUIGG SANTA CANOL BELAN AHNDO LENNA FICKY,PASSA|QUIGG|SANTA|CANOL|BELAN|AHNDO|LENNA|FICKY,PASSA|QUIGG|SANTA|CANOL|BELAN|AHNDO|LENNA|FICKY,8,8,true,true,,exact_match
B580,C,BARKR BOYES BESTY BAYUS BOILS,BARKR|BOYES|BESTY|BAYUS|BOILS,BARKR|BOYES|BESTY|BAYUS|BOILS,5,5,true,true,,exact_match
B581,C,WOOBY WACOS WOSLU WAYSE WINTY CAMOS BALKS AFONE WEDES FICKY,WOOBY|WACOS|WOSLU|WAYSE|WINTY|CAMOS|BALKS|AFONE|WEDES|FICKY,WOOBY|WACOS|WOSLU|WAYSE|WINTY|CAMOS|BALKS|AFONE|WEDES|FICKY,10,10,true,true,,exact_match
B586,C,OMLET TOESS WINZR UNZ ASADE KAPOK HUTEL NUTTI PIKOK,OMLET|TOESS|WINZR|UNZ|ASADE|KAPOK|HUTEL|NUTTI|PIKOK,OMLET|TOESS|WINZR|UNZ|ASADE|KAPOK|HUTEL|NUTTI|PIKOK,9,9,true,true,,exact_match
B589,C,MAJ ELNUR,MAJ|ELNUR,MAJ|ELNUR,2,2,true,true,,exact_match
B595,C,KOA TARDE TAKIE TARPP TENOR,KOA|TARDE|TAKIE|TARPP|TENOR,KOA|TARDE|TAKIE|TARPP|TENOR,5,5,true,true,,exact_match
B596,C,DOVRR RUDEE RAGDE RAYOR RAMIZ,DOVRR|RUDEE|RAGDE|RAYOR|RAMIZ,DOVRR|RUDEE|RAGDE|RAYOR|RAMIZ,5,5,true,true,,exact_match
B757,A,KATCH HMPTN GRIZZ CJAYY EHM ONEOX HOWRR NULUK,KATCH|HMPTN|GRIZZ|CJAYY|EHM|ONEOX|HOWRR|NULUK,KATCH|HMPTN|GRIZZ|CJAYY|EHM|ONEOX|HOWRR|NULUK,8,8,true,true,,exact_match
B760,C,ZBV LEEVI MENDL BORDO,ZBV|LEEVI|MENDL|BORDO,ZBV|LEEVI|MENDL|BORDO,4,4,true,true,,exact_match
B892,C,ANTEX MAZ,ANTEX|MAZ,ANTEX|MAZ,2,2,true,true,,exact_match
B932,A,BAMOK MORLY EPLOS KIVAK LESAD MCG,BAMOK|MORLY|EPLOS|KIVAK|LESAD|MCG,BAMOK|MORLY|EPLOS|KIVAK|LESAD|MCG,6,6,true,true,,exact_match
BR10L,C,ZFP FLINY HAANA MRRSH BNTTZ,ZFP|FLINY|HAANA|MRRSH|BNTTZ,ZFP|FLINY|HAANA|MRRSH|BNTTZ,5,5,true,true,,exact_match
BR1L,C,JOLTS ZFP BARTS MAMML DIAZZ LOGVN BRRGO AVNEY BENIE OREDE RAHAM STRUD BIKIN GTK,JOLTS|ZFP|BARTS|MAMML|DIAZZ|LOGVN|BRRGO|AVNEY|BENIE|OREDE|RAHAM|STRUD|BIKIN|GTK,JOLTS|ZFP|BARTS|MAMML|DIAZZ|LOGVN|BRRGO|AVNEY|BENIE|OREDE|RAHAM|STRUD|BIKIN|GTK,14,14,true,true,,exact_match
BR21V,C,ZFP ULAMA KIXAL WALIK PBI,ZFP|ULAMA|KIXAL|WALIK|PBI,ZFP|ULAMA|KIXAL|WALIK|PBI,5,5,true,true,,exact_match
BR22V,C,FLL DEKAL WIERS OYSTA CAREY MAJUR ZQA,FLL|DEKAL|WIERS|OYSTA|CAREY|MAJUR|ZQA,FLL|DEKAL|WIERS|OYSTA|CAREY|MAJUR|ZQA,7,7,true,true,,exact_match
BR2L,C,ZSJ DUKKY WRECK SOLEI TROTR PVN TOMAZ BURTZ GOVET JUELE,ZSJ|DUKKY|WRECK|SOLEI|TROTR|PVN|TOMAZ|BURTZ|GOVET|JUELE,ZSJ|DUKKY|WRECK|SOLEI|TROTR|PVN|TOMAZ|BURTZ|GOVET|JUELE,10,10,true,true,,exact_match
BR49V,C,DHP LUVLY JUNUR FOWEE LUCSS JERRE TINKY NICKO ZQA,DHP|LUVLY|JUNUR|FOWEE|LUCSS|JERRE|TINKY|NICKO|ZQA,DHP|LUVLY|JUNUR|FOWEE|LUCSS|JERRE|TINKY|NICKO|ZQA,9,9,true,true,,exact_match
BR53V,C,VKZ SKIPS LEEVI SWIMM WOOZE RAJAY PRUNE HINZY ZQA GUAVA BNTTZ,VKZ|SKIPS|LEEVI|SWIMM|WOOZE|RAJAY|PRUNE|HINZY|ZQA|GUAVA|BNTTZ,VKZ|SKIPS|LEEVI|SWIMM|WOOZE|RAJAY|PRUNE|HINZY|ZQA|GUAVA|BNTTZ,11,11,true,true,,exact_match
BR54V,C,PBI MRLIN PREDA ISAAC OYSTA CAREY MAJUR ZQA,PBI|MRLIN|PREDA|ISAAC|OYSTA|CAREY|MAJUR|ZQA,PBI|MRLIN|PREDA|ISAAC|OYSTA|CAREY|MAJUR|ZQA,8,8,true,true,,exact_match
BR55V,C,PBI MRLIN PREDA BEECH ZBV RAJAY PRUNE HINZY ZQA BURRL SEAAN MUVOD BRRGO,PBI|MRLIN|PREDA|BEECH|ZBV|RAJAY|PRUNE|HINZY|ZQA|BURRL|SEAAN|MUVOD|BRRGO,PBI|MRLIN|PREDA|BEECH|ZBV|RAJAY|PRUNE|HINZY|ZQA|BURRL|SEAAN|MUVOD|BRRGO,13,13,true,true,,exact_match
BR57V,C,FLL DEKAL WIERS ZBV CAREY MAJUR ZQA,FLL|DEKAL|WIERS|ZBV|CAREY|MAJUR|ZQA,FLL|DEKAL|WIERS|ZBV|CAREY|MAJUR|ZQA,7,7,true,true,,exact_match
BR58V,C,ZQA KURAY MELON HANKX BARTS ANGLL,ZQA|KURAY|MELON|HANKX|BARTS|ANGLL,ZQA|KURAY|MELON|HANKX|BARTS|ANGLL,6,6,true,true,,exact_match
BR63V,C,PBI TURPS MIXAE HALBI ULAMA ZFP CEGUR BURBO BAYRU HANKX MELON KURAY ZQA,PBI|TURPS|MIXAE|HALBI|ULAMA|ZFP|CEGUR|BURBO|BAYRU|HANKX|MELON|KURAY|ZQA,PBI|TURPS|MIXAE|HALBI|ULAMA|ZFP|CEGUR|BURBO|BAYRU|HANKX|MELON|KURAY|ZQA,13,13,true,true,,exact_match
BR64V,C,VKZ KAINS QEPRO KUCEP LONNI HEATT MRLIN MUNRO ZFP,VKZ|KAINS|QEPRO|KUCEP|LONNI|HEATT|MRLIN|MUNRO|ZFP,VKZ|KAINS|QEPRO|KUCEP|LONNI|HEATT|MRLIN|MUNRO|ZFP,9,9,true,true,,exact_match
BR65V,C,ZQA PEACH SYDNY LAUTH ZFP RAPPS STIFF ELDER ADOOR,ZQA|PEACH|SYDNY|LAUTH|ZFP|RAPPS|STIFF|ELDER|ADOOR,ZQA|PEACH|SYDNY|LAUTH|ZFP|RAPPS|STIFF|ELDER|ADOOR,9,9,true,true,,exact_match
BR66V,C,VKZ JANUS PADUS ZFP,VKZ|JANUS|PADUS|ZFP,VKZ|JANUS|PADUS|ZFP,4,4,true,true,,exact_match
BR68V,C,FLL MRLIN MUNRO ZFP,FLL|MRLIN|MUNRO|ZFP,FLL|MRLIN|MUNRO|ZFP,4,4,true,true,,exact_match
BR69V,C,ZBV BAHMA MAYKO ZFP JAMAX BENZI JOLTS KIXAL WALIK PBI,ZBV|BAHMA|MAYKO|ZFP|JAMAX|BENZI|JOLTS|KIXAL|WALIK|PBI,ZBV|BAHMA|MAYKO|ZFP|JAMAX|BENZI|JOLTS|KIXAL|WALIK|PBI,10,10,true,true,,exact_match
BR70V,C,FLL TURBO PADUS ZFP GRREG MRRSH ZQA,FLL|TURBO|PADUS|ZFP|GRREG|MRRSH|ZQA,FLL|TURBO|PADUS|ZFP|GRREG|MRRSH|ZQA,7,7,true,true,,exact_match
BR71V,C,ZFP WOPOP WLKER,ZFP|WOPOP|WLKER,ZFP|WOPOP|WLKER,3,3,true,true,,exact_match
BR9L,C,GTK TOMAZ CARAH SKHOT KNSLY,GTK|TOMAZ|CARAH|SKHOT|KNSLY,GTK|TOMAZ|CARAH|SKHOT|KNSLY,5,5,true,true,,exact_match
G1,A,ADK HORTH MORDI TESPE CHUNA UNETE ELF,ADK|HORTH|MORDI|TESPE|CHUNA|UNETE|ELF,ADK|HORTH|MORDI|TESPE|CHUNA|UNETE|ELF,7,7,true,true,,exact_match
G10,A,EHM SPY IVOXE BILBE GENFU ELF SAFKO CFMWC IYUWI PDN ESHOS ZEVON WIDTH RWO,EHM|SPY|IVOXE|BILBE|GENFU|ELF|SAFKO|CFMWC|IYUWI|PDN|ESHOS|ZEVON|WIDTH|RWO,EHM|SPY|IVOXE|BILBE|GENFU|ELF|SAFKO|CFMWC|IYUWI|PDN|ESHOS|ZEVON|WIDTH|RWO,14,14,true,true,,exact_match
G12,A,ELF KOTIZ UCLON MILAM DUGAC HBT RAYMD PEWUK PDN,ELF|KOTIZ|UCLON|MILAM|DUGAC|HBT|RAYMD|PEWUK|PDN,ELF|KOTIZ|UCLON|MILAM|DUGAC|HBT|RAYMD|PEWUK|PDN,9,9,true,true,,exact_match
G2,A,HBT CUBPA GESSE CILAC FEVBO FIGAN JOGMO RWO,HBT|CUBPA|GESSE|CILAC|FEVBO|FIGAN|JOGMO|RWO,HBT|CUBPA|GESSE|CILAC|FEVBO|FIGAN|JOGMO|RWO,8,8,true,true,,exact_match
G205,C,RUTUS KISME GOOFI JUNIE OPLAR GUMGE UNZ GUYES TERYY TEGOD,RUTUS|KISME|GOOFI|JUNIE|OPLAR|GUMGE|UNZ|GUYES|TERYY|TEGOD,RUTUS|KISME|GOOFI|JUNIE|OPLAR|GUMGE|UNZ|GUYES|TERYY|TEGOD,10,10,true,true,,exact_match
G215,A,NRKEY OLCOT PLADO SYA CURVS DUT,NRKEY|OLCOT|PLADO|SYA|CURVS|DUT,NRKEY|OLCOT|PLADO|SYA|CURVS|DUT,6,6,true,true,,exact_match
G223,C,MUBIT OLGIS PHILY RISBA,MUBIT|OLGIS|PHILY|RISBA,MUBIT|OLGIS|PHILY|RISBA,4,4,true,true,,exact_match
G339,C,UNZ SHAWS RIDLL NATSS PAKDO,UNZ|SHAWS|RIDLL|NATSS|PAKDO,UNZ|SHAWS|RIDLL|NATSS|PAKDO,5,5,true,true,,exact_match
G347,C,DATBE DASNE DULCE DUNEY,DATBE|DASNE|DULCE|DUNEY,DATBE|DASNE|DULCE|DUNEY,4,4,true,true,,exact_match
G349,A,MARCC KIVAK PALIN NEONN,MARCC|KIVAK|PALIN|NEONN,MARCC|KIVAK|PALIN|NEONN,4,4,true,true,,exact_match
G437,C,DYNAH JAYEE JEFRY BRONO WELKS ZQA INGRA ELBOW AVOXI BAAGR OMALY MAPYL,DYNAH|JAYEE|JEFRY|BRONO|WELKS|ZQA|INGRA|ELBOW|AVOXI|BAAGR|OMALY|MAPYL,DYNAH|JAYEE|JEFRY|BRONO|WELKS|ZQA|INGRA|ELBOW|AVOXI|BAAGR|OMALY|MAPYL,12,12,true,true,,exact_match
G439,C,DHP MNATE TWNNS DROWN,DHP|MNATE|TWNNS|DROWN,DHP|MNATE|TWNNS|DROWN,4,4,true,true,,exact_match
G444,C,BOTES SAAKO GTK,BOTES|SAAKO|GTK,BOTES|SAAKO|GTK,3,3,true,true,,exact_match
G457,C,DATBE EGKEL EBEBE ELLMS,DATBE|EGKEL|EBEBE|ELLMS,DATBE|EGKEL|EBEBE|ELLMS,4,4,true,true,,exact_match
G467,C,ENDAX YELLO KITSS ACRON PULEE UNZ,ENDAX|YELLO|KITSS|ACRON|PULEE|UNZ,ENDAX|YELLO|KITSS|ACRON|PULEE|UNZ,6,6,true,true,,exact_match
G469,A,NYMPH ONEIL RULOY PINTT CREMR SPY PDN,NYMPH|ONEIL|RULOY|PINTT|CREMR|SPY|PDN,NYMPH|ONEIL|RULOY|PINTT|CREMR|SPY|PDN,7,7,true,true,,exact_match
G504,C,LETON IORIO COUKY FOLLE PRRDO ANGSS STRUD RATTL PVN SHOEZ CARAH ALBBE,LETON|IORIO|COUKY|FOLLE|PRRDO|ANGSS|STRUD|RATTL|PVN|SHOEZ|CARAH|ALBBE,LETON|IORIO|COUKY|FOLLE|PRRDO|ANGSS|STRUD|RATTL|PVN|SHOEZ|CARAH|ALBBE,12,12,true,true,,exact_match
G575,C,WIBIG CINTO BIGBY APIDD HILCO FICKY,WIBIG|CINTO|BIGBY|APIDD|HILCO|FICKY,WIBIG|CINTO|BIGBY|APIDD|HILCO|FICKY,6,6,true,true,,exact_match
G583,A,BESAT MARCC MUNRI ENM,BESAT|MARCC|MUNRI|ENM,BESAT|MARCC|MUNRI|ENM,4,4,true,true,,exact_match
G629,C,KNSLY RAPPR CATHI PVN EGANN RAHAM LYMIN,KNSLY|RAPPR|CATHI|PVN|EGANN|RAHAM|LYMIN,KNSLY|RAPPR|CATHI|PVN|EGANN|RAHAM|LYMIN,7,7,true,true,,exact_match
G633,C,GABAR DANDE TANZY COY SNOOZ VEDAS TUUNA DDP MAZ ZADAV MELLA,GABAR|DANDE|TANZY|COY|SNOOZ|VEDAS|TUUNA|DDP|MAZ|ZADAV|MELLA,GABAR|DANDE|TANZY|COY|SNOOZ|VEDAS|TUUNA|DDP|MAZ|ZADAV|MELLA,11,11,true,true,,exact_match
G648,C,GTK PVN MICAS,GTK|PVN|MICAS,GTK|PVN|MICAS,3,3,true,true,,exact_match
G8,A,ADK RUNUW LONOK SIYNY DUT ZEBUV MORDI TESPE CHUNA UNETE ELF,ADK|RUNUW|LONOK|SIYNY|DUT|ZEBUV|MORDI|TESPE|CHUNA|UNETE|ELF,ADK|RUNUW|LONOK|SIYNY|DUT|ZEBUV|MORDI|TESPE|CHUNA|UNETE|ELF,11,11,true,true,,exact_match
H201,A,OME SLEDD AVUBA ENEGU MUNRI KIVAK NAYLD,OME|SLEDD|AVUBA|ENEGU|MUNRI|KIVAK|NAYLD,OME|SLEDD|AVUBA|ENEGU|MUNRI|KIVAK|NAYLD,7,7,true,true,,exact_match
H222,A,VALDA ICEEE SLEDD MCG,VALDA|ICEEE|SLEDD|MCG,VALDA|ICEEE|SLEDD|MCG,4,4,true,true,,exact_match
J1,C,TIJ TEYON MZB OCN LAX FIM REYES DERBB AVE OAK RBL HANDY OED DREWS BTG ALDER SEA,TIJ|TEYON|MZB|OCN|LAX|FIM|REYES|DERBB|AVE|OAK|RBL|HANDY|OED|DREWS|BTG|ALDER|SEA,TIJ|U.S. MEXICAN BORDER-2|TEYON|MZB|OCN|LAX|FIM|REYES|DERBB|AVE|OAK|RBL|HANDY|OED|DREWS|BTG|ALDER|SEA,17,18,false,false,1,token_value_mismatch
J10,C,LAX JUGLI CIVET RUSTT PIONE TNP CADEZ HIPPI FLG RSK HBU FQF LBF DSM IOW,LAX|JUGLI|CIVET|RUSTT|PIONE|TNP|CADEZ|HIPPI|FLG|RSK|HBU|FQF|LBF|DSM|IOW,LAX|JUGLI|CIVET|RUSTT|PIONE|TNP|CADEZ|HIPPI|FLG|RSK|HBU|FQF|LBF|DSM|IOW,15,15,true,true,,exact_match
J100,C,LAX DAG MISEN CLARR LAS SUVIE NORRA BCE SAKES EKR FROGS SNY DBQ COTON OBK,LAX|DAG|MISEN|CLARR|LAS|SUVIE|NORRA|BCE|SAKES|EKR|FROGS|SNY|DBQ|COTON|OBK,LAX|DAG|MISEN|CLARR|LAS|SUVIE|NORRA|BCE|SAKES|EKR|FROGS|SNY|DBQ|COTON|OBK,15,15,true,true,,exact_match
J101,C,IAH LFK SKKIP ADUKE BERKE CISAR LIT PLIED TWRAY STL FARGO SPI OBK BAE GRB SSM,IAH|LFK|SKKIP|ADUKE|BERKE|CISAR|LIT|PLIED|TWRAY|STL|FARGO|SPI|OBK|BAE|GRB|SSM,IAH|LFK|SKKIP|ADUKE|BERKE|CISAR|LIT|PLIED|TWRAY|STL|FARGO|SPI|OBK|BAE|GRB|SSM,16,16,true,true,,exact_match
J102,C,PXR FORPE CHEKR BOLIC ZUN GUP PUMPS RGINA ALS LAA RYLIE SLN,PXR|FORPE|CHEKR|BOLIC|ZUN|GUP|PUMPS|RGINA|ALS|LAA|RYLIE|SLN,PXR|FORPE|CHEKR|BOLIC|ZUN|GUP|PUMPS|RGINA|ALS|LAA|RYLIE|SLN,12,12,true,true,,exact_match
J104,C,LAX JUGLI CIVET RUSTT PIONE TNP PKE WLVRN CULTS KOFFA GBN ALMON TUS SSAND SSO WOBUG GREBE TMACK ONM FTI PUB,LAX|JUGLI|CIVET|RUSTT|PIONE|TNP|PKE|WLVRN|CULTS|KOFFA|GBN|ALMON|TUS|SSAND|SSO|WOBUG|GREBE|TMACK|ONM|FTI|PUB,LAX|JUGLI|CIVET|RUSTT|PIONE|TNP|PKE|WLVRN|CULTS|KOFFA|GBN|ALMON|TUS|SSAND|SSO|WOBUG|GREBE|TMACK|ONM|FTI|PUB,21,21,true,true,,exact_match
J106,C,JHW HOXIE DMACK STENT MAGIO LVZ JENNO HARTY STW LGA,JHW|HOXIE|DMACK|STENT|MAGIO|LVZ|JENNO|HARTY|STW|LGA,JHW|HOXIE|DMACK|STENT|MAGIO|LVZ|JENNO|HARTY|STW|LGA,10,10,true,true,,exact_match
J107,C,LAX JUGLI CIVET RESOR HEC BLD OVETO NORRA BERYL MLF URNUW OCS DDY DPR,LAX|JUGLI|CIVET|RESOR|HEC|BLD|OVETO|NORRA|BERYL|MLF|URNUW|OCS|DDY|DPR,LAX|JUGLI|CIVET|RESOR|HEC|BLD|OVETO|NORRA|BERYL|MLF|URNUW|OCS|DDY|DPR,14,14,true,true,,exact_match
J108,C,INW SJN TCS GINGR INK,INW|SJN|TCS|GINGR|INK,INW|SJN|TCS|GINGR|INK,5,5,true,true,,exact_match
J11,C,TUS TOTEC TUKEE PXR DRK KIDDR NAVHO CORKR SNAER FREDD BCE URNUW NEEBO FFU TCH,TUS|TOTEC|TUKEE|PXR|DRK|KIDDR|NAVHO|CORKR|SNAER|FREDD|BCE|URNUW|NEEBO|FFU|TCH,TUS|TOTEC|TUKEE|PXR|DRK|KIDDR|NAVHO|CORKR|SNAER|FREDD|BCE|URNUW|NEEBO|FFU|TCH,15,15,true,true,,exact_match
J110,C,BLD LRAIN RSK ALS GCK KIRKE PEABO FRACA BUM SCAWT ELSTO KOOOP STL COWES TILMN VHP FYLLS CREEP EMPTY BOWRR ZANDR CORVS AIR LEJOY VINSE GRAHM BEETS LARRI KIPPI FLIRT PENSY CYN,BLD|LRAIN|RSK|ALS|GCK|KIRKE|PEABO|FRACA|BUM|SCAWT|ELSTO|KOOOP|STL|COWES|TILMN|VHP|FYLLS|CREEP|EMPTY|BOWRR|ZANDR|CORVS|AIR|LEJOY|VINSE|GRAHM|BEETS|LARRI|KIPPI|FLIRT|PENSY|CYN,BLD|LRAIN|RSK|ALS|GCK|KIRKE|PEABO|FRACA|BUM|SCAWT|ELSTO|KOOOP|STL|COWES|TILMN|VHP|FYLLS|CREEP|EMPTY|BOWRR|ZANDR|CORVS|AIR|LEJOY|VINSE|GRAHM|BEETS|LARRI|KIPPI|FLIRT|PENSY|CYN,32,32,true,true,,exact_match
J111,A,OME WONAB UNK MCG WINOR FFITZ TED,OME|WONAB|UNK|MCG|WINOR|FFITZ|TED,OME|WONAB|UNK|MCG|WINOR|FFITZ|TED,7,7,true,true,,exact_match
J112,C,BUM EUNIK ULMAN CROCK FAM PLESS PXV IIU,BUM|EUNIK|ULMAN|CROCK|FAM|PLESS|PXV|IIU,BUM|EUNIK|ULMAN|CROCK|FAM|PLESS|PXV|IIU,8,8,true,true,,exact_match
J114,C,DVV LANDR SNY BENNZ YANKI NARLY ONL FSD GEP,DVV|LANDR|SNY|BENNZ|YANKI|NARLY|ONL|FSD|GEP,DVV|LANDR|SNY|BENNZ|YANKI|NARLY|ONL|FSD|GEP,9,9,true,true,,exact_match
J115,A,ADK DUT CDB BINAL CUDDA TANIE AKN CIFJI TUCKS ENA TED BGQ CAWIN FAI,ADK|DUT|CDB|BINAL|CUDDA|TANIE|AKN|CIFJI|TUCKS|ENA|TED|BGQ|CAWIN|FAI,ADK|DUT|CDB|BINAL|CUDDA|TANIE|AKN|CIFJI|TUCKS|ENA|TED|BGQ|CAWIN|FAI,14,14,true,true,,exact_match
J116,C,TCH FFU EKR FQF,TCH|FFU|EKR|FQF,TCH|FFU|EKR|FQF,4,4,true,true,,exact_match
J117,A,MCG GAL OTZ,MCG|GAL|OTZ,MCG|GAL|OTZ,3,3,true,true,,exact_match
J12,C,SEA NORMY BLUIT EPH DNJ TWF TCH FFU HELPR FIRRE RIFMN JNC,SEA|NORMY|BLUIT|EPH|DNJ|TWF|TCH|FFU|HELPR|FIRRE|RIFMN|JNC,SEA|NORMY|BLUIT|EPH|DNJ|TWF|TCH|FFU|HELPR|FIRRE|RIFMN|JNC,12,12,true,true,,exact_match
J120,A,ADK SPY POETT BET MCG FAI FYU,ADK|SPY|POETT|BET|MCG|FAI|FYU,ADK|SPY|POETT|BET|MCG|FAI|FYU,7,7,true,true,,exact_match
J122,A,FAI GAL OME,FAI|GAL|OME,FAI|GAL|OME,3,3,true,true,,exact_match
J123,A,CJAYY ODK KOKOZ AKN KOWOK BET OME OTZ BRW,CJAYY|ODK|KOKOZ|AKN|KOWOK|BET|OME|OTZ|BRW,CJAYY|ODK|KOKOZ|AKN|KOWOK|BET|OME|OTZ|BRW,9,9,true,true,,exact_match
J124,A,BGQ GKN ORT,BGQ|GKN|ORT,BGQ|GKN|ORT,3,3,true,true,,exact_match
J125,A,ODK KODNE TED,ODK|KODNE|TED,ODK|KODNE|TED,3,3,true,true,,exact_match
J126,C,LAX RZS CEANO ROBIE GOALI SNS SAC RBL HANDY OED EUG UBG OLM CFXKC CFQLS CFGFX,LAX|RZS|CEANO|ROBIE|GOALI|SNS|SAC|RBL|HANDY|OED|EUG|UBG|OLM|CFXKC|CFQLS|CFGFX,LAX|RZS|CEANO|ROBIE|GOALI|SNS|SAC|RBL|HANDY|OED|EUG|UBG|OLM|CFXKC|U.S. CANADIAN BORDER-2|U.S. CANADIAN BORDER-3|CFQLS|CFGFX|U.S. CANADIAN BORDER-4,16,19,false,false,14,token_value_mismatch
J127,A,AKN RINGO NONDA,AKN|RINGO|NONDA,AKN|RINGO|NONDA,3,3,true,true,,exact_match
J128,C,LAX JUGLI CIVET RUSTT EMMEY DIKES BUGGA ETINE PGS TBC LRAIN HBU FQF HCT DBQ COTON OBK,LAX|JUGLI|CIVET|RUSTT|EMMEY|DIKES|BUGGA|ETINE|PGS|TBC|LRAIN|HBU|FQF|HCT|DBQ|COTON|OBK,LAX|JUGLI|CIVET|RUSTT|EMMEY|DIKES|BUGGA|ETINE|PGS|TBC|LRAIN|HBU|FQF|HCT|DBQ|COTON|OBK,17,17,true,true,,exact_match
J129,A,OME CIVED OTZ,OME|CIVED|OTZ,OME|CIVED|OTZ,3,3,true,true,,exact_match
J13,C,BECON RUTER TCS ABQ FRIHO ESPAN ALS VIMPY FQF CYS DDY BIL GTF CFNGJ,BECON|RUTER|TCS|ABQ|FRIHO|ESPAN|ALS|VIMPY|FQF|CYS|DDY|BIL|GTF|CFNGJ,U.S. MEXICAN BORDER-2|BECON|RUTER|TCS|ABQ|FRIHO|ESPAN|ALS|VIMPY|FQF|CYS|DDY|BIL|GTF|CFNGJ|U.S. CANADIAN BORDER-3,14,16,false,false,0,token_value_mismatch
J131,C,SAT HENLY SPURS JUMBO EDNAS FUZ TXK LIT RUSLR HUMBO PXV,SAT|HENLY|SPURS|JUMBO|EDNAS|FUZ|TXK|LIT|RUSLR|HUMBO|PXV,SAT|HENLY|SPURS|JUMBO|EDNAS|FUZ|TXK|LIT|RUSLR|HUMBO|PXV,11,11,true,true,,exact_match
J133,A,TED GAL,TED|GAL,TED|GAL,2,2,true,true,,exact_match
J134,C,LAX SLI TRM PKE LANCY DRK KEYKE GUP CIM ICT ROKNE DOSOA BUM SCAWT ELSTO KOOOP STL JIGSY CAROL JUDDI MOSEY GBEES FLM,LAX|SLI|TRM|PKE|LANCY|DRK|KEYKE|GUP|CIM|ICT|ROKNE|DOSOA|BUM|SCAWT|ELSTO|KOOOP|STL|JIGSY|CAROL|JUDDI|MOSEY|GBEES|FLM,LAX|SLI|TRM|PKE|LANCY|DRK|KEYKE|GUP|CIM|ICT|ROKNE|DOSOA|BUM|SCAWT|ELSTO|KOOOP|STL|JIGSY|CAROL|JUDDI|MOSEY|GBEES|FLM,23,23,true,true,,exact_match
J135,A,BET UNK,BET|UNK,BET|UNK,2,2,true,true,,exact_match
J136,C,ONP BTG YKM GEG HILIE MLP HLN BIL MBW,ONP|BTG|YKM|GEG|HILIE|MLP|HLN|BIL|MBW,ONP|BTG|YKM|GEG|HILIE|MLP|HLN|BIL|MBW,9,9,true,true,,exact_match
J137,C,SPI FAM BSIDE ARG LIT,SPI|FAM|BSIDE|ARG|LIT,SPI|FAM|BSIDE|ARG|LIT,5,5,true,true,,exact_match
J138,C,FST SHUCK CSI SAT LCH LSU SJI,FST|SHUCK|CSI|SAT|LCH|LSU|SJI,FST|SHUCK|CSI|SAT|LCH|LSU|SJI,7,7,true,true,,exact_match
J139,A,BTT SCC,BTT|SCC,BTT|SCC,2,2,true,true,,exact_match
J14,C,PNH CRUSR IRW DWINE KLUBB KOMMA LIT XESSS JMUCK YAALL VUZ,PNH|CRUSR|IRW|DWINE|KLUBB|KOMMA|LIT|XESSS|JMUCK|YAALL|VUZ,PNH|CRUSR|IRW|DWINE|KLUBB|KOMMA|LIT|XESSS|JMUCK|YAALL|VUZ,11,11,true,true,,exact_match
J140,C,FAR DLH SSM,FAR|DLH|SSM,FAR|DLH|SSM,3,3,true,true,,exact_match
J141,C,ELP KEYLO WIPPO,ELP|KEYLO|WIPPO,ELP|KEYLO|WIPPO|U.S. MEXICAN BORDER-1,3,4,false,false,3,token_count_mismatch
J143,C,PYE ENI RBG EUG LTJ GEG,PYE|ENI|RBG|EUG|LTJ|GEG,PYE|ENI|RBG|EUG|LTJ|GEG,6,6,true,true,,exact_match
J144,C,DSM DBQ,DSM|DBQ,DSM|DBQ,2,2,true,true,,exact_match
J146,C,LAX DAG MISEN CLARR LAS BEALE NOOTN BETHL FREDD DICEE DVC HBU GLD LNK CNOTA IOW VORIN JOT GIJ ETG MIP FJC JFK,LAX|DAG|MISEN|CLARR|LAS|BEALE|NOOTN|BETHL|FREDD|DICEE|DVC|HBU|GLD|LNK|CNOTA|IOW|VORIN|JOT|GIJ|ETG|MIP|FJC|JFK,LAX|DAG|MISEN|CLARR|LAS|BEALE|NOOTN|BETHL|FREDD|DICEE|DVC|HBU|GLD|LNK|CNOTA|IOW|VORIN|JOT|GIJ|ETG|MIP|FJC|JFK,23,23,true,true,,exact_match
J148,C,OAL KROST DTA MTU CYS HANKI ONL GOOLD MCW,OAL|KROST|DTA|MTU|CYS|HANKI|ONL|GOOLD|MCW,OAL|KROST|DTA|MTU|CYS|HANKI|ONL|GOOLD|MCW,9,9,true,true,,exact_match
J149,C,AML GINYA RAMAY EYTEE SINDE GEFFS HACKS SUMET VLADY EMPTY MECAN ROD FWA,AML|GINYA|RAMAY|EYTEE|SINDE|GEFFS|HACKS|SUMET|VLADY|EMPTY|MECAN|ROD|FWA,AML|GINYA|RAMAY|EYTEE|SINDE|GEFFS|HACKS|SUMET|VLADY|EMPTY|MECAN|ROD|FWA,13,13,true,true,,exact_match
J15,C,IAH MARCS JCT FUSCO LOWGO INK CME HONDS CNX ABQ CURLY TANER PUMPS RSK BDROC SINSY JNC TCH TWF BOI IMB TIMEE BTG,IAH|MARCS|JCT|FUSCO|LOWGO|INK|CME|HONDS|CNX|ABQ|CURLY|TANER|PUMPS|RSK|BDROC|SINSY|JNC|TCH|TWF|BOI|IMB|TIMEE|BTG,IAH|MARCS|JCT|FUSCO|LOWGO|INK|CME|HONDS|CNX|ABQ|CURLY|TANER|PUMPS|RSK|BDROC|SINSY|JNC|TCH|TWF|BOI|IMB|TIMEE|BTG,23,23,true,true,,exact_match
