airwayId,airwayLocation,airwayStringRaw,airwayStringTokens,orderedSegValues,tokenCount,pointRowCount,exactTokenMatch,normalizedTokenMatch,firstMismatchIndex,mismatchReason
V249,C,RBV JERYY METRO SBJ SAX SHAFF CRANK FLOSI HELON WEETS FILPS PRNCE RIMBA DNY,RBV|JERYY|METRO|SBJ|SAX|SHAFF|CRANK|FLOSI|HELON|WEETS|FILPS|PRNCE|RIMBA|DNY,RBV|JERYY|METRO|SBJ|SAX|SHAFF|CRANK|FLOSI|HELON|WEETS|FILPS|PRNCE|RIMBA|DNY,14,14,true,true,,exact_match
V25,C,MZB REDIN PACIF JARRD MINOE ALBAS FERMY WILMA HERMO LAX MERMA EXERT VTU DEANO ZIQOR RZS POZOE KIKII PRB LUCAB WIGGL HAGRO CASRA SNS MOVER SANTY SAPID OSI SFO SUTRO GOBBS STINS PYE FREES GETER LAPED GRENY RBL HOMAN ITMOR GARSA KAGYE MUREX LMT SPRAG FESOD OCTAD DSD MLLRR HERBS CUPRI GASHE KUKTE JIREN LTJ YABLU GUBSE MUDLE YKM CIDOG ELN AYISO PIGVE BEEHI EAT,MZB|REDIN|PACIF|JARRD|MINOE|ALBAS|FERMY|WILMA|HERMO|LAX|MERMA|EXERT|VTU|DEANO|ZIQOR|RZS|POZOE|KIKII|PRB|LUCAB|WIGGL|HAGRO|CASRA|SNS|MOVER|SANTY|SAPID|OSI|SFO|SUTRO|GOBBS|STINS|PYE|FREES|GETER|LAPED|GRENY|RBL|HOMAN|ITMOR|GARSA|KAGYE|MUREX|LMT|SPRAG|FESOD|OCTAD|DSD|MLLRR|HERBS|CUPRI|GASHE|KUKTE|JIREN|LTJ|YABLU|GUBSE|MUDLE|YKM|CIDOG|ELN|AYISO|PIGVE|BEEHI|EAT,MZB|REDIN|PACIF|JARRD|MINOE|ALBAS|FERMY|WILMA|HERMO|LAX|MERMA|EXERT|VTU|DEANO|ZIQOR|RZS|POZOE|KIKII|PRB|LUCAB|WIGGL|HAGRO|CASRA|SNS|MOVER|SANTY|SAPID|OSI|SFO|SUTRO|GOBBS|STINS|PYE|FREES|GETER|LAPED|GRENY|RBL|HOMAN|ITMOR|GARSA|KAGYE|MUREX|LMT|SPRAG|FESOD|OCTAD|DSD|MLLRR|HERBS|CUPRI|GASHE|KUKTE|JIREN|LTJ|YABLU|GUBSE|MUDLE|YKM|CIDOG|ELN|AYISO|PIGVE|BEEHI|EAT,65,65,true,true,,exact_match
V25,H,ITO KENNZ COOKE BYROW BASSY CODDY ARROW CLUTS,ITO|KENNZ|COOKE|BYROW|BASSY|CODDY|ARROW|CLUTS,ITO|KENNZ|COOKE|BYROW|BASSY|CODDY|ARROW|CLUTS,8,8,true,true,,exact_match
V251,C,AXC REGOY BEMEN CMI,AXC|REGOY|BEMEN|CMI,AXC|REGOY|BEMEN|CMI,4,4,true,true,,exact_match
V252,C,AIRCO EHMAN FIXUS WELTI GEE RITCH GIBBE XUCCO VILCU MESTE CFB LATTY HUGIE ORSON RAGER HUO LEMOR COATE ARMMS HOPAT SLYNG JOKMI VANER LINER PLEXS KOPPS RBV COBUS DQO,AIRCO|EHMAN|FIXUS|WELTI|GEE|RITCH|GIBBE|XUCCO|VILCU|MESTE|CFB|LATTY|HUGIE|ORSON|RAGER|HUO|LEMOR|COATE|ARMMS|HOPAT|SLYNG|JOKMI|VANER|LINER|PLEXS|KOPPS|RBV|COBUS|DQO,AIRCO|EHMAN|FIXUS|WELTI|GEE|RITCH|GIBBE|XUCCO|VILCU|MESTE|CFB|LATTY|HUGIE|ORSON|RAGER|HUO|LEMOR|COATE|ARMMS|HOPAT|SLYNG|JOKMI|VANER|LINER|PLEXS|KOPPS|RBV|COBUS|DQO,29,29,true,true,,exact_match
V253,C,LCU ROGET OYXOJ TWF LITKE SECAR UYEME ALKAL CANEK ATETY BOI SALLA BANGS DNJ KOVRY ZOSNO OXLEY MELLR PIYOL MQG WHELE PUW CISOV ATOXE HUNIB GEG,LCU|ROGET|OYXOJ|TWF|LITKE|SECAR|UYEME|ALKAL|CANEK|ATETY|BOI|SALLA|BANGS|DNJ|KOVRY|ZOSNO|OXLEY|MELLR|PIYOL|MQG|WHELE|PUW|CISOV|ATOXE|HUNIB|GEG,LCU|ROGET|OYXOJ|TWF|LITKE|SECAR|UYEME|ALKAL|CANEK|ATETY|BOI|SALLA|BANGS|DNJ|KOVRY|ZOSNO|OXLEY|MELLR|PIYOL|MQG|WHELE|PUW|CISOV|ATOXE|HUNIB|GEG,26,26,true,true,,exact_match
V254,C,IIP TOOKE JUGIP GCC HITOS CISPU MLS JITAG GGW,IIP|TOOKE|JUGIP|GCC|HITOS|CISPU|MLS|JITAG|GGW,IIP|TOOKE|JUGIP|GCC|HITOS|CISPU|MLS|JITAG|GGW,9,9,true,true,,exact_match
V255,C,GCK KUVVU TOKIE WAMIP HYS,GCK|KUVVU|TOKIE|WAMIP|HYS,GCK|KUVVU|TOKIE|WAMIP|HYS,5,5,true,true,,exact_match
V256,C,TUL LOMAC FRAKS IDLUY PER HUT,TUL|LOMAC|FRAKS|IDLUY|PER|HUT,TUL|LOMAC|FRAKS|IDLUY|PER|HUT,6,6,true,true,,exact_match
V257,C,PXR AVENT BANYO COYOT MAIER DRK IRODY PHYLE KACEE NAVHO BISOP GCN DOZIT JALMA KACIR CIXAP HEGID BCE EYPUZ HURTU NOPAH ENICE DETAN BICAN JULIK DTA WADOK LOLIC AADCO VERNE ENJAK STACO EMONT RIDEN MOINT NUBGE KREBS MLD BANNO PIH ROCCA TERRE DBS WEMKO DLN NUWLI DIVID CPN GLUES SCAAT KELTY RICHD SIEBE WOKEN TUCOK MSURY GTF PSHKN RESLE SHONK BELCA YOYNO HVR,PXR|AVENT|BANYO|COYOT|MAIER|DRK|IRODY|PHYLE|KACEE|NAVHO|BISOP|GCN|DOZIT|JALMA|KACIR|CIXAP|HEGID|BCE|EYPUZ|HURTU|NOPAH|ENICE|DETAN|BICAN|JULIK|DTA|WADOK|LOLIC|AADCO|VERNE|ENJAK|STACO|EMONT|RIDEN|MOINT|NUBGE|KREBS|MLD|BANNO|PIH|ROCCA|TERRE|DBS|WEMKO|DLN|NUWLI|DIVID|CPN|GLUES|SCAAT|KELTY|RICHD|SIEBE|WOKEN|TUCOK|MSURY|GTF|PSHKN|RESLE|SHONK|BELCA|YOYNO|HVR,PXR|AVENT|BANYO|COYOT|MAIER|DRK|IRODY|PHYLE|KACEE|NAVHO|BISOP|GCN|DOZIT|JALMA|KACIR|CIXAP|HEGID|BCE|EYPUZ|HURTU|NOPAH|ENICE|DETAN|BICAN|JULIK|DTA|WADOK|LOLIC|AADCO|VERNE|ENJAK|STACO|EMONT|RIDEN|MOINT|NUBGE|KREBS|MLD|BANNO|PIH|ROCCA|TERRE|DBS|WEMKO|DLN|NUWLI|DIVID|CPN|GLUES|SCAAT|KELTY|RICHD|SIEBE|WOKEN|TUCOK|MSURY|GTF|PSHKN|RESLE|SHONK|BELCA|YOYNO|HVR,63,63,true,true,,exact_match
V259,C,CRE KOOKE CLETA FLO COPEL WARNR CTF HUSTN MOPED BZM GOWBE COREX HOMEK HMV,CRE|KOOKE|CLETA|FLO|COPEL|WARNR|CTF|HUSTN|MOPED|BZM|GOWBE|COREX|HOMEK|HMV,CRE|KOOKE|CLETA|FLO|COPEL|WARNR|CTF|HUSTN|MOPED|BZM|GOWBE|COREX|HOMEK|HMV,14,14,true,true,,exact_match
V26,C,HBU MEYRS MTJ PAGRE BRICK SPADA JNC RAYMN AWRAW HAPRA EKR STRIM CELIA NEDAE CKW ARFEJ CHOMP ALCOS DDY AFYAB SALON WILDA RULER RAP CRETO PHP CABKU PIR RWF OSHOF BEEGR WULEP LYDIA FGT LDASH PRESS ELPAS EAU,HBU|MEYRS|MTJ|PAGRE|BRICK|SPADA|JNC|RAYMN|AWRAW|HAPRA|EKR|STRIM|CELIA|NEDAE|CKW|ARFEJ|CHOMP|ALCOS|DDY|AFYAB|SALON|WILDA|RULER|RAP|CRETO|PHP|CABKU|PIR|RWF|OSHOF|BEEGR|WULEP|LYDIA|FGT|LDASH|PRESS|ELPAS|EAU,HBU|MEYRS|MTJ|PAGRE|BRICK|SPADA|JNC|RAYMN|AWRAW|HAPRA|EKR|STRIM|CELIA|NEDAE|CKW|ARFEJ|CHOMP|ALCOS|DDY|AFYAB|SALON|WILDA|RULER|RAP|CRETO|PHP|CABKU|PIR|RWF|OSHOF|BEEGR|WULEP|LYDIA|FGT|LDASH|PRESS|ELPAS|EAU,38,38,true,true,,exact_match
V260,C,FAK RIC HPW,FAK|RIC|HPW,FAK|RIC|HPW,3,3,true,true,,exact_match
V261,C,ICT KAKEL JUXON CEKIS MHK,ICT|KAKEL|JUXON|CEKIS|MHK,ICT|KAKEL|JUXON|CEKIS|MHK,5,5,true,true,,exact_match
V263,C,CNX CFLMZ FOSED ENCIA MOPSE BUPNY ABQ FRIHO ZIASE HEGMI SAF FTI CELAV ADOZO CIM SAYKA FOGLE WATGU ECDOL TBE KOWTO LAA WEYYI ZANON HGO LIMEX KANDO AKO PIR HATKA LIVVA ALLOT ARJEL OPNAH ABR,CNX|CFLMZ|FOSED|ENCIA|MOPSE|BUPNY|ABQ|FRIHO|ZIASE|HEGMI|SAF|FTI|CELAV|ADOZO|CIM|SAYKA|FOGLE|WATGU|ECDOL|TBE|KOWTO|LAA|WEYYI|ZANON|HGO|LIMEX|KANDO|AKO|PIR|HATKA|LIVVA|ALLOT|ARJEL|OPNAH|ABR,CNX|CFLMZ|FOSED|ENCIA|MOPSE|BUPNY|ABQ|FRIHO|ZIASE|HEGMI|SAF|FTI|CELAV|ADOZO|CIM|SAYKA|FOGLE|WATGU|ECDOL|TBE|KOWTO|LAA|WEYYI|ZANON|HGO|LIMEX|KANDO|AKO|PIR|HATKA|LIVVA|ALLOT|ARJEL|OPNAH|ABR,35,35,true,true,,exact_match
V264,C,LAX STABO AMTRA ITSME HOPUN COVIN POM RRIZE RAVON REANS YUCCA TNP JEHLI PKE DRK DRRTY JUWSO OATES HOXOL INW AVANS IRECU SJN ONM CNX PELCI TCC,LAX|STABO|AMTRA|ITSME|HOPUN|COVIN|POM|RRIZE|RAVON|REANS|YUCCA|TNP|JEHLI|PKE|DRK|DRRTY|JUWSO|OATES|HOXOL|INW|AVANS|IRECU|SJN|ONM|CNX|PELCI|TCC,LAX|STABO|AMTRA|ITSME|HOPUN|COVIN|POM|RRIZE|RAVON|REANS|YUCCA|TNP|JEHLI|PKE|DRK|DRRTY|JUWSO|OATES|HOXOL|INW|AVANS|IRECU|SJN|ONM|CNX|PELCI|TCC,27,27,true,true,,exact_match
V265,C,KRANT BELTS CUTOP CLEAT DATED YANNI EMI BINNS PIFER KOLBY HAR PYCAT MCMAN RASHE PSB ETG,KRANT|BELTS|CUTOP|CLEAT|DATED|YANNI|EMI|BINNS|PIFER|KOLBY|HAR|PYCAT|MCMAN|RASHE|PSB|ETG,KRANT|BELTS|CUTOP|CLEAT|DATED|YANNI|EMI|BINNS|PIFER|KOLBY|HAR|PYCAT|MCMAN|RASHE|PSB|ETG,16,16,true,true,,exact_match
V266,C,ELW PELZE NINYI WANOL DUNKE SPA GSO REIDE YANCE SBV SUNNS MCARY ECG,ELW|PELZE|NINYI|WANOL|DUNKE|SPA|GSO|REIDE|YANCE|SBV|SUNNS|MCARY|ECG,ELW|PELZE|NINYI|WANOL|DUNKE|SPA|GSO|REIDE|YANCE|SBV|SUNNS|MCARY|ECG,13,13,true,true,,exact_match
V267,C,ORL PAOLA KIZER WORMS GUANO BARBS ROYES MATEO BRADO CRG HABLE BAXLY AILEY DBN HEPUT HADOC BEYLO TRAPI CORVI PENFI AHN IRMOS CORCE,ORL|PAOLA|KIZER|WORMS|GUANO|BARBS|ROYES|MATEO|BRADO|CRG|HABLE|BAXLY|AILEY|DBN|HEPUT|HADOC|BEYLO|TRAPI|CORVI|PENFI|AHN|IRMOS|CORCE,ORL|PAOLA|KIZER|WORMS|GUANO|BARBS|ROYES|MATEO|BRADO|CRG|HABLE|BAXLY|AILEY|DBN|HEPUT|HADOC|BEYLO|TRAPI|CORVI|PENFI|AHN|IRMOS|CORCE,23,23,true,true,,exact_match
V268,C,HGR KEMAR EMI SLOAF BAL SWANN GOLDA BROSS ENO LEEAH AZXEW AVALO BRIGS HARBO DRIFT MANTA PLUME SHERL DUNEE KOPPY SARDI RICED BEDYA SHLEP BEADS HTO JORDN SEY MINNK AVONN INNDY BURDY KYLES TONNI WIMPY EXALT LBSTA CEKAY SCOGS MESHL SAPPE AUG,HGR|KEMAR|EMI|SLOAF|BAL|SWANN|GOLDA|BROSS|ENO|LEEAH|AZXEW|AVALO|BRIGS|HARBO|DRIFT|MANTA|PLUME|SHERL|DUNEE|KOPPY|SARDI|RICED|BEDYA|SHLEP|BEADS|HTO|JORDN|SEY|MINNK|AVONN|INNDY|BURDY|KYLES|TONNI|WIMPY|EXALT|LBSTA|CEKAY|SCOGS|MESHL|SAPPE|AUG,HGR|KEMAR|EMI|SLOAF|BAL|SWANN|GOLDA|BROSS|ENO|LEEAH|AZXEW|AVALO|BRIGS|HARBO|DRIFT|MANTA|PLUME|SHERL|DUNEE|KOPPY|SARDI|RICED|BEDYA|SHLEP|BEADS|HTO|JORDN|SEY|MINNK|AVONN|INNDY|BURDY|KYLES|TONNI|WIMPY|EXALT|LBSTA|CEKAY|SCOGS|MESHL|SAPPE|AUG,42,42,true,true,,exact_match
V269,C,ELY FAPGI SPATS LWL JACKS YUSUN IXUVE TWF APGUH BYI JALIK COLAY YERUP PIH JATTS YOYYU WABUD LKT DNJ NEYGI HOVEL PIYID FONNA ILR NAXZY FUFQO SAKKO DSD EENIE MANTE MOBIL COBUR EUG,ELY|FAPGI|SPATS|LWL|JACKS|YUSUN|IXUVE|TWF|APGUH|BYI|JALIK|COLAY|YERUP|PIH|JATTS|YOYYU|WABUD|LKT|DNJ|NEYGI|HOVEL|PIYID|FONNA|ILR|NAXZY|FUFQO|SAKKO|DSD|EENIE|MANTE|MOBIL|COBUR|EUG,ELY|FAPGI|SPATS|LWL|JACKS|YUSUN|IXUVE|TWF|APGUH|BYI|JALIK|COLAY|YERUP|PIH|JATTS|YOYYU|WABUD|LKT|DNJ|NEYGI|HOVEL|PIYID|FONNA|ILR|NAXZY|FUFQO|SAKKO|DSD|EENIE|MANTE|MOBIL|COBUR|EUG,33,33,true,true,,exact_match
V27,C,MZB REDIN PACIF AVOLS SXC PAROL DOYLE EXERT VTU HENER DEANO KWANG GOLET GVO AFOXY ORCUT FABEG AVILA MQO FRAMS CALIS BLANC WONGO BSR CARME PEBBS PENNI SAGUE SHOEY EUGEN TAILS HADLY SEEMS STINS PYE FREES GETER CABEX ENI MERRI FLUEN EBBLS HIDAK OLRIO TUNGS FOT SEGVE HEXIT HOCUT TRIAL WHEEL CULDU OLJEK ZIKNO CHIDE CEC KEVZU WIPOG ROOTY LEDGE LUPCI OVLEE OLINE OTH YUPVU GAMMA BOSVE JANAS ONP CUTEL DANES ULKAW FETUJ ZIGPI KULOA AST PULYI PUGIC WAVLU HQM OZALU ULESS SANDR WONKU ZOLGI CARRO HOOME SEA,MZB|REDIN|PACIF|AVOLS|SXC|PAROL|DOYLE|EXERT|VTU|HENER|DEANO|KWANG|GOLET|GVO|AFOXY|ORCUT|FABEG|AVILA|MQO|FRAMS|CALIS|BLANC|WONGO|BSR|CARME|PEBBS|PENNI|SAGUE|SHOEY|EUGEN|TAILS|HADLY|SEEMS|STINS|PYE|FREES|GETER|CABEX|ENI|MERRI|FLUEN|EBBLS|HIDAK|OLRIO|TUNGS|FOT|SEGVE|HEXIT|HOCUT|TRIAL|WHEEL|CULDU|OLJEK|ZIKNO|CHIDE|CEC|KEVZU|WIPOG|ROOTY|LEDGE|LUPCI|OVLEE|OLINE|OTH|YUPVU|GAMMA|BOSVE|JANAS|ONP|CUTEL|DANES|ULKAW|FETUJ|ZIGPI|KULOA|AST|PULYI|PUGIC|WAVLU|HQM|OZALU|ULESS|SANDR|WONKU|ZOLGI|CARRO|HOOME|SEA,MZB|REDIN|PACIF|AVOLS|SXC|PAROL|DOYLE|EXERT|VTU|HENER|DEANO|KWANG|GOLET|GVO|AFOXY|ORCUT|FABEG|AVILA|MQO|FRAMS|CALIS|BLANC|WONGO|BSR|CARME|PEBBS|PENNI|SAGUE|SHOEY|EUGEN|TAILS|HADLY|SEEMS|STINS|PYE|FREES|GETER|CABEX|ENI|MERRI|FLUEN|EBBLS|HIDAK|OLRIO|TUNGS|FOT|SEGVE|HEXIT|HOCUT|TRIAL|WHEEL|CULDU|OLJEK|ZIKNO|CHIDE|CEC|KEVZU|WIPOG|ROOTY|LEDGE|LUPCI|OVLEE|OLINE|OTH|YUPVU|GAMMA|BOSVE|JANAS|ONP|CUTEL|DANES|ULKAW|FETUJ|ZIGPI|KULOA|AST|PULYI|PUGIC|WAVLU|HQM|OZALU|ULESS|SANDR|WONKU|ZOLGI|CARRO|HOOME|SEA,88,88,true,true,,exact_match
V270,C,CFB DANZI HIDAL CTR FAIDS SPENO GLYDE BOS,CFB|DANZI|HIDAL|CTR|FAIDS|SPENO|GLYDE|BOS,CFB|DANZI|HIDAL|CTR|FAIDS|SPENO|GLYDE|BOS,8,8,true,true,,exact_match
V272,C,BFV LIONS IRW,BFV|LIONS|IRW,BFV|LIONS|IRW,3,3,true,true,,exact_match
V273,C,FALLZ HAAYS HUO RAGER WECOL HNK,FALLZ|HAAYS|HUO|RAGER|WECOL|HNK,FALLZ|HAAYS|HUO|RAGER|WECOL|HNK,6,6,true,true,,exact_match
V274,C,PMM SAMME BLBBY VIO SARAN ORIEN PALOW POMPE INDEX MBS,PMM|SAMME|BLBBY|VIO|SARAN|ORIEN|PALOW|POMPE|INDEX|MBS,PMM|SAMME|BLBBY|VIO|SARAN|ORIEN|PALOW|POMPE|INDEX|MBS,10,10,true,true,,exact_match
V275,C,DQN CUBOB JINAK KLOEE,DQN|CUBOB|JINAK|KLOEE,DQN|CUBOB|JINAK|KLOEE,4,4,true,true,,exact_match
V276,C,RASHE HERDA MORTO RAV VAYRE OUTLT DUMMR FLOAT KATVE HIKES ARD RBV CASVI DIXIE ZIGGI GAMBY BILLZ MANTA PREPI,RASHE|HERDA|MORTO|RAV|VAYRE|OUTLT|DUMMR|FLOAT|KATVE|HIKES|ARD|RBV|CASVI|DIXIE|ZIGGI|GAMBY|BILLZ|MANTA|PREPI,RASHE|HERDA|MORTO|RAV|VAYRE|OUTLT|DUMMR|FLOAT|KATVE|HIKES|ARD|RBV|CASVI|DIXIE|ZIGGI|GAMBY|BILLZ|MANTA|PREPI,19,19,true,true,,exact_match
V277,C,ROD BUTYN NADIR OSBER FWA,ROD|BUTYN|NADIR|OSBER|FWA,ROD|BUTYN|NADIR|OSBER|FWA,5,5,true,true,,exact_match
V278,C,TXO HURIK PVW UKW ZUMKI BYP OKUCI MONTE RAKOC PRX LENYI GIGVE TXK WEEBR WARLO LOCUS HAMPT GLH CECAR LAARI SQS TOMLN NEEON CLOUT HANOP IGB UYSEF MINIM BESOM FIBER VUZ,TXO|HURIK|PVW|UKW|ZUMKI|BYP|OKUCI|MONTE|RAKOC|PRX|LENYI|GIGVE|TXK|WEEBR|WARLO|LOCUS|HAMPT|GLH|CECAR|LAARI|SQS|TOMLN|NEEON|CLOUT|HANOP|IGB|UYSEF|MINIM|BESOM|FIBER|VUZ,TXO|HURIK|PVW|UKW|ZUMKI|BYP|OKUCI|MONTE|RAKOC|PRX|LENYI|GIGVE|TXK|WEEBR|WARLO|LOCUS|HAMPT|GLH|CECAR|LAARI|SQS|TOMLN|NEEON|CLOUT|HANOP|IGB|UYSEF|MINIM|BESOM|FIBER|VUZ,31,31,true,true,,exact_match
V279,C,GUNNE ESSIE OJACE YOGGI FBC,GUNNE|ESSIE|OJACE|YOGGI|FBC,GUNNE|ESSIE|OJACE|YOGGI|FBC,5,5,true,true,,exact_match
V28,C,OAK SALAD ALTAM HAIRE ORANG LIN KATSO SPOOK RICHY HUYJO FMG,OAK|SALAD|ALTAM|HAIRE|ORANG|LIN|KATSO|SPOOK|RICHY|HUYJO|FMG,OAK|SALAD|ALTAM|HAIRE|ORANG|LIN|KATSO|SPOOK|RICHY|HUYJO|FMG,11,11,true,true,,exact_match
V280,C,FARCY ELP WHOLE CORUD PIO JAKKY HOPET CME FRAIZ CURIB DEBRA HIMRO KEBYO TXO ZULAK YACUL PNH UKDEW BROKE HINOD MMB RICBU CARKO WIPET HUT BUHLS STONS WILSY HEYDN DIETS TOP,FARCY|ELP|WHOLE|CORUD|PIO|JAKKY|HOPET|CME|FRAIZ|CURIB|DEBRA|HIMRO|KEBYO|TXO|ZULAK|YACUL|PNH|UKDEW|BROKE|HINOD|MMB|RICBU|CARKO|WIPET|HUT|BUHLS|STONS|WILSY|HEYDN|DIETS|TOP,U.S. MEXICAN BORDER-3|FARCY|ELP|WHOLE|CORUD|PIO|JAKKY|HOPET|CME|FRAIZ|CURIB|DEBRA|HIMRO|KEBYO|TXO|ZULAK|YACUL|PNH|UKDEW|BROKE|HINOD|MMB|RICBU|CARKO|WIPET|HUT|BUHLS|STONS|WILSY|HEYDN|DIETS|TOP,31,32,false,false,0,token_value_mismatch
V281,C,PSC BAKCA OZONI OLFUS ODECE MWH,PSC|BAKCA|OZONI|OLFUS|ODECE|MWH,PSC|BAKCA|OZONI|OLFUS|ODECE|MWH,6,6,true,true,,exact_match
V283,C,SLI JOGIT KAYOH FRETS HDF ACINS DAWNA RESOR LUCER BULGY HEC DANBY WHIGG WOPMA BOACH CRESO DICSA BLD,SLI|JOGIT|KAYOH|FRETS|HDF|ACINS|DAWNA|RESOR|LUCER|BULGY|HEC|DANBY|WHIGG|WOPMA|BOACH|CRESO|DICSA|BLD,SLI|JOGIT|KAYOH|FRETS|HDF|ACINS|DAWNA|RESOR|LUCER|BULGY|HEC|DANBY|WHIGG|WOPMA|BOACH|CRESO|DICSA|BLD,18,18,true,true,,exact_match
V284,C,SIE AZXEW VCN,SIE|AZXEW|VCN,SIE|AZXEW|VCN,3,3,true,true,,exact_match
V286,C,EKN DERIN TEAKK AANTS CSN FLUKY ANTNY BRV,EKN|DERIN|TEAKK|AANTS|CSN|FLUKY|ANTNY|BRV,EKN|DERIN|TEAKK|AANTS|CSN|FLUKY|ANTNY|BRV,8,8,true,true,,exact_match
V287,C,FJS GRENA EHPUG HIVEG FOBRO KLAMA OED AZURE KOLER CAMAS DEROY OTH ZUBOR RARES TICKY WOUDS CRAAF MCCOY UBG ENDZZ BTG ROARK COUGA MALAY TONNO OLM CARRO JUVGA ARPEE LOFAL PAE CVV,FJS|GRENA|EHPUG|HIVEG|FOBRO|KLAMA|OED|AZURE|KOLER|CAMAS|DEROY|OTH|ZUBOR|RARES|TICKY|WOUDS|CRAAF|MCCOY|UBG|ENDZZ|BTG|ROARK|COUGA|MALAY|TONNO|OLM|CARRO|JUVGA|ARPEE|LOFAL|PAE|CVV,FJS|GRENA|EHPUG|HIVEG|FOBRO|KLAMA|OED|AZURE|KOLER|CAMAS|DEROY|OTH|ZUBOR|RARES|TICKY|WOUDS|CRAAF|MCCOY|UBG|ENDZZ|BTG|ROARK|COUGA|MALAY|TONNO|OLM|CARRO|JUVGA|ARPEE|LOFAL|PAE|CVV,32,32,true,true,,exact_match
V288,C,LCU SWITZ BEARR CORIN NIWTE FBR,LCU|SWITZ|BEARR|CORIN|NIWTE|FBR,LCU|SWITZ|BEARR|CORIN|NIWTE|FBR,6,6,true,true,,exact_match
V289,C,LFK AFRUH ARMOR PIPES GGG SKIDI NEVER LASSA DOGGE TXK CUGSO PROVO UMPIR BATEZ UVUZU FSM FIGGS MULBY CASKS MADES MARBI HRO DGD MODNY MUPIE GOBEY PEKLE BACTA ZOREB VIH,LFK|AFRUH|ARMOR|PIPES|GGG|SKIDI|NEVER|LASSA|DOGGE|TXK|CUGSO|PROVO|UMPIR|BATEZ|UVUZU|FSM|FIGGS|MULBY|CASKS|MADES|MARBI|HRO|DGD|MODNY|MUPIE|GOBEY|PEKLE|BACTA|ZOREB|VIH,LFK|AFRUH|ARMOR|PIPES|GGG|SKIDI|NEVER|LASSA|DOGGE|TXK|CUGSO|PROVO|UMPIR|BATEZ|UVUZU|FSM|FIGGS|MULBY|CASKS|MADES|MARBI|HRO|DGD|MODNY|MUPIE|GOBEY|PEKLE|BACTA|ZOREB|VIH,30,30,true,true,,exact_match
V29,C,ENO BLARE DQO MXE PTW HIKES ETX SLATT WHITT LVZ LECOR SCOFF WONGS NOSEE CFB CORTA VESPE TUMPS SYR,ENO|BLARE|DQO|MXE|PTW|HIKES|ETX|SLATT|WHITT|LVZ|LECOR|SCOFF|WONGS|NOSEE|CFB|CORTA|VESPE|TUMPS|SYR,ENO|BLARE|DQO|MXE|PTW|HIKES|ETX|SLATT|WHITT|LVZ|LECOR|SCOFF|WONGS|NOSEE|CFB|CORTA|VESPE|TUMPS|SYR,19,19,true,true,,exact_match
V290,C,SHANE NATTS BOOME OBEPE MOL ROMAN BRAIL ARVON FAK TYI KENIR WEMOX PUNGO,SHANE|NATTS|BOOME|OBEPE|MOL|ROMAN|BRAIL|ARVON|FAK|TYI|KENIR|WEMOX|PUNGO,SHANE|NATTS|BOOME|OBEPE|MOL|ROMAN|BRAIL|ARVON|FAK|TYI|KENIR|WEMOX|PUNGO,13,13,true,true,,exact_match
V291,C,HOB WOKAM HEBIX BOZDA CME DUPAL BUCZO CNX CADVO CYOTE ABQ HEXEM AROYO LORAT EMUXE BLINI GUP DODAH GRINT FORAN INW TAWNE FLG KACEE PGS,HOB|WOKAM|HEBIX|BOZDA|CME|DUPAL|BUCZO|CNX|CADVO|CYOTE|ABQ|HEXEM|AROYO|LORAT|EMUXE|BLINI|GUP|DODAH|GRINT|FORAN|INW|TAWNE|FLG|KACEE|PGS,HOB|WOKAM|HEBIX|BOZDA|CME|DUPAL|BUCZO|CNX|CADVO|CYOTE|ABQ|HEXEM|AROYO|LORAT|EMUXE|BLINI|GUP|DODAH|GRINT|FORAN|INW|TAWNE|FLG|KACEE|PGS,25,25,true,true,,exact_match
V292,C,HNK RIMBA SAGES WIGAN BOWAN MOBBS SASHA TOMES BAF GLYDE BOS,HNK|RIMBA|SAGES|WIGAN|BOWAN|MOBBS|SASHA|TOMES|BAF|GLYDE|BOS,HNK|RIMBA|SAGES|WIGAN|BOWAN|MOBBS|SASHA|TOMES|BAF|GLYDE|BOS,11,11,true,true,,exact_match
V293,C,GCN KLIFF PGA ACOSI CABER BCE EHK BERYL ILC DOTME EPUHE ELY HARRV INGOL JEBEG YANKU SIKEE DUCAY BQU ARAYI YOBBO YIKUK SAMAN YIRUR TWF WALIL GOODE TORIN DERSO SIDZY PEPUC DNJ,GCN|KLIFF|PGA|ACOSI|CABER|BCE|EHK|BERYL|ILC|DOTME|EPUHE|ELY|HARRV|INGOL|JEBEG|YANKU|SIKEE|DUCAY|BQU|ARAYI|YOBBO|YIKUK|SAMAN|YIRUR|TWF|WALIL|GOODE|TORIN|DERSO|SIDZY|PEPUC|DNJ,GCN|KLIFF|PGA|ACOSI|CABER|BCE|EHK|BERYL|ILC|DOTME|EPUHE|ELY|HARRV|INGOL|JEBEG|YANKU|SIKEE|DUCAY|BQU|ARAYI|YOBBO|YIKUK|SAMAN|YIRUR|TWF|WALIL|GOODE|TORIN|DERSO|SIDZY|PEPUC|DNJ,32,32,true,true,,exact_match
V294,C,DSM SINGR NASAL RIDCO GUERN CID SOLUM BILOX CVA,DSM|SINGR|NASAL|RIDCO|GUERN|CID|SOLUM|BILOX|CVA,DSM|SINGR|NASAL|RIDCO|GUERN|CID|SOLUM|BILOX|CVA,9,9,true,true,,exact_match
V296,C,HUSTN CLINE LILLS RAEFO LORRY FAY GANDS ZUNIT RAPVY YOAST URRIE ILM,HUSTN|CLINE|LILLS|RAEFO|LORRY|FAY|GANDS|ZUNIT|RAPVY|YOAST|URRIE|ILM,HUSTN|CLINE|LILLS|RAEFO|LORRY|FAY|GANDS|ZUNIT|RAPVY|YOAST|URRIE|ILM,12,12,true,true,,exact_match
V298,C,SEA VAMPS BANDR BEEZR THICK PERTT DATVE SELAH YKM SUNED BENTY PSC GAWWY GINLE OLODE PDT CABAN EYUYA HAGRD IBEAM SUMOQ DNJ YOWLS DBS SABAT LAMON RELAE QUIRT NECIT NALSI DNW BOY HIKOX DDY CESPI CHANG JENNE GCC,SEA|VAMPS|BANDR|BEEZR|THICK|PERTT|DATVE|SELAH|YKM|SUNED|BENTY|PSC|GAWWY|GINLE|OLODE|PDT|CABAN|EYUYA|HAGRD|IBEAM|SUMOQ|DNJ|YOWLS|DBS|SABAT|LAMON|RELAE|QUIRT|NECIT|NALSI|DNW|BOY|HIKOX|DDY|CESPI|CHANG|JENNE|GCC,SEA|VAMPS|BANDR|BEEZR|THICK|PERTT|DATVE|SELAH|YKM|SUNED|BENTY|PSC|GAWWY|GINLE|OLODE|PDT|CABAN|EYUYA|HAGRD|IBEAM|SUMOQ|DNJ|YOWLS|DBS|SABAT|LAMON|RELAE|QUIRT|NECIT|NALSI|DNW|BOY|HIKOX|DDY|CESPI|CHANG|JENNE|GCC,38,38,true,true,,exact_match
V299,C,LAX SADDE VTU ACRAT FIM ZUWNI WOTOK GMN,LAX|SADDE|VTU|ACRAT|FIM|ZUWNI|WOTOK|GMN,LAX|SADDE|VTU|ACRAT|FIM|ZUWNI|WOTOK|GMN,8,8,true,true,,exact_match
V3,C,EYW BIPIN JANKA GUCEL DROWN TWNNS MNATE DHP FLL PBI MORGA SMUGS MLB INDIA TICCO MALET FORNI OAKIE SMYRA MIKBE OMN SEBAG VEDRA LLIPS TOMDY SSI BROUN HARPS WOHPY KELER SAV REBUS OWENS FLO IDEBE DUNGY TOWEY TESYU SDZ OCHOC MOATS RDU ESTMA STEMM YITUP OXFRD HARVY DOCMO NUTTS CARML FAK GVE WITTO LURAY KERRE AANTS HOAGE MRB RUANE EMI VINNY KITHE MERLL GLOMO MXE FROSE MUDNE DASDE MAZIE HARRS BIGGY SBJ PIYIN FALLZ NYACK CMK RACEY SORRY YALER HFD JEWIT FOSTY WOONS MILIS BOS,EYW|BIPIN|JANKA|GUCEL|DROWN|TWNNS|MNATE|DHP|FLL|PBI|MORGA|SMUGS|MLB|INDIA|TICCO|MALET|FORNI|OAKIE|SMYRA|MIKBE|OMN|SEBAG|VEDRA|LLIPS|TOMDY|SSI|BROUN|HARPS|WOHPY|KELER|SAV|REBUS|OWENS|FLO|IDEBE|DUNGY|TOWEY|TESYU|SDZ|OCHOC|MOATS|RDU|ESTMA|STEMM|YITUP|OXFRD|HARVY|DOCMO|NUTTS|CARML|FAK|GVE|WITTO|LURAY|KERRE|AANTS|HOAGE|MRB|RUANE|EMI|VINNY|KITHE|MERLL|GLOMO|MXE|FROSE|MUDNE|DASDE|MAZIE|HARRS|BIGGY|SBJ|PIYIN|FALLZ|NYACK|CMK|RACEY|SORRY|YALER|HFD|JEWIT|FOSTY|WOONS|MILIS|BOS,EYW|BIPIN|JANKA|GUCEL|DROWN|TWNNS|MNATE|DHP|FLL|PBI|MORGA|SMUGS|MLB|INDIA|TICCO|MALET|FORNI|OAKIE|SMYRA|MIKBE|OMN|SEBAG|VEDRA|LLIPS|TOMDY|SSI|BROUN|HARPS|WOHPY|KELER|SAV|REBUS|OWENS|FLO|IDEBE|DUNGY|TOWEY|TESYU|SDZ|OCHOC|MOATS|RDU|ESTMA|STEMM|YITUP|OXFRD|HARVY|DOCMO|NUTTS|CARML|FAK|GVE|WITTO|LURAY|KERRE|AANTS|HOAGE|MRB|RUANE|EMI|VINNY|KITHE|MERLL|GLOMO|MXE|FROSE|MUDNE|DASDE|MAZIE|HARRS|BIGGY|SBJ|PIYIN|FALLZ|NYACK|CMK|RACEY|SORRY|YALER|HFD|JEWIT|FOSTY|WOONS|MILIS|BOS,85,85,true,true,,exact_match
V3,H,MYNAH JASON MUE TIGAH VELLA PARIS,MYNAH|JASON|MUE|TIGAH|VELLA|PARIS,MYNAH|JASON|MUE|TIGAH|VELLA|PARIS,6,6,true,true,,exact_match
V30,C,BAE SQUIB SALES PMM PSB SEG PINNA ETX TROXL BOPLY LANNA SBJ,BAE|SQUIB|SALES|PMM|PSB|SEG|PINNA|ETX|TROXL|BOPLY|LANNA|SBJ,BAE|SQUIB|SALES|PMM|PSB|SEG|PINNA|ETX|TROXL|BOPLY|LANNA|SBJ,12,12,true,true,,exact_match
V300,C,SSM ALVUS RIBIR IILND NAASH MRUCI,SSM|ALVUS|RIBIR|IILND|NAASH|MRUCI,SSM|ALVUS|RIBIR|U.S. CANADIAN BORDER-3|U.S. CANADIAN BORDER-12|IILND|NAASH|MRUCI|U.S. CANADIAN BORDER-8,6,9,false,false,3,token_value_mismatch
V301,A,FAI FIBEX BACMY DIFER FYU,FAI|FIBEX|BACMY|DIFER|FYU,FAI|FIBEX|BACMY|DIFER|FYU,5,5,true,true,,exact_match
V301,C,PXN KARNN BORED BUSHY SUNOL OAK COMMO MICRA PYE ROZZA KLOGE RUMSY ILA,PXN|KARNN|BORED|BUSHY|SUNOL|OAK|COMMO|MICRA|PYE|ROZZA|KLOGE|RUMSY|ILA,PXN|KARNN|BORED|BUSHY|SUNOL|OAK|COMMO|MICRA|PYE|ROZZA|KLOGE|RUMSY|ILA,13,13,true,true,,exact_match
V302,A,FAI EVVOJ AYKID MAYPO FYU,FAI|EVVOJ|AYKID|MAYPO|FYU,FAI|EVVOJ|AYKID|MAYPO|FYU,5,5,true,true,,exact_match
V302,C,AUG RAZZR ANCOR,AUG|RAZZR|ANCOR,AUG|RAZZR|ANCOR,3,3,true,true,,exact_match
V303,C,HOT BLURB BLIMP IXEYA FSM,HOT|BLURB|BLIMP|IXEYA|FSM,HOT|BLURB|BLIMP|IXEYA|FSM,5,5,true,true,,exact_match
V305,C,ELD BUNNS LIT DUMPI UKORE JEBEP ARG CNG WESON PXV AUGUS WEGEE EYTEJ OOM ZARHO VHP,ELD|BUNNS|LIT|DUMPI|UKORE|JEBEP|ARG|CNG|WESON|PXV|AUGUS|WEGEE|EYTEJ|OOM|ZARHO|VHP,ELD|BUNNS|LIT|DUMPI|UKORE|JEBEP|ARG|CNG|WESON|PXV|AUGUS|WEGEE|EYTEJ|OOM|ZARHO|VHP,16,16,true,true,,exact_match
V306,C,JCT CORVY FLIES AMUSE CWK HOOKK ILEXY JAYJO BLUBL COUTH TNV GOMER ZMSKL CLEEP DAS KIELL SILBE KUUPR OFERS STRUT LCH,JCT|CORVY|FLIES|AMUSE|CWK|HOOKK|ILEXY|JAYJO|BLUBL|COUTH|TNV|GOMER|ZMSKL|CLEEP|DAS|KIELL|SILBE|KUUPR|OFERS|STRUT|LCH,JCT|CORVY|FLIES|AMUSE|CWK|HOOKK|ILEXY|JAYJO|BLUBL|COUTH|TNV|GOMER|ZMSKL|CLEEP|DAS|KIELL|SILBE|KUUPR|OFERS|STRUT|LCH,21,21,true,true,,exact_match
V308,A,BET FISHH CERGU WAKOX SQA,BET|FISHH|CERGU|WAKOX|SQA,BET|FISHH|CERGU|WAKOX|SQA,5,5,true,true,,exact_match
V309,A,WAZUR ANN,WAZUR|ANN,U.S. CANADIAN BORDER-4|WAZUR|ANN,2,3,false,false,0,token_value_mismatch
V309,C,HVQ KETTA JULEA RANDE BURGS KIVGE AIR,HVQ|KETTA|JULEA|RANDE|BURGS|KIVGE|AIR,HVQ|KETTA|JULEA|RANDE|BURGS|KIVGE|AIR,7,7,true,true,,exact_match
V310,C,IIU MAUDD DARBY UNCKL DOLLY LOZ JARAM ROSAR YUMMY HMV STAIN MULBE BURCH GSO KIMES HOJPA SNOWS CHAPL RDU ZEBUL EXULE FEBEL TYI CHWAN RJBOB ECG,IIU|MAUDD|DARBY|UNCKL|DOLLY|LOZ|JARAM|ROSAR|YUMMY|HMV|STAIN|MULBE|BURCH|GSO|KIMES|HOJPA|SNOWS|CHAPL|RDU|ZEBUL|EXULE|FEBEL|TYI|CHWAN|RJBOB|ECG,IIU|MAUDD|DARBY|UNCKL|DOLLY|LOZ|JARAM|ROSAR|YUMMY|HMV|STAIN|MULBE|BURCH|GSO|KIMES|HOJPA|SNOWS|CHAPL|RDU|ZEBUL|EXULE|FEBEL|TYI|CHWAN|RJBOB|ECG,26,26,true,true,,exact_match
V311,A,ANN DWARF ERANE UDENE TOKEE WIBTA FLIPS BKA,ANN|DWARF|ERANE|UDENE|TOKEE|WIBTA|FLIPS|BKA,ANN|DWARF|ERANE|UDENE|TOKEE|WIBTA|FLIPS|BKA,8,8,true,true,,exact_match
V311,C,HCH KIRCH DUBBS MADOL NELLO AWSON CORCE ELW,HCH|KIRCH|DUBBS|MADOL|NELLO|AWSON|CORCE|ELW,HCH|KIRCH|DUBBS|MADOL|NELLO|AWSON|CORCE|ELW,8,8,true,true,,exact_match
V312,C,POLLA PALEO GOLDA DEWIR TACKS UKIEY CANUV OOD ALBEK INNEZ DITCH CYN JIMEE FALON WINKK DRIFT PREPI,POLLA|PALEO|GOLDA|DEWIR|TACKS|UKIEY|CANUV|OOD|ALBEK|INNEZ|DITCH|CYN|JIMEE|FALON|WINKK|DRIFT|PREPI,POLLA|PALEO|GOLDA|DEWIR|TACKS|UKIEY|CANUV|OOD|ALBEK|INNEZ|DITCH|CYN|JIMEE|FALON|WINKK|DRIFT|PREPI,17,17,true,true,,exact_match
V313,C,ENL CORKI AQUAS AXC,ENL|CORKI|AQUAS|AXC,ENL|CORKI|AQUAS|AXC,4,4,true,true,,exact_match
V315,C,PRX PGO,PRX|PGO,PRX|PGO,2,2,true,true,,exact_match
V316,C,IWD COTMO SAW,IWD|COTMO|SAW,IWD|COTMO|SAW,3,3,true,true,,exact_match
V317,A,CFTBX ANN GIRTS GESTI DOOZI LVD TURKS ZARUT HOODS WIVEK SSR RUKIE CSPER HAPIT,CFTBX|ANN|GIRTS|GESTI|DOOZI|LVD|TURKS|ZARUT|HOODS|WIVEK|SSR|RUKIE|CSPER|HAPIT,U.S. CANADIAN BORDER-3|CFTBX|ANN|GIRTS|GESTI|DOOZI|LVD|TURKS|ZARUT|HOODS|WIVEK|SSR|RUKIE|CSPER|HAPIT,14,15,false,false,0,token_value_mismatch
V317,C,MZB PGY BROWS JONDA IPL,MZB|PGY|BROWS|JONDA|IPL,MZB|PGY|BROWS|JONDA|IPL,5,5,true,true,,exact_match
V319,A,YAK WORTT MALAS FORAT KATAT CASEL EYAKS JOH ZIMUR NAKED PEPPI EDELE SNRIS TED YONEK TORTE VEILL SPARV SQA ACRAN VIDDA WEEKE BET ROLLR ARSEN FANCI JOTPU HPB,YAK|WORTT|MALAS|FORAT|KATAT|CASEL|EYAKS|JOH|ZIMUR|NAKED|PEPPI|EDELE|SNRIS|TED|YONEK|TORTE|VEILL|SPARV|SQA|ACRAN|VIDDA|WEEKE|BET|ROLLR|ARSEN|FANCI|JOTPU|HPB,YAK|WORTT|MALAS|FORAT|KATAT|CASEL|EYAKS|JOH|ZIMUR|NAKED|PEPPI|EDELE|SNRIS|TED|YONEK|TORTE|VEILL|SPARV|SQA|ACRAN|VIDDA|WEEKE|BET|ROLLR|ARSEN|FANCI|JOTPU|HPB,28,28,true,true,,exact_match
V319,C,BOY ZURNA RLY ALVIL CRANY COD,BOY|ZURNA|RLY|ALVIL|CRANY|COD,BOY|ZURNA|RLY|ALVIL|CRANY|COD,6,6,true,true,,exact_match
V32,C,FMG OHOSO HZN HOTIC LLC ZUSRU FESKO WIKLO BAM JOKNA OLGAA BQU SPATS UHEPI BVL ZONSU BAGGI CEVAR YADDY STACO WEGET SALTA TCH COOLI EXILE FBR,FMG|OHOSO|HZN|HOTIC|LLC|ZUSRU|FESKO|WIKLO|BAM|JOKNA|OLGAA|BQU|SPATS|UHEPI|BVL|ZONSU|BAGGI|CEVAR|YADDY|STACO|WEGET|SALTA|TCH|COOLI|EXILE|FBR,FMG|OHOSO|HZN|HOTIC|LLC|ZUSRU|FESKO|WIKLO|BAM|JOKNA|OLGAA|BQU|SPATS|UHEPI|BVL|ZONSU|BAGGI|CEVAR|YADDY|STACO|WEGET|SALTA|TCH|COOLI|EXILE|FBR,26,26,true,true,,exact_match
V320,A,MCG IRUCU ERLAN WINOR FFITZ FRIDA RUNTL BDRIK KAYTI TED HOPER MURYY NELLI KEBAB JOH,MCG|IRUCU|ERLAN|WINOR|FFITZ|FRIDA|RUNTL|BDRIK|KAYTI|TED|HOPER|MURYY|NELLI|KEBAB|JOH,MCG|IRUCU|ERLAN|WINOR|FFITZ|FRIDA|RUNTL|BDRIK|KAYTI|TED|HOPER|MURYY|NELLI|KEBAB|JOH,15,15,true,true,,exact_match
V320,C,PLN LORIW IROTO ADENO TIDDU SKIPR TVC ZOLOX ICADA MOP MBS,PLN|LORIW|IROTO|ADENO|TIDDU|SKIPR|TVC|ZOLOX|ICADA|MOP|MBS,PLN|LORIW|IROTO|ADENO|TIDDU|SKIPR|TVC|ZOLOX|ICADA|MOP|MBS,11,11,true,true,,exact_match
V321,A,EHM DAJOB EXIPE AKN OSKOE BATTY AUGEY ELDOH HOM,EHM|DAJOB|EXIPE|AKN|OSKOE|BATTY|AUGEY|ELDOH|HOM,EHM|DAJOB|EXIPE|AKN|OSKOE|BATTY|AUGEY|ELDOH|HOM,9,9,true,true,,exact_match
V321,C,PZD KUTVE DUVAT LUMPP PREST RSVLT JALVO LGC HEFIN JAMUD HOKES GAD BOAZE ALBER OWENT RQZ VOYUD JEKBA ATWUS KUXYI SYI PECON GRILL LVT,PZD|KUTVE|DUVAT|LUMPP|PREST|RSVLT|JALVO|LGC|HEFIN|JAMUD|HOKES|GAD|BOAZE|ALBER|OWENT|RQZ|VOYUD|JEKBA|ATWUS|KUXYI|SYI|PECON|GRILL|LVT,PZD|KUTVE|DUVAT|LUMPP|PREST|RSVLT|JALVO|LGC|HEFIN|JAMUD|HOKES|GAD|BOAZE|ALBER|OWENT|RQZ|VOYUD|JEKBA|ATWUS|KUXYI|SYI|PECON|GRILL|LVT,24,24,true,true,,exact_match
V322,A,AKN KONIC WORRI MALLT HOM,AKN|KONIC|WORRI|MALLT|HOM,AKN|KONIC|WORRI|MALLT|HOM,5,5,true,true,,exact_match
V323,C,MGM FITTZ PEECH KOMER EUF RENFO PREST WILMS,MGM|FITTZ|PEECH|KOMER|EUF|RENFO|PREST|WILMS,MGM|FITTZ|PEECH|KOMER|EUF|RENFO|PREST|WILMS,8,8,true,true,,exact_match
V324,C,GCC DEBBI CZI CHAPY RLY,GCC|DEBBI|CZI|CHAPY|RLY,GCC|DEBBI|CZI|CHAPY|RLY,5,5,true,true,,exact_match
