airwayId,airwayLocation,airwayStringRaw,airwayStringTokens,orderedSegValues,tokenCount,pointRowCount,exactTokenMatch,normalizedTokenMatch,firstMismatchIndex,mismatchReason
Q902,A,OTZ FAI HRDNG RDFLG ORT AYZOL WOGUS SSR HOODS LVD DOOZI GESTI ANN HIGHE DISCO ROSLN SEA,OTZ|FAI|HRDNG|RDFLG|ORT|AYZOL|WOGUS|SSR|HOODS|LVD|DOOZI|GESTI|ANN|HIGHE|DISCO|ROSLN|SEA,OTZ|FAI|HRDNG|RDFLG|ORT|AYZOL|U.S. CANADIAN BORDER-1|U.S. CANADIAN BORDER-2|WOGUS|SSR|HOODS|LVD|DOOZI|GESTI|ANN|HIGHE|U.S. CANADIAN BORDER-4|U.S. CANADIAN BORDER-5|DISCO|ROSLN|SEA,17,21,false,false,6,token_value_mismatch
Q905,C,HOCKE CFJBZ,HOCKE|CFJBZ,HOCKE|CFJBZ|U.S. CANADIAN BORDER-1,2,3,false,false,2,token_count_mismatch
Q907,C,POSTS PADDE SVM GADAV ATENE IMAMA,POSTS|PADDE|SVM|GADAV|ATENE|IMAMA,POSTS|PADDE|SVM|GADAV|U.S. CANADIAN BORDER-5|U.S. CANADIAN BORDER-3|ATENE|IMAMA|U.S. CANADIAN BORDER-4,6,9,false,false,4,token_value_mismatch
Q913,C,RAKAM CABCI TOPPS,RAKAM|CABCI|TOPPS,U.S. CANADIAN BORDER-1|RAKAM|CABCI|TOPPS,3,4,false,false,0,token_value_mismatch
Q917,C,SSM CFNBP CFRCC CFPWF CFSKX HOZIR WOZEE,SSM|CFNBP|CFRCC|CFPWF|CFSKX|HOZIR|WOZEE,SSM|CFNBP|U.S. CANADIAN BORDER-1|U.S. CANADIAN BORDER-3|CFRCC|CFPWF|U.S. CANADIAN BORDER-4|U.S. CANADIAN BORDER-2|CFSKX|HOZIR|WOZEE,7,11,false,false,2,token_value_mismatch
Q92,C,CHUWY KUTCH WYYTE MAASI HANKU JORDY,CHUWY|KUTCH|WYYTE|MAASI|HANKU|JORDY,CHUWY|KUTCH|WYYTE|MAASI|HANKU|JORDY,6,6,true,true,,exact_match
Q923,C,HOCKE CFNBB,HOCKE|CFNBB,HOCKE|CFNBB|U.S. CANADIAN BORDER-1,2,3,false,false,2,token_count_mismatch
Q924,C,DLH VURLY WEMAN SUZLI UDORY HUDRU BYPOR MECNU BEKRR,DLH|VURLY|WEMAN|SUZLI|UDORY|HUDRU|BYPOR|MECNU|BEKRR,DLH|VURLY|WEMAN|SUZLI|UDORY|HUDRU|BYPOR|MECNU|BEKRR|U.S. CANADIAN BORDER-1,9,10,false,false,9,token_count_mismatch
Q93,C,MCLAW VAULT LINEY FOBIN EBAYY MALET DEBRL KENLL PRMUS WOPNR GIPPL SUSYQ ISUZO GURGE FISHO QUIWE JEPEX BENBY DOOGE HAPKI TONIO OCASE HEVAN,MCLAW|VAULT|LINEY|FOBIN|EBAYY|MALET|DEBRL|KENLL|PRMUS|WOPNR|GIPPL|SUSYQ|ISUZO|GURGE|FISHO|QUIWE|JEPEX|BENBY|DOOGE|HAPKI|TONIO|OCASE|HEVAN,MCLAW|VAULT|LINEY|FOBIN|EBAYY|MALET|DEBRL|KENLL|PRMUS|WOPNR|GIPPL|SUSYQ|ISUZO|GURGE|FISHO|QUIWE|JEPEX|BENBY|DOOGE|HAPKI|TONIO|OCASE|HEVAN,23,23,true,true,,exact_match
Q935,C,MONEE HOCKE CFRCN CFTBR WOZEE HANKK JOSSY AUDIL FABEN PONCT GDM BOS,MONEE|HOCKE|CFRCN|CFTBR|WOZEE|HANKK|JOSSY|AUDIL|FABEN|PONCT|GDM|BOS,MONEE|HOCKE|CFRCN|U.S. CANADIAN BORDER-2|U.S. CANADIAN BORDER-1|CFTBR|WOZEE|HANKK|JOSSY|AUDIL|FABEN|PONCT|GDM|BOS,12,14,false,false,3,token_value_mismatch
Q937,C,TULEG WAYGO KRAZZ,TULEG|WAYGO|KRAZZ,U.S. CANADIAN BORDER-2|TULEG|WAYGO|KRAZZ,3,4,false,false,0,token_value_mismatch
Q94,C,WELUM MNGGO ROOLL,WELUM|MNGGO|ROOLL,WELUM|MNGGO|ROOLL,3,3,true,true,,exact_match
Q945,C,DIK OSMEE,DIK|OSMEE,DIK|OSMEE|U.S. CANADIAN BORDER-1,2,3,false,false,2,token_count_mismatch
Q951,C,POSTS PADDE SVM GADAV KATEK DAVDA SSENA TALNO KERVO DANOL,POSTS|PADDE|SVM|GADAV|KATEK|DAVDA|SSENA|TALNO|KERVO|DANOL,POSTS|PADDE|SVM|GADAV|U.S. CANADIAN BORDER-4|U.S. CANADIAN BORDER-1|KATEK|DAVDA|SSENA|TALNO|U.S. CANADIAN BORDER-2|U.S. CANADIAN BORDER-3|KERVO|DANOL|U.S. CANADIAN BORDER-5,10,15,false,false,4,token_value_mismatch
Q96,C,PURSE DODDL BFUNE GUNTR PIIXR FIZZL BAWER ROCCY SARAF KIMMR,PURSE|DODDL|BFUNE|GUNTR|PIIXR|FIZZL|BAWER|ROCCY|SARAF|KIMMR,PURSE|DODDL|BFUNE|GUNTR|PIIXR|FIZZL|BAWER|ROCCY|SARAF|KIMMR,10,10,true,true,,exact_match
Q97,C,TOVAR EBAYY MALET DEBRL KENLL PRMUS WOPNR JEVED CAKET ELMSZ YURCK ELLDE YEASO PAACK KOHLS SAWED KALDA ZJAAY PAJET CAANO TBONN ZIZZI YAZUU HEADI SAILN CCC NTMEG VENTE BLENO BEEKN FRIAR PQI,TOVAR|EBAYY|MALET|DEBRL|KENLL|PRMUS|WOPNR|JEVED|CAKET|ELMSZ|YURCK|ELLDE|YEASO|PAACK|KOHLS|SAWED|KALDA|ZJAAY|PAJET|CAANO|TBONN|ZIZZI|YAZUU|HEADI|SAILN|CCC|NTMEG|VENTE|BLENO|BEEKN|FRIAR|PQI,TOVAR|EBAYY|MALET|DEBRL|KENLL|PRMUS|WOPNR|JEVED|CAKET|ELMSZ|YURCK|ELLDE|YEASO|PAACK|KOHLS|SAWED|KALDA|ZJAAY|PAJET|CAANO|TBONN|ZIZZI|YAZUU|HEADI|SAILN|CCC|NTMEG|VENTE|BLENO|BEEKN|FRIAR|PQI,32,32,true,true,,exact_match
Q971,C,MOT CIPTA,MOT|CIPTA,MOT|CIPTA|U.S. CANADIAN BORDER-1,2,3,false,false,2,token_count_mismatch
Q98,C,HAKMN ZZYZX LAKRR DUZIT EEEZY PEEWE,HAKMN|ZZYZX|LAKRR|DUZIT|EEEZY|PEEWE,HAKMN|ZZYZX|LAKRR|DUZIT|EEEZY|PEEWE,6,6,true,true,,exact_match
Q99,C,KPASA DOFFY CAMJO HEPAR TEEEM BLAAN BWAGS EFFAY WNGUD POLYY RAANE OGRAE PEETT SHIRY UMBRE QUART HURLE,KPASA|DOFFY|CAMJO|HEPAR|TEEEM|BLAAN|BWAGS|EFFAY|WNGUD|POLYY|RAANE|OGRAE|PEETT|SHIRY|UMBRE|QUART|HURLE,KPASA|DOFFY|CAMJO|HEPAR|TEEEM|BLAAN|BWAGS|EFFAY|WNGUD|POLYY|RAANE|OGRAE|PEETT|SHIRY|UMBRE|QUART|HURLE,17,17,true,true,,exact_match
R2,A,ELF GLENT LAPLE PDN,ELF|GLENT|LAPLE|PDN,ELF|GLENT|LAPLE|PDN,4,4,true,true,,exact_match
R2010,A,FOMBU OWILY PUROY SEPFY ZEVMO PAHSI UKSEC OBACE HAAZY OWXUY SEBAW LUKEC ZUPAK TIKOW COBSU,FOMBU|OWILY|PUROY|SEPFY|ZEVMO|PAHSI|UKSEC|OBACE|HAAZY|OWXUY|SEBAW|LUKEC|ZUPAK|TIKOW|COBSU,FOMBU|OWILY|PUROY|SEPFY|ZEVMO|PAHSI|UKSEC|OBACE|HAAZY|OWXUY|SEBAW|LUKEC|ZUPAK|TIKOW|COBSU,15,15,true,true,,exact_match
R2015,A,COBSU UFMUP TECLY FIPAM VAZPU NEREE YICAX FOGID VULHO XADZY NAYTI TAWMO UCUXY OKVAW SAXRY ZUHXY ROVZU OWILY SSR,COBSU|UFMUP|TECLY|FIPAM|VAZPU|NEREE|YICAX|FOGID|VULHO|XADZY|NAYTI|TAWMO|UCUXY|OKVAW|SAXRY|ZUHXY|ROVZU|OWILY|SSR,COBSU|UFMUP|TECLY|FIPAM|VAZPU|NEREE|YICAX|FOGID|VULHO|XADZY|NAYTI|TAWMO|UCUXY|OKVAW|SAXRY|ZUHXY|ROVZU|OWILY|SSR,19,19,true,true,,exact_match
R2020,A,HAAZY BKA PAHSI ZOLKO WUSID SAROC TAWMO,HAAZY|BKA|PAHSI|ZOLKO|WUSID|SAROC|TAWMO,HAAZY|BKA|PAHSI|ZOLKO|WUSID|SAROC|TAWMO,7,7,true,true,,exact_match
R2025,A,OWXUY TECLY SUKVY LVD VAZPU,OWXUY|TECLY|SUKVY|LVD|VAZPU,OWXUY|TECLY|SUKVY|LVD|VAZPU,5,5,true,true,,exact_match
R204,C,KEITH KYWEE KERNE KEONE KALIN,KEITH|KYWEE|KERNE|KEONE|KALIN,KEITH|KYWEE|KERNE|KEONE|KALIN,5,5,true,true,,exact_match
R220,C,NODLE NICHO NOSHO NEONN NANZA NOLTI NAYLD NULUK NANDY NATES NIKLL NYMPH NUZAN NRKEY NIPPI,NODLE|NICHO|NOSHO|NEONN|NANZA|NOLTI|NAYLD|NULUK|NANDY|NATES|NIKLL|NYMPH|NUZAN|NRKEY|NIPPI,NODLE|NICHO|NOSHO|NEONN|NANZA|NOLTI|NAYLD|NULUK|NANDY|NATES|NIKLL|NYMPH|NUZAN|NRKEY|NIPPI,15,15,true,true,,exact_match
R330,C,POWAL SYA,POWAL|SYA,POWAL|SYA,2,2,true,true,,exact_match
R332,C,MAJ VAVEE,MAJ|VAVEE,MAJ|VAVEE,2,2,true,true,,exact_match
R337,C,ISGOG ROR,ISGOG|ROR,ISGOG|ROR,2,2,true,true,,exact_match
R338,A,OME ICEEE IDROD ROCET MUCLA MARCC MORLY NATES HEDMI,OME|ICEEE|IDROD|ROCET|MUCLA|MARCC|MORLY|NATES|HEDMI,OME|ICEEE|IDROD|ROCET|MUCLA|MARCC|MORLY|NATES|HEDMI,9,9,true,true,,exact_match
R341,C,NATES HAVAM OFORD HODDY PUGGY CHUUK ODK,NATES|HAVAM|OFORD|HODDY|PUGGY|CHUUK|ODK,NATES|HAVAM|OFORD|HODDY|PUGGY|CHUUK|ODK,7,7,true,true,,exact_match
R35,A,FDV JUJXI ADLEN,FDV|JUJXI|ADLEN,FDV|JUJXI|ADLEN,3,3,true,true,,exact_match
R451,C,HIXOR POWAL AAMYY WALLT CHIKI ADK,HIXOR|POWAL|AAMYY|WALLT|CHIKI|ADK,HIXOR|POWAL|AAMYY|WALLT|CHIKI|ADK,6,6,true,true,,exact_match
R463,C,MAGGI SERYU TOADS APACK AUNTI ADOPE AXELE ADTIL ALLBE ALCOA,MAGGI|SERYU|TOADS|APACK|AUNTI|ADOPE|AXELE|ADTIL|ALLBE|ALCOA,MAGGI|SERYU|TOADS|APACK|AUNTI|ADOPE|AXELE|ADTIL|ALLBE|ALCOA,10,10,true,true,,exact_match
R464,C,MAGGI BITTA BOARD BEKME BILLO BARAZ BAART BEBOP,MAGGI|BITTA|BOARD|BEKME|BILLO|BARAZ|BAART|BEBOP,MAGGI|BITTA|BOARD|BEKME|BILLO|BARAZ|BAART|BEBOP,8,8,true,true,,exact_match
R465,C,MAGGI SHARK CLUTS CEBEN CIVIT CORTT CUNDU CREAN CINNY,MAGGI|SHARK|CLUTS|CEBEN|CIVIT|CORTT|CUNDU|CREAN|CINNY,MAGGI|SHARK|CLUTS|CEBEN|CIVIT|CORTT|CUNDU|CREAN|CINNY,9,9,true,true,,exact_match
R507,C,GTK MRTEE LENUS ANTOX NOPIT SAPPO CONCH UTAHS,GTK|MRTEE|LENUS|ANTOX|NOPIT|SAPPO|CONCH|UTAHS,GTK|MRTEE|LENUS|ANTOX|NOPIT|SAPPO|CONCH|UTAHS,8,8,true,true,,exact_match
R56,C,LINND KENDA LARGE PENYT SLATN,LINND|KENDA|LARGE|PENYT|SLATN,LINND|KENDA|LARGE|PENYT|SLATN,5,5,true,true,,exact_match
R576,C,OGG ALAFU WAPPO ONOVY DENNS DRAYK DUSAC DIALO DADIE DUETS DINTY,OGG|ALAFU|WAPPO|ONOVY|DENNS|DRAYK|DUSAC|DIALO|DADIE|DUETS|DINTY,OGG|ALAFU|WAPPO|ONOVY|DENNS|DRAYK|DUSAC|DIALO|DADIE|DUETS|DINTY,11,11,true,true,,exact_match
R577,C,OGG AWAHI AZIBA TANFO ALICA EBBER ELOYI ERROT ETNIC ETECO EDSEL EDTOO ELKEY,OGG|AWAHI|AZIBA|TANFO|ALICA|EBBER|ELOYI|ERROT|ETNIC|ETECO|EDSEL|EDTOO|ELKEY,OGG|AWAHI|AZIBA|TANFO|ALICA|EBBER|ELOYI|ERROT|ETNIC|ETECO|EDSEL|EDTOO|ELKEY,13,13,true,true,,exact_match
R578,C,DEREC BYROW FITES FAPIS FOMAS FIZEL FLITY FOOTS FICKY,DEREC|BYROW|FITES|FAPIS|FOMAS|FIZEL|FLITY|FOOTS|FICKY,DEREC|BYROW|FITES|FAPIS|FOMAS|FIZEL|FLITY|FOOTS|FICKY,9,9,true,true,,exact_match
R580,C,OMOTO OGDEN OPHET OLCOT OPAKE ONEIL OBOYD OFORD OGGOE ONEOX ORVIL ORCCA HAMND,OMOTO|OGDEN|OPHET|OLCOT|OPAKE|ONEIL|OBOYD|OFORD|OGGOE|ONEOX|ORVIL|ORCCA|HAMND,OMOTO|OGDEN|OPHET|OLCOT|OPAKE|ONEIL|OBOYD|OFORD|OGGOE|ONEOX|ORVIL|ORCCA|HAMND,13,13,true,true,,exact_match
R584,C,CHOKO MCFLY MANRE MAZZA MAJ CURCH RASON LOOIS HAVNU TRADD PNI BIRUQ MICNO TKK DAMAY WUMVE GUNSS JUNIE OPLAR GUMGE UNZ OTTRE MIKYY KEITH,CHOKO|MCFLY|MANRE|MAZZA|MAJ|CURCH|RASON|LOOIS|HAVNU|TRADD|PNI|BIRUQ|MICNO|TKK|DAMAY|WUMVE|GUNSS|JUNIE|OPLAR|GUMGE|UNZ|OTTRE|MIKYY|KEITH,CHOKO|MCFLY|MANRE|MAZZA|MAJ|CURCH|RASON|LOOIS|HAVNU|TRADD|PNI|BIRUQ|MICNO|TKK|DAMAY|WUMVE|GUNSS|JUNIE|OPLAR|GUMGE|UNZ|OTTRE|MIKYY|KEITH,24,24,true,true,,exact_match
R585,C,CIVIT FLEXX GITLE GALIP AUDIA,CIVIT|FLEXX|GITLE|GALIP|AUDIA,CIVIT|FLEXX|GITLE|GALIP|AUDIA,5,5,true,true,,exact_match
R595,C,UNZ OTTRE MIKYY KEITH,UNZ|OTTRE|MIKYY|KEITH,UNZ|OTTRE|MIKYY|KEITH,4,4,true,true,,exact_match
R628,C,TANIA ZOLLA MENDL PEKRE SANNS ZQA,TANIA|ZOLLA|MENDL|PEKRE|SANNS|ZQA,TANIA|ZOLLA|MENDL|PEKRE|SANNS|ZQA,6,6,true,true,,exact_match
R760,C,COY GOUDA PJM,COY|GOUDA|PJM,COY|GOUDA|PJM,3,3,true,true,,exact_match
R763,C,LETON IORIO COUKY FOLLE JEFFO GTK RNTRY MACKI HARBG MUNOZ BQN,LETON|IORIO|COUKY|FOLLE|JEFFO|GTK|RNTRY|MACKI|HARBG|MUNOZ|BQN,LETON|IORIO|COUKY|FOLLE|JEFFO|GTK|RNTRY|MACKI|HARBG|MUNOZ|BQN,11,11,true,true,,exact_match
R888,C,COY MODUX,COY|MODUX,COY|MODUX,2,2,true,true,,exact_match
R99,A,DUT DIBWO LIJFY RANND SPY,DUT|DIBWO|LIJFY|RANND|SPY,DUT|DIBWO|LIJFY|RANND|SPY,5,5,true,true,,exact_match
RTE1,C,UTAHS BQN MAZ,UTAHS|BQN|MAZ,UTAHS|BQN|MAZ,3,3,true,true,,exact_match
RTE12,C,MAZ JOSHE VARNA SJU JETSS STT,MAZ|JOSHE|VARNA|SJU|JETSS|STT,MAZ|JOSHE|VARNA|SJU|JETSS|STT,6,6,true,true,,exact_match
RTE2,C,BQN PEBLO BOCCA SJU ISLLA FAJAR TOURO MALIE STT OSSEL COY,BQN|PEBLO|BOCCA|SJU|ISLLA|FAJAR|TOURO|MALIE|STT|OSSEL|COY,BQN|PEBLO|BOCCA|SJU|ISLLA|FAJAR|TOURO|MALIE|STT|OSSEL|COY,11,11,true,true,,exact_match
RTE3,C,UTAHS JAAWS SJU,UTAHS|JAAWS|SJU,UTAHS|JAAWS|SJU,3,3,true,true,,exact_match
RTE4,C,IDAHO BQN JOSHE MIGHT TUUNA VEDAS HAKVO SNOOZ COY,IDAHO|BQN|JOSHE|MIGHT|TUUNA|VEDAS|HAKVO|SNOOZ|COY,IDAHO|BQN|JOSHE|MIGHT|TUUNA|VEDAS|HAKVO|SNOOZ|COY,9,9,true,true,,exact_match
RTE5,C,BQN ROBLL PLING,BQN|ROBLL|PLING,BQN|ROBLL|PLING,3,3,true,true,,exact_match
RTE6,C,IDAHO ROBLL BEANO CORAF SJU CHAKA PALCO STT,IDAHO|ROBLL|BEANO|CORAF|SJU|CHAKA|PALCO|STT,IDAHO|ROBLL|BEANO|CORAF|SJU|CHAKA|PALCO|STT,8,8,true,true,,exact_match
RTE7,C,PLING SAALR DONKE SJU SANLO TUUNA GESSO,PLING|SAALR|DONKE|SJU|SANLO|TUUNA|GESSO,PLING|SAALR|DONKE|SJU|SANLO|TUUNA|GESSO,7,7,true,true,,exact_match
RTE9,C,BEWIK WIGUM CLAYO MIGHT GANBO SJU WALNA DEEDY VERMO,BEWIK|WIGUM|CLAYO|MIGHT|GANBO|SJU|WALNA|DEEDY|VERMO,BEWIK|WIGUM|CLAYO|MIGHT|GANBO|SJU|WALNA|DEEDY|VERMO,9,9,true,true,,exact_match
T200,C,CLL COUTH PRARI SEALY DREWZ MOLLR SBI,CLL|COUTH|PRARI|SEALY|DREWZ|MOLLR|SBI,CLL|COUTH|PRARI|SEALY|DREWZ|MOLLR|SBI,7,7,true,true,,exact_match
T201,C,MEVAE TRUEX FEGNO NUROE BORTZ,MEVAE|TRUEX|FEGNO|NUROE|BORTZ,MEVAE|TRUEX|FEGNO|NUROE|BORTZ,5,5,true,true,,exact_match
T202,C,GURSH AWRYT RICHE HUSTN FEGNO GANTS ZADEL,GURSH|AWRYT|RICHE|HUSTN|FEGNO|GANTS|ZADEL,GURSH|AWRYT|RICHE|HUSTN|FEGNO|GANTS|ZADEL,7,7,true,true,,exact_match
T203,C,ANDYS AWRYT ROUTH FADOS OREAD,ANDYS|AWRYT|ROUTH|FADOS|OREAD,ANDYS|AWRYT|ROUTH|FADOS|OREAD,5,5,true,true,,exact_match
T205,C,OCF OTK,OCF|OTK,OCF|OTK,2,2,true,true,,exact_match
T206,C,ENADE FADOS GOTHS NUROE ZADEL LIB SNOWS,ENADE|FADOS|GOTHS|NUROE|ZADEL|LIB|SNOWS,ENADE|FADOS|GOTHS|NUROE|ZADEL|LIB|SNOWS,7,7,true,true,,exact_match
T207,C,FOXAM MMKAY WALEE,FOXAM|MMKAY|WALEE,FOXAM|MMKAY|WALEE,3,3,true,true,,exact_match
T208,C,SIROC SAHND FOXAM SUUGR SMYRA OAKIE MALET TICCO INDIA DIMBY VALKA SULTY WIXED CLEFF DURRY BOBOE SHANC,SIROC|SAHND|FOXAM|SUUGR|SMYRA|OAKIE|MALET|TICCO|INDIA|DIMBY|VALKA|SULTY|WIXED|CLEFF|DURRY|BOBOE|SHANC,SIROC|SAHND|FOXAM|SUUGR|SMYRA|OAKIE|MALET|TICCO|INDIA|DIMBY|VALKA|SULTY|WIXED|CLEFF|DURRY|BOBOE|SHANC,17,17,true,true,,exact_match
T209,C,TBERT SPONG DOVER MILEN SARDY HEDIL BEANS WANSA COLON BLANE LUKES HRTWL REEDY PETON DUNKE ILEYO PELAM UNMAN STYLZ,TBERT|SPONG|DOVER|MILEN|SARDY|HEDIL|BEANS|WANSA|COLON|BLANE|LUKES|HRTWL|REEDY|PETON|DUNKE|ILEYO|PELAM|UNMAN|STYLZ,TBERT|SPONG|DOVER|MILEN|SARDY|HEDIL|BEANS|WANSA|COLON|BLANE|LUKES|HRTWL|REEDY|PETON|DUNKE|ILEYO|PELAM|UNMAN|STYLZ,19,19,true,true,,exact_match
T210,C,MILLP MHOUS GRNVL HADDE MISSM OHLEE MMKAY MRUTT GUANO KIZER EMSEE DAIYL AKOJO PUNQU VARZE WEZER,MILLP|MHOUS|GRNVL|HADDE|MISSM|OHLEE|MMKAY|MRUTT|GUANO|KIZER|EMSEE|DAIYL|AKOJO|PUNQU|VARZE|WEZER,MILLP|MHOUS|GRNVL|HADDE|MISSM|OHLEE|MMKAY|MRUTT|GUANO|KIZER|EMSEE|DAIYL|AKOJO|PUNQU|VARZE|WEZER,16,16,true,true,,exact_match
T211,C,OCF JUTTS CARRA PRKKS CRG,OCF|JUTTS|CARRA|PRKKS|CRG,OCF|JUTTS|CARRA|PRKKS|CRG,5,5,true,true,,exact_match
T212,C,RASHE SEG KIACK BLESS DIANO LVZ LAAYK QTIPP WEARD WEETS TRESA STUBY VEERS NELIE DARTH PUT,RASHE|SEG|KIACK|BLESS|DIANO|LVZ|LAAYK|QTIPP|WEARD|WEETS|TRESA|STUBY|VEERS|NELIE|DARTH|PUT,RASHE|SEG|KIACK|BLESS|DIANO|LVZ|LAAYK|QTIPP|WEARD|WEETS|TRESA|STUBY|VEERS|NELIE|DARTH|PUT,16,16,true,true,,exact_match
T213,C,IIU GAMKE GEENY MILAN ZESOD RID,IIU|GAMKE|GEENY|MILAN|ZESOD|RID,IIU|GAMKE|GEENY|MILAN|ZESOD|RID,6,6,true,true,,exact_match
T214,C,OREAD BORTZ THMSN ZADEL ORPEE,OREAD|BORTZ|THMSN|ZADEL|ORPEE,OREAD|BORTZ|THMSN|ZADEL|ORPEE,5,5,true,true,,exact_match
T215,C,BURGG GENOD HORAL HILTO HUTSI FLENR RISTE DACEL OLETE HUGEN IRVIN HYK NERVE GAMKE GEENY MILAN DEEKS BONOY CLEFT MAPPS SMARS CPTON,BURGG|GENOD|HORAL|HILTO|HUTSI|FLENR|RISTE|DACEL|OLETE|HUGEN|IRVIN|HYK|NERVE|GAMKE|GEENY|MILAN|DEEKS|BONOY|CLEFT|MAPPS|SMARS|CPTON,BURGG|GENOD|HORAL|HILTO|HUTSI|FLENR|RISTE|DACEL|OLETE|HUGEN|IRVIN|HYK|NERVE|GAMKE|GEENY|MILAN|DEEKS|BONOY|CLEFT|MAPPS|SMARS|CPTON,22,22,true,true,,exact_match
T216,C,PSB SWISS ZAGTI FQM ORDMO ELEXY LOPEZ LECOR LAAYK HAWLY RAGER CAMMO HELON SPECL IGN DEEDE MOONI JUDDS HFD THUMB ARENE SALEM GON TRAIT SEY NEWBE BENNT ACK,PSB|SWISS|ZAGTI|FQM|ORDMO|ELEXY|LOPEZ|LECOR|LAAYK|HAWLY|RAGER|CAMMO|HELON|SPECL|IGN|DEEDE|MOONI|JUDDS|HFD|THUMB|ARENE|SALEM|GON|TRAIT|SEY|NEWBE|BENNT|ACK,PSB|SWISS|ZAGTI|FQM|ORDMO|ELEXY|LOPEZ|LECOR|LAAYK|HAWLY|RAGER|CAMMO|HELON|SPECL|IGN|DEEDE|MOONI|JUDDS|HFD|THUMB|ARENE|SALEM|GON|TRAIT|SEY|NEWBE|BENNT|ACK,28,28,true,true,,exact_match
T217,C,HYK BOSTR HEDEN PRUDE SGH BONEE SJAAY DERRF GETCH GAYLE,HYK|BOSTR|HEDEN|PRUDE|SGH|BONEE|SJAAY|DERRF|GETCH|GAYLE,HYK|BOSTR|HEDEN|PRUDE|SGH|BONEE|SJAAY|DERRF|GETCH|GAYLE,10,10,true,true,,exact_match
T218,C,DLMAR GUYED LACIE SCOFF LAAYK TALLI COATE SAX,DLMAR|GUYED|LACIE|SCOFF|LAAYK|TALLI|COATE|SAX,DLMAR|GUYED|LACIE|SCOFF|LAAYK|TALLI|COATE|SAX,8,8,true,true,,exact_match
T219,A,DLG BROUS NACIP ACATE RUFVY MKLUK HPB,DLG|BROUS|NACIP|ACATE|RUFVY|MKLUK|HPB,DLG|BROUS|NACIP|ACATE|RUFVY|MKLUK|HPB,7,7,true,true,,exact_match
T220,C,MARCS CRAYS MEESO MNURE SEALY DREWZ MOLLR SBI,MARCS|CRAYS|MEESO|MNURE|SEALY|DREWZ|MOLLR|SBI,MARCS|CRAYS|MEESO|MNURE|SEALY|DREWZ|MOLLR|SBI,8,8,true,true,,exact_match
T221,C,MAZIE TROXL FJC BEERS ROCOY RITTY LAAYK TYYLR CFB,MAZIE|TROXL|FJC|BEERS|ROCOY|RITTY|LAAYK|TYYLR|CFB,MAZIE|TROXL|FJC|BEERS|ROCOY|RITTY|LAAYK|TYYLR|CFB,9,9,true,true,,exact_match
T222,A,SPY HYLEE ALIEN RUFVY BET HOLIN CABOT WOGAX IKUFU JILSI CYCAS UTICE JOANY MCG MEFRA SUCOD HEMRO ENN FAI,SPY|HYLEE|ALIEN|RUFVY|BET|HOLIN|CABOT|WOGAX|IKUFU|JILSI|CYCAS|UTICE|JOANY|MCG|MEFRA|SUCOD|HEMRO|ENN|FAI,SPY|HYLEE|ALIEN|RUFVY|BET|HOLIN|CABOT|WOGAX|IKUFU|JILSI|CYCAS|UTICE|JOANY|MCG|MEFRA|SUCOD|HEMRO|ENN|FAI,19,19,true,true,,exact_match
T223,A,ZIKNI ROGOC CEKBA PEDUJ DLG OCDIJ KOWOK ZUNOS SAHOK FAGIN FORAX NONDA BLUGA AMOTT GASTO TED,ZIKNI|ROGOC|CEKBA|PEDUJ|DLG|OCDIJ|KOWOK|ZUNOS|SAHOK|FAGIN|FORAX|NONDA|BLUGA|AMOTT|GASTO|TED,ZIKNI|ROGOC|CEKBA|PEDUJ|DLG|OCDIJ|KOWOK|ZUNOS|SAHOK|FAGIN|FORAX|NONDA|BLUGA|AMOTT|GASTO|TED,16,16,true,true,,exact_match
T224,C,PSX KEEDS MOLLR FRYED MOCKS SHWNN WASPY KNZLY HAYES ARTEL CRISP MICRO ZIROR DAFLY LULEW BUDAM MYRIC WOVON DONBE AWDAD SIMBY VOODO KJAAY SNAKI SLIDD CLERY MUDDA WTERS NESFE BUGLE SQWID LYNRD AXSIS AXEJA TENSA WIILL PICKS ALOON MGMRY GONDR RSVLT CANER GRANT HUZER SMARR SINCA GLOSS MADDI JOTNO DACHA UGAAA JOSPI BOWMN HARTI ECITY PEDAL DOODD TUXDO STYLZ GENOD SWENK VAESE BONZE SANFI JOTTA INGON PROVE MAYOS LEAKS UFFIN MCDON YUDUG NUTTS WAVES TAPPA COLIN SHLBK QUENS PRNCZ GARED CHOPS ORETE HEDGE RIDGY CANNY ENO BRIEF JIIMS LEBVE CYN WHITE DIXIE MOVFA JFK KEEPM TRANZ JAFFY CCC KEYED VIKKY CREAM FLIBB YODER KURTY SALEM YANTC JEWIT FOSTY HEFTY WOONS MILIS BOS,PSX|KEEDS|MOLLR|FRYED|MOCKS|SHWNN|WASPY|KNZLY|HAYES|ARTEL|CRISP|MICRO|ZIROR|DAFLY|LULEW|BUDAM|MYRIC|WOVON|DONBE|AWDAD|SIMBY|VOODO|KJAAY|SNAKI|SLIDD|CLERY|MUDDA|WTERS|NESFE|BUGLE|SQWID|LYNRD|AXSIS|AXEJA|TENSA|WIILL|PICKS|ALOON|MGMRY|GONDR|RSVLT|CANER|GRANT|HUZER|SMARR|SINCA|GLOSS|MADDI|JOTNO|DACHA|UGAAA|JOSPI|BOWMN|HARTI|ECITY|PEDAL|DOODD|TUXDO|STYLZ|GENOD|SWENK|VAESE|BONZE|SANFI|JOTTA|INGON|PROVE|MAYOS|LEAKS|UFFIN|MCDON|YUDUG|NUTTS|WAVES|TAPPA|COLIN|SHLBK|QUENS|PRNCZ|GARED|CHOPS|ORETE|HEDGE|RIDGY|CANNY|ENO|BRIEF|JIIMS|LEBVE|CYN|WHITE|DIXIE|MOVFA|JFK|KEEPM|TRANZ|JAFFY|CCC|KEYED|VIKKY|CREAM|FLIBB|YODER|KURTY|SALEM|YANTC|JEWIT|FOSTY|HEFTY|WOONS|MILIS|BOS,PSX|KEEDS|MOLLR|FRYED|MOCKS|SHWNN|WASPY|KNZLY|HAYES|ARTEL|CRISP|MICRO|ZIROR|DAFLY|LULEW|BUDAM|MYRIC|WOVON|DONBE|AWDAD|SIMBY|VOODO|KJAAY|SNAKI|SLIDD|CLERY|MUDDA|WTERS|NESFE|BUGLE|SQWID|LYNRD|AXSIS|AXEJA|TENSA|WIILL|PICKS|ALOON|MGMRY|GONDR|RSVLT|CANER|GRANT|HUZER|SMARR|SINCA|GLOSS|MADDI|JOTNO|DACHA|UGAAA|JOSPI|BOWMN|HARTI|ECITY|PEDAL|DOODD|TUXDO|STYLZ|GENOD|SWENK|VAESE|BONZE|SANFI|JOTTA|INGON|PROVE|MAYOS|LEAKS|UFFIN|MCDON|YUDUG|NUTTS|WAVES|TAPPA|COLIN|SHLBK|QUENS|PRNCZ|GARED|CHOPS|ORETE|HEDGE|RIDGY|CANNY|ENO|BRIEF|JIIMS|LEBVE|CYN|WHITE|DIXIE|MOVFA|JFK|KEEPM|TRANZ|JAFFY|CCC|KEYED|VIKKY|CREAM|FLIBB|YODER|KURTY|SALEM|YANTC|JEWIT|FOSTY|HEFTY|WOONS|MILIS|BOS,112,112,true,true,,exact_match
T225,A,HPB AKELT HUMLA ZIPIX ALMOT HERLA MKLUR UNK EDMON VENCE GAL KUHZE FECFO CHOKK NELTE TAL SATUE REEBA GOLLY MINTO FAI,HPB|AKELT|HUMLA|ZIPIX|ALMOT|HERLA|MKLUR|UNK|EDMON|VENCE|GAL|KUHZE|FECFO|CHOKK|NELTE|TAL|SATUE|REEBA|GOLLY|MINTO|FAI,HPB|AKELT|HUMLA|ZIPIX|ALMOT|HERLA|MKLUR|UNK|EDMON|VENCE|GAL|KUHZE|FECFO|CHOKK|NELTE|TAL|SATUE|REEBA|GOLLY|MINTO|FAI,21,21,true,true,,exact_match
T226,A,JOH FIDAL ROBES KLUNG GKN DOZEY PAXON DONEL BIG HUTIL DEYEP WUTGA HEXAX FYU,JOH|FIDAL|ROBES|KLUNG|GKN|DOZEY|PAXON|DONEL|BIG|HUTIL|DEYEP|WUTGA|HEXAX|FYU,JOH|FIDAL|ROBES|KLUNG|GKN|DOZEY|PAXON|DONEL|BIG|HUTIL|DEYEP|WUTGA|HEXAX|FYU,14,14,true,true,,exact_match
T227,A,SYA JANNT DEJJE BAERE INOTY HIMKI ALEUT MORDI GENFU BINAL WIXER CULTI ZAFPO BATTY GAMIC FEDGI WEZZL AMOTT BGQ SURES CAWIN LIBER GLOWS PERZO FAI PESGE JIFFS FIPSU CUGOB SIKLV SCC,SYA|JANNT|DEJJE|BAERE|INOTY|HIMKI|ALEUT|MORDI|GENFU|BINAL|WIXER|CULTI|ZAFPO|BATTY|GAMIC|FEDGI|WEZZL|AMOTT|BGQ|SURES|CAWIN|LIBER|GLOWS|PERZO|FAI|PESGE|JIFFS|FIPSU|CUGOB|SIKLV|SCC,SYA|JANNT|DEJJE|BAERE|INOTY|HIMKI|ALEUT|MORDI|GENFU|BINAL|WIXER|CULTI|ZAFPO|BATTY|GAMIC|FEDGI|WEZZL|AMOTT|BGQ|SURES|CAWIN|LIBER|GLOWS|PERZO|FAI|PESGE|JIFFS|FIPSU|CUGOB|SIKLV|SCC,31,31,true,true,,exact_match
T228,A,ZIKNI KUCYE RUFVY DENRO HPB ITKIC FAIRE OME JESZU GAITS TALYN HIKAX HIPIV ECIPI JAPKI PODKE CIRSU FAQIR BRW OOSIK YIGUF SCC ROCES,ZIKNI|KUCYE|RUFVY|DENRO|HPB|ITKIC|FAIRE|OME|JESZU|GAITS|TALYN|HIKAX|HIPIV|ECIPI|JAPKI|PODKE|CIRSU|FAQIR|BRW|OOSIK|YIGUF|SCC|ROCES,ZIKNI|KUCYE|RUFVY|DENRO|HPB|ITKIC|FAIRE|OME|JESZU|GAITS|TALYN|HIKAX|HIPIV|ECIPI|JAPKI|PODKE|CIRSU|FAQIR|BRW|OOSIK|YIGUF|SCC|ROCES,23,23,true,true,,exact_match
T229,A,FAI MINTO GOLLY REEBA SATUE TAL ELCON CENSE TOYKU HSL ATAGO DESOY WLK OTZ BERJO FIWWI JEGTU ECIPI SUGRE VANTY,FAI|MINTO|GOLLY|REEBA|SATUE|TAL|ELCON|CENSE|TOYKU|HSL|ATAGO|DESOY|WLK|OTZ|BERJO|FIWWI|JEGTU|ECIPI|SUGRE|VANTY,FAI|MINTO|GOLLY|REEBA|SATUE|TAL|ELCON|CENSE|TOYKU|HSL|ATAGO|DESOY|WLK|OTZ|BERJO|FIWWI|JEGTU|ECIPI|SUGRE|VANTY,20,20,true,true,,exact_match
T230,A,SPY GARRS AKN,SPY|GARRS|AKN,SPY|GARRS|AKN,3,3,true,true,,exact_match
T231,A,FAI HOBOM MOGFO ATYEB TAYWY MIPMY WLK OTZ,FAI|HOBOM|MOGFO|ATYEB|TAYWY|MIPMY|WLK|OTZ,FAI|HOBOM|MOGFO|ATYEB|TAYWY|MIPMY|WLK|OTZ,8,8,true,true,,exact_match
T232,A,BRW CHIPS BRONX AKUMY ZENLA OCOCU BTT HORAG CYCLE BRION LIVEN HESSE FAI KRNKL IMARE CUTUB RIVOR BIG MEYLE EGAXE CUGCA CIMGO ORT,BRW|CHIPS|BRONX|AKUMY|ZENLA|OCOCU|BTT|HORAG|CYCLE|BRION|LIVEN|HESSE|FAI|KRNKL|IMARE|CUTUB|RIVOR|BIG|MEYLE|EGAXE|CUGCA|CIMGO|ORT,BRW|CHIPS|BRONX|AKUMY|ZENLA|OCOCU|BTT|HORAG|CYCLE|BRION|LIVEN|HESSE|FAI|KRNKL|IMARE|CUTUB|RIVOR|BIG|MEYLE|EGAXE|CUGCA|CIMGO|ORT,23,23,true,true,,exact_match
T233,A,OTZ CIBDU TOMPY KORKY ENCOR BTT,OTZ|CIBDU|TOMPY|KORKY|ENCOR|BTT,OTZ|CIBDU|TOMPY|KORKY|ENCOR|BTT,6,6,true,true,,exact_match
T234,A,FAI WILTS TOLLO RAMPA,FAI|WILTS|TOLLO|RAMPA,FAI|WILTS|TOLLO|RAMPA,4,4,true,true,,exact_match
T235,A,FILEV FAQIR ZISDU WUPUV JATIL ZADRO SCC,FILEV|FAQIR|ZISDU|WUPUV|JATIL|ZADRO|SCC,FILEV|FAQIR|ZISDU|WUPUV|JATIL|ZADRO|SCC,7,7,true,true,,exact_match
T236,A,ENN RAMPA,ENN|RAMPA,ENN|RAMPA,2,2,true,true,,exact_match
T237,A,HOM WUXAN MDO,HOM|WUXAN|MDO,HOM|WUXAN|MDO,3,3,true,true,,exact_match
T238,A,RAMPA KANUT BTT,RAMPA|KANUT|BTT,RAMPA|KANUT|BTT,3,3,true,true,,exact_match
T239,C,PCANN SHANY AYUVO SAWES AXOSE TYGRR MILER KENTT SEMAN NIXBY FAYEZ KYLEE HANDE VLKNN NEGEE CORES CHOOK EXIST FOGUM SWIKI GANTT ICAVY GOINS,PCANN|SHANY|AYUVO|SAWES|AXOSE|TYGRR|MILER|KENTT|SEMAN|NIXBY|FAYEZ|KYLEE|HANDE|VLKNN|NEGEE|CORES|CHOOK|EXIST|FOGUM|SWIKI|GANTT|ICAVY|GOINS,PCANN|SHANY|AYUVO|SAWES|AXOSE|TYGRR|MILER|KENTT|SEMAN|NIXBY|FAYEZ|KYLEE|HANDE|VLKNN|NEGEE|CORES|CHOOK|EXIST|FOGUM|SWIKI|GANTT|ICAVY|GOINS,23,23,true,true,,exact_match
T240,A,BTT JEVUM TEGDE ZETUV DERIK MUKTU SHELO SCC,BTT|JEVUM|TEGDE|ZETUV|DERIK|MUKTU|SHELO|SCC,BTT|JEVUM|TEGDE|ZETUV|DERIK|MUKTU|SHELO|SCC,8,8,true,true,,exact_match
T241,A,LATCH FOROP AKCAR LVD ZIDRA,LATCH|FOROP|AKCAR|LVD|ZIDRA,LATCH|FOROP|AKCAR|LVD|ZIDRA,5,5,true,true,,exact_match
T242,A,BRW WUPUV LACIL KUTDE TADUE JOKAP WEGNO HUMUB TKA,BRW|WUPUV|LACIL|KUTDE|TADUE|JOKAP|WEGNO|HUMUB|TKA,BRW|WUPUV|LACIL|KUTDE|TADUE|JOKAP|WEGNO|HUMUB|TKA,9,9,true,true,,exact_match
T243,C,PUNGO HULIP ZOLMN,PUNGO|HULIP|ZOLMN,PUNGO|HULIP|ZOLMN,3,3,true,true,,exact_match
T244,A,OME CONFI JERDN CHEFF BETPE CEXIX CAKAD TED,OME|CONFI|JERDN|CHEFF|BETPE|CEXIX|CAKAD|TED,OME|CONFI|JERDN|CHEFF|BETPE|CEXIX|CAKAD|TED,8,8,true,true,,exact_match
T245,C,SLI POPPR SMO SILEX,SLI|POPPR|SMO|SILEX,SLI|POPPR|SMO|SILEX,4,4,true,true,,exact_match
T246,A,BRW GAL GEYHY MCG WINOR FFITZ FRIDA IVANN TED,BRW|GAL|GEYHY|MCG|WINOR|FFITZ|FRIDA|IVANN|TED,BRW|GAL|GEYHY|MCG|WINOR|FFITZ|FRIDA|IVANN|TED,9,9,true,true,,exact_match
T247,C,SLI POPPR SMO CANOG,SLI|POPPR|SMO|CANOG,SLI|POPPR|SMO|CANOG,4,4,true,true,,exact_match
T248,A,GAM QAYAQ ENM,GAM|QAYAQ|ENM,GAM|QAYAQ|ENM,3,3,true,true,,exact_match
T249,C,VNY SMO POPPR SLI,VNY|SMO|POPPR|SLI,VNY|SMO|POPPR|SLI,4,4,true,true,,exact_match
T250,A,GAM ULL QAYAQ BANAT AKELT BET,GAM|ULL|QAYAQ|BANAT|AKELT|BET,GAM|ULL|QAYAQ|BANAT|AKELT|BET,6,6,true,true,,exact_match
T251,C,FRNIA MOGYU FAM FTZ RIVRS KAYUU POOOL MERKR AGENS PICRA LMONT HAVOS ALO ZEZDU DDUCK FALAR KOETZ,FRNIA|MOGYU|FAM|FTZ|RIVRS|KAYUU|POOOL|MERKR|AGENS|PICRA|LMONT|HAVOS|ALO|ZEZDU|DDUCK|FALAR|KOETZ,FRNIA|MOGYU|FAM|FTZ|RIVRS|KAYUU|POOOL|MERKR|AGENS|PICRA|LMONT|HAVOS|ALO|ZEZDU|DDUCK|FALAR|KOETZ,17,17,true,true,,exact_match
T252,A,OME BAIME OTZ PERCI WARRT SCC,OME|BAIME|OTZ|PERCI|WARRT|SCC,OME|BAIME|OTZ|PERCI|WARRT|SCC,6,6,true,true,,exact_match
T254,C,SJT EVILE BREDY DILLO KALLA REEST DOWWD LETTA CLL HIPPS EAKES KAABA CREPO XAMPL KNZLY,SJT|EVILE|BREDY|DILLO|KALLA|REEST|DOWWD|LETTA|CLL|HIPPS|EAKES|KAABA|CREPO|XAMPL|KNZLY,SJT|EVILE|BREDY|DILLO|KALLA|REEST|DOWWD|LETTA|CLL|HIPPS|EAKES|KAABA|CREPO|XAMPL|KNZLY,15,15,true,true,,exact_match
T255,C,MVY FALMA PVD NOXSE EGAKE BLATT NELIE,MVY|FALMA|PVD|NOXSE|EGAKE|BLATT|NELIE,MVY|FALMA|PVD|NOXSE|EGAKE|BLATT|NELIE,7,7,true,true,,exact_match
T256,C,SAT CHURN SNIDR SEEDS WEMAR FFSSH WHAEL LDRET GLAND BLUMS BALIO MOLLR SBI TEMCO CIPDA GUSTI DAFLY,SAT|CHURN|SNIDR|SEEDS|WEMAR|FFSSH|WHAEL|LDRET|GLAND|BLUMS|BALIO|MOLLR|SBI|TEMCO|CIPDA|GUSTI|DAFLY,SAT|CHURN|SNIDR|SEEDS|WEMAR|FFSSH|WHAEL|LDRET|GLAND|BLUMS|BALIO|MOLLR|SBI|TEMCO|CIPDA|GUSTI|DAFLY,17,17,true,true,,exact_match
T257,C,VTU RZS MQO CALIS BLANC HNNTR DUBSS CAATE CHAWZ PORTE THHEO JAMIN PYE FREES NACKI ENI MERRI FLUEN PLYAT CCHUK CICRO SEGVE SCUPY OLJEK CIGCA FURNS NELLL MITUE JANAS ONP CUTEL EYCEH ILWAC ZEDAT WAVLU HQM COPLS WAPTO OZETT TOU,VTU|RZS|MQO|CALIS|BLANC|HNNTR|DUBSS|CAATE|CHAWZ|PORTE|THHEO|JAMIN|PYE|FREES|NACKI|ENI|MERRI|FLUEN|PLYAT|CCHUK|CICRO|SEGVE|SCUPY|OLJEK|CIGCA|FURNS|NELLL|MITUE|JANAS|ONP|CUTEL|EYCEH|ILWAC|ZEDAT|WAVLU|HQM|COPLS|WAPTO|OZETT|TOU,VTU|RZS|MQO|CALIS|BLANC|HNNTR|DUBSS|CAATE|CHAWZ|PORTE|THHEO|JAMIN|PYE|FREES|NACKI|ENI|MERRI|FLUEN|PLYAT|CCHUK|CICRO|SEGVE|SCUPY|OLJEK|CIGCA|FURNS|NELLL|MITUE|JANAS|ONP|CUTEL|EYCEH|ILWAC|ZEDAT|WAVLU|HQM|COPLS|WAPTO|OZETT|TOU,40,40,true,true,,exact_match
T258,C,MINIM CAYAP CRMSN ZIVMU DAYVS HEENA KYLEE CAMPP BRAVS LANGA CANER GRANT HUZER SMARR SINCA GLOSS MADDI JOTNO DACHA UGAAA HRTWL WILLS TAYSO RICHE HUNNY NATCH GMINI TWHYY LANHO ZEBUL MEYER BOUSY,MINIM|CAYAP|CRMSN|ZIVMU|DAYVS|HEENA|KYLEE|CAMPP|BRAVS|LANGA|CANER|GRANT|HUZER|SMARR|SINCA|GLOSS|MADDI|JOTNO|DACHA|UGAAA|HRTWL|WILLS|TAYSO|RICHE|HUNNY|NATCH|GMINI|TWHYY|LANHO|ZEBUL|MEYER|BOUSY,MINIM|CAYAP|CRMSN|ZIVMU|DAYVS|HEENA|KYLEE|CAMPP|BRAVS|LANGA|CANER|GRANT|HUZER|SMARR|SINCA|GLOSS|MADDI|JOTNO|DACHA|UGAAA|HRTWL|WILLS|TAYSO|RICHE|HUNNY|NATCH|GMINI|TWHYY|LANHO|ZEBUL|MEYER|BOUSY,32,32,true,true,,exact_match
